suite,question,answer,status,knowledge,correct_chain,wrong_option_warning
2026通州一模,第2题,B（①③）,选择题速记并入,文化自信；中华文化影响力；文化交流,外国游客探索中式生活方式，能支撑“中国开放中的文化自信”和“中华文化具有独特魅力、文化软实力提升”。,②把题意转向一般文化多样性和尊重不同民族文化，离开“中国生活方式吸引外国人”的主旨；④“普遍认可”扩大化。
2026通州一模,第3题,B（①④）,选择题速记并入,社会存在与社会意识；辩证否定；科学立法,耕地保护立法回应现实问题，体现社会意识源于社会存在并反作用于社会发展；在继承既有规范基础上完善草案，可对应辩证否定。,②把从个别经验到一般规则说成演绎推理，推理类型错；③说上层建筑“引领经济基础变革”过度且关系表述不当。
2026通州一模,第4题,A,选择题速记并入,系统优化；创新驱动；产业创新与制度创新协同,人工智能+、量子科技、具身智能以及产业创新与制度创新协同发力，提示用系统优化的科学思维方法推进创新驱动发展。,B把科技创新说成基本国策；C把智能经济夸成塑造新质生产力的核心；D硬套主要矛盾，材料没有要求抓“产业创新”这一个主要矛盾。
2026通州一模,第9题,B（①④）,选择题速记并入,文化交流互鉴；文化传播；价值观与生活方式对话,文化出海既是传播中华文化，也是价值观、生活方式的跨文化对话，有助于提升国家文化软实力。,②把“中华优秀传统文化”说成文化出海的核心载体，范围过窄；③“增强文化认同”主体容易泛化，题意更稳的是影响力和软实力。
2026通州一模,第12题,D（③④）,跨书边界：不入必修四正文，只作选必三提示,联想思维；创新思维,机器人春晚体现联想思维的畅想性和创新思维的独特性，属于《逻辑与思维》更直接的题。,①说超前思维具有确定性，表述错误；②把艺术表达说成必须依托科技实现突破，绝对化。
