suite_id,year,district,stage,suite_name,question_no,answer,answer_source,overview_sentence,wrong_option_sentences,question_excerpt,rubric_source,notes
2025_顺义_一模_024,2025,顺义,一模,2025顺义一模,10,A,/Users/wanglifei/Desktop/2025模拟题/2025各区一模/2025顺义一模/细则/细则.docx,在某公司员工邓某将其已怀孕的情况告知人事部门，公司于当日通知邓某调岗到外省，调岗理由为邓某 在一年内有两天的工作日志内容一致，主观认为存在日志作假情形。邓某表示愿意在产假结束后去外省上 班。公司以其“工作日志弄虚作假，不服从公司工作安排，严重缺乏职业道德”和依据《劳动法》第三条第 ……中，应选A，核心判断是“邓某可以特殊劳动保护的原则和调岗理由缺乏事实依据，依法要求公司履行合同”；其他项主要错在没有同时扣准主体关系、行为事实和法律后果。,B项不对在主体、行为、权利义务或适用条件没有扣准，因为“邓某虽未完整履行义务，但公司单方解约违背了协商一致的原则，构成实际违约”与题面事实或法律规则不匹配。；C项不对在纠纷解决程序或法律效力错位，因为“邓某须以双方自愿订立的有效仲裁协议为前提申请仲裁，这是解决争议的必经程序”与题面事实或法律规则不匹配。；D项不对在劳动关系或用人单位责任边界不准，因为“公司依据《劳动法》规定，认为邓某两天的日志作假是违反职业道德，故解约合法”与题面事实或法律规则不匹配。,10．某公司员工邓某将其已怀孕的情况告知人事部门，公司于当日通知邓某调岗到外省，调岗理由为邓某 在一年内有两天的工作日志内容一致，主观认为存在日志作假情形。邓某表示愿意在产假结束后去外省上 班。公司以其“工作日志弄虚作假，不服从公司工作安排，严重缺乏职业道德”和依据《劳动法》第三条第 二款的规定向邓某发送《解除劳动合同通知函》 。因此双方发生争议。 法条链接《中华人民共和国劳动法》第三条第二款规定：“劳动者应当完成劳动任务，提高职业 第4页/共18页 技能，执行劳动安全卫生规程，遵守劳动纪律和职业道德。” 第五十八条国家对女职工和未成年工实行特殊劳动保护。 对此，下列说法正确的是（ ） A．邓某可以特殊劳动保护的原则和调岗理由缺乏事实依据，依法要求公司履行合同 B．邓某虽未完整履行义务，但公司单方解约违背了协商一致的原则，构成实际违约 C．邓某须以双方自愿订立的有效仲裁协议为前提申请仲裁，这是解决争议的必经程序 D．公司依据《劳动法》规定，认为邓某两天的日志作假是违反职业道德，故解约合法,,
2025_顺义_一模_024,2025,顺义,一模,2025顺义一模,11,D,/Users/wanglifei/Desktop/2025模拟题/2025各区一模/2025顺义一模/细则/细则.docx,在卫先生在搭乘上行自动扶梯时，因帮助其前方的古阿姨站立不稳向后摔倒，古阿姨并未受伤，但卫先 生却因冲击力大且事发突然而摔倒受伤。事后，卫先生自行就医并支付了所有费用。相关部门拟对卫先生 颁发“见义勇为”荣誉证书，需古阿姨对救助情况进行确认却遭到拒绝，卫先生将古阿姨诉至法院。法院依 ……中，应选D，核心判断是“③④”；其他项主要错在没有同时扣准主体关系、行为事实和法律后果。,A项不对在主体、行为、权利义务或适用条件没有扣准，因为“①②”与题面事实或法律规则不匹配。；B项不对在主体、行为、权利义务或适用条件没有扣准，因为“①④”与题面事实或法律规则不匹配。；C项不对在主体、行为、权利义务或适用条件没有扣准，因为“②③”与题面事实或法律规则不匹配。,11．卫先生在搭乘上行自动扶梯时，因帮助其前方的古阿姨站立不稳向后摔倒，古阿姨并未受伤，但卫先 生却因冲击力大且事发突然而摔倒受伤。事后，卫先生自行就医并支付了所有费用。相关部门拟对卫先生 颁发“见义勇为”荣誉证书，需古阿姨对救助情况进行确认却遭到拒绝，卫先生将古阿姨诉至法院。法院依 法判决古阿姨补偿卫先生 7000 元。对此，下列看法正确的是（ ） ①卫先生因保护古阿姨民事权益使自己受到损害，故由侵权人古阿姨承担民事责任 ②法院综合考虑卫先生的受伤情况、救助行为及所起作用等实际情况确定赔偿责任 ③因保护古阿姨民事权益致使卫先生受到损害，可以由受益人古阿姨给予适当补偿 ④用法治力量扶起“跌倒的美德”，弘扬了见义勇为、知恩图报的中华民族传统美德 A．①② B．①④ C．②③ D．③④,,
2025_东城_二模_025,2025,东城,二模,2025东城二模,10,,,在司法助力旅游市场健康发展，就地解“游”愁。某地风景名胜区游客张某不顾警示逗猴喂猴，不慎被抓伤。 在接受工作人员救护后，张某拨打旅游环保法庭热线电话，要求景区管委会对其进行赔偿。旅游环保法庭 工作人员迅速到达现场，向双方当事人释法说理，开展调解工作。对此，下列说法正确的是中，本题暂不写死答案，因为 v2 未从可靠答案表锁定客观答案；先保留题面，等待答案源核验。,答案未锁定，暂不生成错项句。,10.司法助力旅游市场健康发展，就地解“游”愁。某地风景名胜区游客张某不顾警示逗猴喂猴，不慎被抓伤。 在接受工作人员救护后，张某拨打旅游环保法庭热线电话，要求景区管委会对其进行赔偿。旅游环保法庭 工作人员迅速到达现场，向双方当事人释法说理，开展调解工作。对此，下列说法正确的是 A.就地化解旅游纠纷，人民调解机制助力打造安心舒心的旅游环境 B.本案符合举证责任倒置情形，张某作为受害者无须提交任何证据 C.如果能证明张某在游览时没有尽到相应注意义务，景区就能免责 D.景区如果没有尽到安全保障义务，则须承担赔偿责任,,答案未从可靠答案表或逐题解析锁定
2025_东城_二模_025,2025,东城,二模,2025东城二模,11,,,在物权是最基本的财产权，国家依法保护物权。下列情形符合我国法律规定的是中，本题暂不写死答案，因为 v2 未从可靠答案表锁定客观答案；先保留题面，等待答案源核验。,答案未锁定，暂不生成错项句。,11.物权是最基本的财产权，国家依法保护物权。下列情形符合我国法律规定的是 A.李某作为土地承包经营权人，可以自主决定依法向他人流转土地经营权的方式 B.王某“一房二卖”，先签买房合同且入住的丁某可对抗已办完产权过户的刘某权利 C.张某向银行抵押贷款，没有按约定还款时，银行可以直接获得抵押财产所有权 D.付某将借来的电脑以远低于市场的价格卖给申某，因已交付，电脑归申某所有,,答案未从可靠答案表或逐题解析锁定
2025_东城_二模_025,2025,东城,二模,2025东城二模,12,,,在田某与所在公司就解除劳动关系、结清工资等事项达成一致，依法签订《解除劳动合同协议书》 。不久， 田某以对内容了解不足、存在误解为由提起劳动仲裁，请求撤销协议书，被劳动人事争议仲裁委员会驳回。 下列说法正确的是中，本题暂不写死答案，因为 v2 未从可靠答案表锁定客观答案；先保留题面，等待答案源核验。,答案未锁定，暂不生成错项句。,12.田某与所在公司就解除劳动关系、结清工资等事项达成一致，依法签订《解除劳动合同协议书》 。不久， 田某以对内容了解不足、存在误解为由提起劳动仲裁，请求撤销协议书，被劳动人事争议仲裁委员会驳回。 下列说法正确的是 ①在解除合同过程中发生争议，田某应先向劳动保障监察部门投诉 ②若田某不服裁决结果，有权向法院提起公诉解决与该公司的纠纷 ③协议经双方协商一致且田某签字确认，应视为田某真实意思表示 ④双方当事人均应遵循诚实信用原则，按照协议履行自身义务 A.①② B.①③ C.②④ D.③④,,答案未从可靠答案表或逐题解析锁定
2025_丰台_二模_026,2025,丰台,二模,2025丰台二模,9,,,在北京市首家街道劳动人事争议“一站式”调解中心成立。该调解中心在原有解纷中心的 基础上融入了公益 法律服务、工商联行业监管、工会联合调解等多元化功能，并设置了 巡回法庭、心理咨询室、争议调解室 等专业功能室。通过专业力量、社会资源、居民自 治，构建“大维权”“大调解”体系，为辖区内……中，本题暂不写死答案，因为 v2 未从可靠答案表锁定客观答案；先保留题面，等待答案源核验。,答案未锁定，暂不生成错项句。,9. 北京市首家街道劳动人事争议“一站式”调解中心成立。该调解中心在原有解纷中心的 基础上融入了公益 法律服务、工商联行业监管、工会联合调解等多元化功能，并设置了 巡回法庭、心理咨询室、争议调解室 等专业功能室。通过专业力量、社会资源、居民自 治，构建“大维权”“大调解”体系，为辖区内企业和劳动 者提供集成、高效、专业、 便捷的调解服务，实现“只进一扇门、最多跑一地、事务全办清”。该调解中心 ①提供“一站式”服务，促进 劳动关系和谐 ②整合“多元化”功能，创新劳动人事改革 ③构建“大维权”体系，维护居民自治权利 ④提供“集成式”服务，提升社会治理水平 A.①② B.①④ C.②③ D.②④,,答案未从可靠答案表或逐题解析锁定
2025_丰台_二模_026,2025,丰台,二模,2025丰台二模,10,,,在乙金融资产管理公司因甲投资公司未能按期还款，将其诉至金融法院。法庭上，甲公 司强烈表达了调 解意愿。经过调查，法官认为，如果简单裁判可能导致甲公司正在洽 谈的商业融资项目搁置，进而影响 公司的经营发展，甚至会导致成百上千名员工面临 失业风险。法官决定进行调解，经过 10 轮磋商，……中，本题暂不写死答案，因为 v2 未从可靠答案表锁定客观答案；先保留题面，等待答案源核验。,答案未锁定，暂不生成错项句。,10. 乙金融资产管理公司因甲投资公司未能按期还款，将其诉至金融法院。法庭上，甲公 司强烈表达了调 解意愿。经过调查，法官认为，如果简单裁判可能导致甲公司正在洽 谈的商业融资项目搁置，进而影响 公司的经营发展，甚至会导致成百上千名员工面临 失业风险。法官决定进行调解，经过 10 轮磋商，双方 当事人达成调解协议，约定两年 半时间还完全部债务。下列分析正确的是 ①案件事实清楚，债权债务关系清晰，诉讼是最有 效的解决方式 ②依据“谁主张谁举证”的原则，甲公司应举证其并未恶意违约 ③成功调解，有利于实现各方共赢，充分激发市场主体活力 ④司法为民，通过诉讼调解化解金融纠纷，传递了司法温度 A.①② B.①④ C.②③ D.③④ 第4页/共10页,,答案未从可靠答案表或逐题解析锁定
2025_丰台_二模_026,2025,丰台,二模,2025丰台二模,12,,,在食品可以免费试吃，科技成果也能“先尝后买”。某公司与某高校签订了专利实施许可 合同，公司可以在免 费使用专利一年后，根据使用情况再付费，这成为当地首个科技 成果“先使用后付费”案例。科技成果“先 使用后付费”中，本题暂不写死答案，因为 v2 未从可靠答案表锁定客观答案；先保留题面，等待答案源核验。,答案未锁定，暂不生成错项句。,12. 食品可以免费试吃，科技成果也能“先尝后买”。某公司与某高校签订了专利实施许可 合同，公司可以在免 费使用专利一年后，根据使用情况再付费，这成为当地首个科技 成果“先使用后付费”案例。科技成果“先 使用后付费” ①不同于食品“先吃后买”的思维方法，属于演绎推理 ②运用了逆向思维，有利于更好地解决科技应用问题 ③作为一种创新模式，是辩证思维动态性特征的体现 ④实现了科技成果与现实生产力之间的相互转化 A.①② B.①④ C.②③ D.③④,,答案未从可靠答案表或逐题解析锁定
2025_丰台_二模_026,2025,丰台,二模,2025丰台二模,14,,,在在《资本论》中，马克思以“商品”概念为逻辑起点，通过分析其内在矛盾引出“货 币”的概念。货币出现 以后，发展到一定阶段会转化为资本，在进一步发展中，由资 本而产生剩余价值，社会财富大量集中，必 然加剧劳动与资本之间的矛盾，促使社会 主义革命不可避免地到来。这表明中，本题暂不写死答案，因为 v2 未从可靠答案表锁定客观答案；先保留题面，等待答案源核验。,答案未锁定，暂不生成错项句。,14. 在《资本论》中，马克思以“商品”概念为逻辑起点，通过分析其内在矛盾引出“货 币”的概念。货币出现 以后，发展到一定阶段会转化为资本，在进一步发展中，由资 本而产生剩余价值，社会财富大量集中，必 然加剧劳动与资本之间的矛盾，促使社会 主义革命不可避免地到来。这表明 ①舍弃具体商品个性形成“商品”概念是从感性具体到思维抽象的过程 ②从“商品”到“货币”的推演完成了思维抽象上升到思维具体的历程 ③把握“资本”的本质需要以分析作为综合的先导逐一解剖认识对象 ④通过分析资本主义社会基本矛盾把握社会发展规律属于辩证思维方法 A.①② B.①④ C.②③ D.③④,,答案未从可靠答案表或逐题解析锁定
2025_昌平_二模_027,2025,昌平,二模,2025昌平二模,5,,,在一方薄纸，一把剪刀，于无声处交织共舞。中国剪纸，是我国劳动人民在民俗 生活中创造、流传、积累、享用的民间美术形式，它历经千年演变，呈现出不 同地域特色。南方剪纸细腻华丽，北方粗犷豪放，一张薄薄的纸片，剪出的是 迎祥纳福、吉祥如意。中国剪纸艺术中，本题暂不写死答案，因为 v2 未从可靠答案表锁定客观答案；先保留题面，等待答案源核验。,答案未锁定，暂不生成错项句。,5.一方薄纸，一把剪刀，于无声处交织共舞。中国剪纸，是我国劳动人民在民俗 生活中创造、流传、积累、享用的民间美术形式，它历经千年演变，呈现出不 同地域特色。南方剪纸细腻华丽，北方粗犷豪放，一张薄薄的纸片，剪出的是 迎祥纳福、吉祥如意。中国剪纸艺术 ①反映了中国深邃的传统思想，寄寓人们对美好生活的追求 ②是各族人民在生产劳动中创造的，是人类社会实践的产物 ③说明文化具有多样性，应当坚持“洋为中用” 、以我为主 ④是民族文化的结晶，植根于博大精深的中华传统文化之中 A．①② B．①③ C．②④ D．③④,,答案未从可靠答案表或逐题解析锁定
2025_昌平_二模_027,2025,昌平,二模,2025昌平二模,9,,,在商务部等5部门发布《手机、平板、智能手表（手环）购新补贴实施方案》 ，消费者购买上述数码产品， 可享受购新补贴。每人每类可补贴 1 件，每件最高不超过 500 元。关于实施购新补贴带来的影响，下列 传导路径正确的是中，本题暂不写死答案，因为 v2 未从可靠答案表锁定客观答案；先保留题面，等待答案源核验。,答案未锁定，暂不生成错项句。,9.商务部等5部门发布《手机、平板、智能手表（手环）购新补贴实施方案》 ，消费者购买上述数码产品， 可享受购新补贴。每人每类可补贴 1 件，每件最高不超过 500 元。关于实施购新补贴带来的影响，下列 传导路径正确的是 A.实施购新补贴→降低商品价格→扩大生产要素投入→激发市场主体活力 B.实施购新补贴→增加财政支出→降低生产成本→提高企业经济效益 C.实施购新补贴→鼓励超前消费→转变消费观念→提振消费信心 D.实施购新补贴→降低消费成本→刺激消费需求→拉动经济增长,,答案未从可靠答案表或逐题解析锁定
2025_昌平_二模_027,2025,昌平,二模,2025昌平二模,10,,,在国家邮政局发布2025年邮政快递业贴近民生七件实事。 一 加强村级寄递物流综合服务站建设，持续提高农村地区按址投递水平 二 强化快递包装标准落实，进一步提高标准化、循环化、减量化、无害化水平 三 持续推进邮件快件隐私运单应用，保护用户信息安全 四 组织举办邮政行业职业技能竞赛，不……中，本题暂不写死答案，因为 v2 未从可靠答案表锁定客观答案；先保留题面，等待答案源核验。,答案未锁定，暂不生成错项句。,10.国家邮政局发布2025年邮政快递业贴近民生七件实事。 一 加强村级寄递物流综合服务站建设，持续提高农村地区按址投递水平 二 强化快递包装标准落实，进一步提高标准化、循环化、减量化、无害化水平 三 持续推进邮件快件隐私运单应用，保护用户信息安全 四 组织举办邮政行业职业技能竞赛，不断提高从业人员素质 五 选取部分城市开展快递行业劳动合同制度试点，推动快递企业依法与从业人员签订劳动合同 六 持续提升快递服务质量，有效降低用户申诉率 七 巩固建制村、边境自然村通邮成果，进一步提升农村邮政服务质量 这说明国家邮政局 ①着力推动邮政快递服务更为便捷、更广覆盖、更加优质 ②以提高经济效益为重点，加快国有经济布局优化和结构调整 ③通过实施宏观调控，增强企业创新力、影响力、抗风险能力 ④优化服务，更好满足人民群众日益增长的美好生活用邮需要 A. ①③ B．①④ C．②③ D．②④,,答案未从可靠答案表或逐题解析锁定
2025_昌平_二模_027,2025,昌平,二模,2025昌平二模,14,,,在小王乘坐出租车出行，行驶途中该车与路旁隔离带发生碰撞致 小王重伤。经勘察取证，交通运输部门 认定，本次事故出租车司机应负全部责任。双方就赔偿事宜协商未果，小王将出租车司机诉至法院。关 于本案，下列说法正确的是中，本题暂不写死答案，因为 v2 未从可靠答案表锁定客观答案；先保留题面，等待答案源核验。,答案未锁定，暂不生成错项句。,14.小王乘坐出租车出行，行驶途中该车与路旁隔离带发生碰撞致 小王重伤。经勘察取证，交通运输部门 认定，本次事故出租车司机应负全部责任。双方就赔偿事宜协商未果，小王将出租车司机诉至法院。关 于本案，下列说法正确的是 ①出租车司机对于撞上隔离带的行为不存在主观故意，应减轻其赔偿责任 ②民事诉讼实行“谁主张，谁举证”的举证原则，司机不承担举证责任 ③出租车司机侵犯了小王的健康权和身体权，应承担侵权责任 ④小王和出租车司机的交通运输合同成立并生效，出租车司机承担违约责任 A. ①② B．①④ C．②③ D．③④,,答案未从可靠答案表或逐题解析锁定
2025_朝阳_二模_028,2025,朝阳,二模,2025朝阳二模,10,,,"在周某与 A 公司签订了《住宅装饰装修工程施工合同》,约定由 A 公司设计并施工。A 公司按照设计图施 工,拆改了承重墙 ,导致建筑承重结构变动 ,周某因此受到邻居指 责,并接到区住建委发来的 《责令改正通知 书》。周某额外花费 9 万元用于整改加固。随后,周某将 A 公司诉至法院……中，本题暂不写死答案，因为 v2 未从可靠答案表锁定客观答案；先保留题面，等待答案源核验。",答案未锁定，暂不生成错项句。,"10.周某与 A 公司签订了《住宅装饰装修工程施工合同》,约定由 A 公司设计并施工。A 公司按照设计图施 工,拆改了承重墙 ,导致建筑承重结构变动 ,周某因此受到邻居指 责,并接到区住建委发来的 《责令改正通知 书》。周某额外花费 9 万元用于整改加固。随后,周某将 A 公司诉至法院,要求 A 公司赔偿加固费、精神损失 费等。下列说法正确的是 ①周某与 A 公司订立的书面合同具有即时清结的特点,便于预防纠纷 ②根据公平原则,周某也应尽到注意义务,承担相应责任 ③周某选择请求 A 公司承担违约责任,不影响其请求精神损害赔偿 ④本案适用举证责任倒置,周某提出自诉后,由 A 公司负责举证 A.①② B.①④ C.②③ D.③④",,答案未从可靠答案表或逐题解析锁定
2025_海淀_二模_029,2025,海淀,二模,2025海淀二模,5,,,在2025年3月，《最高人民法院关于审理预付式消费民事纠纷案件适用法律若干问题的解释》发 布。某班学习小组查阅该解释后，梳理了以下内容。 •经营者收取预付款后终止营业，不按照约定兑付商品或提供服务，恶意逃避消费者申 请退款，需承担惩罚性赔偿责任。 •经营者控制合同文本或消费记录，无……中，本题暂不写死答案，因为 v2 未从可靠答案表锁定客观答案；先保留题面，等待答案源核验。,答案未锁定，暂不生成错项句。,5. 2025年3月，《最高人民法院关于审理预付式消费民事纠纷案件适用法律若干问题的解释》发 布。某班学习小组查阅该解释后，梳理了以下内容。 •经营者收取预付款后终止营业，不按照约定兑付商品或提供服务，恶意逃避消费者申 请退款，需承担惩罚性赔偿责任。 •经营者控制合同文本或消费记录，无正当理由拒不提交，法院根据消费者的主张认定 争议事实。 •商场作为场地出租者，若未要求经营者提供经营资质，导致消费者损失，需承担民 事责任。 对此，理解不正确的是 A. 惩罚性赔偿有助于预防恶意违约，引导经营者依法诚信经营 B. 消费者通常处于弱势地位，合理分配举证责任符合公平原则 C. 进一步明确预付式消费纠纷责任主体，助力消费者维护合法权益 D. 法律规定商场承担无过错侵权责任，促进市场健康发展,,答案未从可靠答案表或逐题解析锁定
2025_海淀_二模_029,2025,海淀,二模,2025海淀二模,6,,,在颜某与罗某婚后育有一女小罗，一家人共同生活。后因家庭矛盾未能得到有效调和，父亲罗某 将6岁的小罗强行带至外地生活。颜某请求法院裁定罗某将小罗送回原住所并禁止罗某抢夺、 藏匿未成年子女。对此案认识正确的是中，本题暂不写死答案，因为 v2 未从可靠答案表锁定客观答案；先保留题面，等待答案源核验。,答案未锁定，暂不生成错项句。,6. 颜某与罗某婚后育有一女小罗，一家人共同生活。后因家庭矛盾未能得到有效调和，父亲罗某 将6岁的小罗强行带至外地生活。颜某请求法院裁定罗某将小罗送回原住所并禁止罗某抢夺、 藏匿未成年子女。对此案认识正确的是 ①强行改变惯常生活可能对未成年子女的身心健康产生不利影响 ②法律保障未成年人的合法权益，应由小罗自行决定其居住地 ③罗某有权按照自己意愿改变子女居住地，法院需考虑其情感需求 ④父母对未成年子女的监护权平等，抢夺行为侵害了颜某的监护权 A. ①③ B. ①④ C. D. 24,/Users/wanglifei/Desktop/2025模拟题/2025各区二模/2025海淀二模/其他材料/2025届二模考试讲评0510.pdf,答案未从可靠答案表或逐题解析锁定
