audit_id,line,entry_type,section,source,year,district,stage,question,question_nature,evidence_grade_initial,grade_reason,bundle_path,bundle_state,trigger_hit_count_in_bundle,trigger_hit_terms_in_bundle,review_status,material,trigger,logic,suite_name,question_no_norm,covered_by_v6_question_number,present_by_suite_question_in_v7,quality_gate
V3-FW-0004,102,label4,一切从实际出发 / 实事求是,2025北京丰台高三（上）期末 第16题（丰台期末细则.pptx）,2025,丰台,期末,第16题,subjective,A,细则/阅卷/评分标准类显性来源,data/preprocessed_corpus/gpt_suite_bundles/2025各区模拟题__2025各区期末__2025丰台期末.md,found,1,一切从实际出发,rubric-source-review,“胸中有‘数’”要求在工作生活中做计划、定方案，在国家治理中看大数、看长远；评分标准把“数从哪里来”对应到实践、实际、规律、发挥主观能动性。,一切从实际出发 / 实事求是,“数”不是主观臆想出来的，而是对客观情况、统计数据、百分比和数量界限的把握。材料要求从实际情况中取得“数”，再依据实际确定方案，因此触发“一切从实际出发、实事求是”。,2025丰台期末,16,False,True,FAIL_NEEDS_FULL_PROMPT_AND_CONCRETE_LANDING
V3-FW-0014,143,label4,一切从实际出发 / 实事求是,2024北京东城高三二模 第16题（阅卷总结/16题/16题二模阅卷总结.docx、16题评分细则.pptx）,2024,东城,二模,第16题,subjective,A,细则/阅卷/评分标准类显性来源,data/preprocessed_corpus/gpt_suite_bundles/2024各区模拟题__2024各区二模__2024东城二模.md,found,1,一切从实际出发,rubric-source-review,桑基鱼塘立足农业实践、尊重人与自然发展规律，因地制宜保护利用，并随时代发展实现生态景观、产业融合、文化研学和乡村振兴结合。,一切从实际出发 / 实事求是,阅卷细则明确把“基于规律和实际（实践）证明桑基鱼塘的科学价值”列为哲学层面，并给出“尊重规律/一切从实际出发”。桑基鱼塘之所以“两千多岁仍未老”，不是因为抽象保留旧形式，而是始终立足当地水土、桑蚕鱼塘系统和现实乡村发展需要，因此应补入从实际出发栏目。,2024东城二模,16,False,True,FAIL_NEEDS_FULL_PROMPT_AND_CONCRETE_LANDING
V3-FW-0015,147,label4,一切从实际出发 / 实事求是,2025北京门头沟高三一模 第21题第（2）问（门头沟一模细则.doc）,2025,门头沟,一模,第21题第（2）问,subjective,A,细则/阅卷/评分标准类显性来源,data/preprocessed_corpus/gpt_suite_bundles/2025各区模拟题__2025各区一模__2025门头沟一模.md,found,1,主观与客观,rubric-source-review,门头沟服务首都发展大局，立足生态涵养功能定位和资源约束，关闭全部矿山，探索“绿水青山”向“金山银山”转化。,主观与客观、认识与实践具体的历史的统一,评分细则明确允许从“主观与客观、认识与实践具体的历史的统一”作答。材料不是抽象谈转型愿望，而是在首都功能定位、生态规律、产业基础和人民长远利益变化中选择发展路径，因此应作为从实际出发栏目的细化方法论保存。,2025门头沟一模,21,False,True,FAIL_NEEDS_FULL_PROMPT_AND_CONCRETE_LANDING
V3-FW-0026,193,label4,主观能动性 / 意识的能动作用,2025北京丰台高三（上）期末 第16题（丰台期末细则.pptx）,2025,丰台,期末,第16题,subjective,A,细则/阅卷/评分标准类显性来源,data/preprocessed_corpus/gpt_suite_bundles/2025各区模拟题__2025各区期末__2025丰台期末.md,found,2,主观能动性;意识的能动作用,rubric-source-review,评分标准把“数为何所用”指向做计划、定方案，以及认识对实践的反作用、意识的能动作用。,主观能动性 / 意识的能动作用,材料中的“胸中有数”不是停留在知道数据，而是把对数量、比例、界限的认识转化为计划、方案和治理行动。主体能够依据“数”进行预判、选择和安排，体现意识对实践活动的指导作用。,2025丰台期末,16,False,True,FAIL_NEEDS_FULL_PROMPT_AND_CONCRETE_LANDING
V3-FW-0038,243,label4,尊重客观规律与发挥主观能动性相结合,2024北京东城高三二模 第16题（阅卷总结/16题/16题二模阅卷总结.docx、16题评分细则.pptx）,2024,东城,二模,第16题,subjective,A,细则/阅卷/评分标准类显性来源,data/preprocessed_corpus/gpt_suite_bundles/2024各区模拟题__2024各区二模__2024东城二模.md,found,0,,rubric-source-review,桑基鱼塘遵循人与自然的发展规律，又通过保护利用、产业融合、文化研学等方式在新时代继续发挥作用。,尊重客观规律与发挥主观能动性相结合,细则把“尊重规律”放在哲学层面第一项。桑基鱼塘不是人任意设计的景观，而是在顺应水、桑、蚕、鱼、塘之间生态规律的基础上形成；新时代的保护开发又体现人对这一规律的主动利用和创新转化，因此应补入尊重规律与能动性栏目。,2024东城二模,16,False,True,FAIL_NEEDS_FULL_PROMPT_AND_CONCRETE_LANDING
V3-FW-0039,247,label4,尊重客观规律与发挥主观能动性相结合,2024北京西城高三二模 第18题第（4）问（高三模拟测试思想政治答案细则.docx）,2024,西城,二模,第18题第（4）问,subjective,A,细则/阅卷/评分标准类显性来源,data/preprocessed_corpus/gpt_suite_bundles/2024各区模拟题__2024各区二模__2024西城二模.md,found,1,按客观规律办事和发挥主观能动性,rubric-source-review,传统村落受到进城置业、移民搬迁冲击，文化和旅游部等机关要求以文化产业赋能乡村振兴，提升乡村审美水平和人文素养。,按客观规律办事和发挥主观能动性,答案细则明确列出“按客观规律办事和发挥主观能动性”。推动乡村文化振兴不能脱离村落形态、乡土文化传承规律和人口流动现实，也不能被动等待传统村落自然延续；要在尊重乡村文化生成和传播规律的基础上，通过审美教育、文化空间建设和产业赋能主动创造新活力。,2024西城二模,18,False,True,FAIL_NEEDS_FULL_PROMPT_AND_CONCRETE_LANDING
V3-FW-0041,257,label4,规律的客观性,2025北京丰台高三（上）期末 第16题（丰台期末细则.pptx）,2025,丰台,期末,第16题,subjective,B,评标或讲评角度清单，材料链需标整理者解释,data/preprocessed_corpus/gpt_suite_bundles/2025各区模拟题__2025各区期末__2025丰台期末.md,found,0,,angle-list-review,毛泽东强调“不懂得注意决定事物质量的数量界限，一切都是胸中无‘数’，结果就不能不犯错误”。,规律的客观性,数量界限不是人的主观偏好，而是事物发展中客观存在的“度”。忽视基本统计、主要百分比和数量界限，就会违背客观规律而犯错误，因此材料能稳定触发规律客观性。,2025丰台期末,16,False,True,FAIL_NEEDS_FULL_PROMPT_AND_CONCRETE_LANDING
V3-FW-0061,341,label4,联系的普遍性 / 联系的观点（总）,2024北京西城高三二模 第18题第（4）问（高三模拟测试思想政治答案细则.docx）,2024,西城,二模,第18题第（4）问,subjective,A,细则/阅卷/评分标准类显性来源,data/preprocessed_corpus/gpt_suite_bundles/2024各区模拟题__2024各区二模__2024西城二模.md,found,1,系统优化,rubric-source-review,传统村落形态多样，桥涵路街、亭阁庙宇、风俗习惯、方言乡音共同承载乡土气息；推动乡村文化振兴要把乡村美学、文化产业、特色书店、剧场、博物馆、美术馆、文创馆等要素统筹起来。,联系的观点 / 整体与部分 / 系统优化,答案细则明确把“系统优化”列为第18（4）问可用角度。乡村文化振兴不是单建一个文化场所，也不是只保护某一处传统建筑，而是把村落空间、民俗记忆、审美教育、文化产业和公共文化设施组织成整体，形成相互支撑的乡村文化生态。,2024西城二模,18,False,True,FAIL_NEEDS_FULL_PROMPT_AND_CONCRETE_LANDING
V3-FW-0062,345,label4,联系的普遍性 / 联系的观点（总）,2024北京丰台高三二模 第20题（丰台政治二模阅卷评标.docx）,2024,丰台,二模,第20题,subjective,B,评标或讲评角度清单，材料链需标整理者解释,data/preprocessed_corpus/gpt_suite_bundles/2024各区模拟题__2024各区二模__2024丰台二模.md,found,0,,angle-list-review,统筹发展和安全贯穿新民主主义革命、社会主义革命和建设、改革开放和中国特色社会主义现代化建设、中国特色社会主义新时代等不同历史时期，关系国家兴衰和历史走向。,联系的观点 / 系统观念,第20题为8分哲学等级题，评标说明可从认识论、辩证法等角度作答，水平4要求三个角度阐释较好或完整。材料把发展与安全、历史阶段与国家治理放进同一关系链中，说明不能孤立谈发展或孤立谈安全，而要在相互联系中统筹把握。,2024丰台二模,20,False,True,FAIL_NEEDS_FULL_PROMPT_AND_CONCRETE_LANDING
V3-FW-0071,388,label4,联系的普遍性 / 联系的观点（总）,2025北京丰台高三（上）期末 第16题（丰台期末细则.pptx）,2025,丰台,期末,第16题,subjective,A,细则/阅卷/评分标准类显性来源,data/preprocessed_corpus/gpt_suite_bundles/2025各区模拟题__2025各区期末__2025丰台期末.md,found,1,系统观念,rubric-source-review,评分标准把“数当如何定”指向系统优化、整体部分；示例答案要求坚持系统观念，立足整体把握相互关联的诸多要素。,整体与部分 / 系统观念,“胸中有数”不是只看一个孤立数字，而是看基本统计、主要百分比、数量界限及其在整体工作中的位置。材料强调做计划、定方案、国家治理看大数，说明要从整体结构中理解局部数据的意义。,2025丰台期末,16,False,True,FAIL_NEEDS_FULL_PROMPT_AND_CONCRETE_LANDING
V3-FW-0072,392,label4,联系的普遍性 / 联系的观点（总）,2025北京朝阳高三（上）期末 第22题（朝阳期末评标.pdf扫描页读图核定）,2025,朝阳,期末,第22题,subjective,A,细则/阅卷/评分标准类显性来源,data/preprocessed_corpus/gpt_suite_bundles/2025各区模拟题__2025各区期末__2025朝阳期末.md,found,1,系统观念,rubric-source-review,细则要求坚持系统观念，为整体性推进党和国家各项事业提供科学思想方法。,整体与部分 / 系统观念,谱写马克思主义中国化时代化新篇章，不是某个领域单点更新，而是服务党和国家事业整体推进。评分细则把“系统观念”设为给分点，说明材料要求从整体性、结构性和协同性上把握理论创新的作用。,2025朝阳期末,22,False,True,FAIL_NEEDS_FULL_PROMPT_AND_CONCRETE_LANDING
V3-FW-0079,420,label4,联系的普遍性 / 联系的观点（总）,2024北京东城高三二模 第16题（阅卷总结/16题/16题二模阅卷总结.docx、16题评分细则.pptx）,2024,东城,二模,第16题,subjective,A,细则/阅卷/评分标准类显性来源,data/preprocessed_corpus/gpt_suite_bundles/2024各区模拟题__2024各区二模__2024东城二模.md,found,2,联系的观点;系统优化,rubric-source-review,桑基鱼塘把桑、蚕、鱼、塘、生态景观、产业融合、乡村振兴和文化研学组织成一个相互支撑的系统。,联系的观点 / 整体与部分 / 系统优化,阅卷细则明确写到“事物是普遍联系的”“桑基鱼塘各要素构成了相互联系的系统”，并在评分口径中列出“联系的观点、立足整体、系统优化”。材料的关键不在单个鱼塘，而在多要素循环共生、功能协同，因此应补入联系与系统栏目。,2024东城二模,16,False,True,FAIL_NEEDS_FULL_PROMPT_AND_CONCRETE_LANDING
V3-FW-0087,455,label4,发展的观点 / 发展的普遍性,2025北京朝阳高三（上）期末 第22题（朝阳期末评标.pdf扫描页读图核定）,2025,朝阳,期末,第22题,subjective,A,细则/阅卷/评分标准类显性来源,data/preprocessed_corpus/gpt_suite_bundles/2025各区模拟题__2025各区期末__2025朝阳期末.md,found,1,发展的观点,rubric-source-review,“实践没有止境，理论创新也没有止境”，习近平新时代中国特色社会主义思想必须长期坚持并不断丰富发展。,发展的观点,材料直接把理论创新写成不断推进的历史过程，说明马克思主义中国化时代化不是一次完成，而是随着时代课题和实践要求持续发展。评分细则中的“坚持用发展的观点看待理论创新”正由此触发。,2025朝阳期末,22,False,True,FAIL_NEEDS_FULL_PROMPT_AND_CONCRETE_LANDING
V3-FW-0091,471,label4,发展的观点 / 发展的普遍性,2024北京东城高三二模 第16题（阅卷总结/16题/16题二模阅卷总结.docx、16题评分细则.pptx）,2024,东城,二模,第16题,subjective,A,细则/阅卷/评分标准类显性来源,data/preprocessed_corpus/gpt_suite_bundles/2024各区模拟题__2024各区二模__2024东城二模.md,found,1,发展的观点,rubric-source-review,桑基鱼塘穿越千年，随时代发展不断创新，从传统农业系统延展到生态景观、产业融合、乡村振兴和文化研学。,发展的观点,题目问“两千多岁的桑基鱼塘为何仍未老”，本身就是发展过程题。阅卷细则把“基于辩证法说明桑基鱼塘的发展过程”列为哲学层面，明确可用发展的观点。材料要求看到传统系统不是静止保存，而是在新时代不断生成新功能和新价值。,2024东城二模,16,False,True,FAIL_NEEDS_FULL_PROMPT_AND_CONCRETE_LANDING
V3-FW-0096,493,label4,发展的观点 / 发展的普遍性,2025北京丰台高三（上）期末 第16题（丰台期末细则.pptx）,2025,丰台,期末,第16题,subjective,B,评标或讲评角度清单，材料链需标整理者解释,data/preprocessed_corpus/gpt_suite_bundles/2025各区模拟题__2025各区期末__2025丰台期末.md,found,1,适度原则,angle-list-review,毛泽东强调任何质量都表现为一定的数量，没有数量也就没有质量；要注意基本统计、主要百分比和决定事物质量的数量界限。,量变与质变 / 适度原则,材料直接把“质量”和“数量界限”并置，要求学生看到数量变化对事物性质的影响。基本统计和百分比是量的把握，数量界限对应“度”，不懂“数”就容易越过界限而犯错，因此稳定触发量变质变及适度原则。,2025丰台期末,16,False,True,FAIL_NEEDS_FULL_PROMPT_AND_CONCRETE_LANDING
V3-FW-0107,541,label4,发展的观点 / 发展的普遍性,2024北京东城高三二模 第16题（阅卷总结/16题/16题二模阅卷总结.docx、16题评分细则.pptx）,2024,东城,二模,第16题,subjective,A,细则/阅卷/评分标准类显性来源,data/preprocessed_corpus/gpt_suite_bundles/2024各区模拟题__2024各区二模__2024东城二模.md,found,1,辩证否定,rubric-source-review,桑基鱼塘保留传统生态农业系统的科学内核，同时通过产业融合、生态景观、文化研学等新形式服务乡村振兴。,辩证否定 / 守正创新,阅卷细则在辩证法层面列出“辩证否定等”。桑基鱼塘“未老”的原因不是原封不动，而是在保留生态循环和农业智慧的基础上更新功能形态，实现传统农业资源的创造性利用，因此可稳定补入辩证否定栏目。,2024东城二模,16,False,True,FAIL_NEEDS_FULL_PROMPT_AND_CONCRETE_LANDING
V3-FW-0130,636,label4,矛盾就是对立统一,2024北京丰台高三二模 第20题（丰台政治二模阅卷评标.docx）,2024,丰台,二模,第20题,subjective,B,评标或讲评角度清单，材料链需标整理者解释,data/preprocessed_corpus/gpt_suite_bundles/2024各区模拟题__2024各区二模__2024丰台二模.md,found,0,,angle-list-review,统筹发展和安全要求在不同时期处理革命与生产、国防与建设、改革发展稳定、国家安全与发展全局之间的关系。,矛盾就是对立统一 / 全面观点,评标说明第20题可从辩证法角度作答，水平4要求多个角度阐释完整。材料中的发展与安全不是二选一：安全为发展提供条件，发展又为安全提供基础；片面强调任何一端都会影响国家兴衰，因此应补入矛盾对立统一和全面观点。,2024丰台二模,20,False,True,FAIL_NEEDS_FULL_PROMPT_AND_CONCRETE_LANDING
V3-FW-0134,656,label4,矛盾就是对立统一,2025北京丰台高三（上）期末 第16题（丰台期末细则.pptx）,2025,丰台,期末,第16题,subjective,A,细则/阅卷/评分标准类显性来源,data/preprocessed_corpus/gpt_suite_bundles/2025各区模拟题__2025各区期末__2025丰台期末.md,found,1,矛盾的特殊性,rubric-source-review,评分标准要求分析矛盾的特殊性，精准分析工作中的“数”。,矛盾的特殊性 / 具体问题具体分析,不同工作、不同治理场景中的“数”并不相同，不能用一个固定数字机械套用。材料强调基本统计、主要百分比、计划方案，说明要根据具体问题确定具体数量界限和方案，因此触发具体问题具体分析。,2025丰台期末,16,False,True,FAIL_NEEDS_FULL_PROMPT_AND_CONCRETE_LANDING
V3-FW-0135,660,label4,矛盾就是对立统一,2025北京朝阳高三（上）期末 第22题（朝阳期末评标.pdf扫描页读图核定）,2025,朝阳,期末,第22题,subjective,A,细则/阅卷/评分标准类显性来源,data/preprocessed_corpus/gpt_suite_bundles/2025各区模拟题__2025各区期末__2025朝阳期末.md,found,1,具体问题具体分析,rubric-source-review,评分细则要求坚持问题导向，不断提出真正解决问题的新理念新思路新办法；坚持具体问题具体分析，回答重大时代课题。,矛盾的特殊性 / 具体问题具体分析,马克思主义中国化时代化不是抽象重复一般原理，而是面对国内外形势新变化、实践新要求和党治国理政的重大时代课题作出具体回答。材料以“新变化、新要求、重大时代课题”为触发点，导向具体问题具体分析。,2025朝阳期末,22,False,True,FAIL_NEEDS_FULL_PROMPT_AND_CONCRETE_LANDING
V3-FW-0139,676,label4,矛盾就是对立统一,2024北京东城高三二模 第16题（阅卷总结/16题/16题二模阅卷总结.docx、16题评分细则.pptx）,2024,东城,二模,第16题,subjective,A,细则/阅卷/评分标准类显性来源,data/preprocessed_corpus/gpt_suite_bundles/2024各区模拟题__2024各区二模__2024东城二模.md,found,1,具体问题具体分析,rubric-source-review,桑基鱼塘因地制宜形成，并在新时代根据当地生态、产业和文化资源进行保护利用。,具体问题具体分析,细则在“事物发展有其规律”后括注“坚持一切从实际出发/具体问题具体分析”，讲评逻辑也把“因地制宜”列为情境抓手。桑基鱼塘的价值必须放回具体自然条件、生产方式和乡村振兴场景中理解，因此应补入具体问题具体分析栏目。,2024东城二模,16,False,True,FAIL_NEEDS_FULL_PROMPT_AND_CONCRETE_LANDING
V3-FW-0140,680,label4,矛盾就是对立统一,2024北京西城高三二模 第18题第（4）问（高三模拟测试思想政治答案细则.docx）,2024,西城,二模,第18题第（4）问,subjective,A,细则/阅卷/评分标准类显性来源,data/preprocessed_corpus/gpt_suite_bundles/2024各区模拟题__2024各区二模__2024西城二模.md,found,1,矛盾的特殊性,rubric-source-review,我国传统村落从豫西地坑院到湘西吊脚楼、客家围屋、开平碉楼，形态多样，风俗习惯和方言乡音各具特色。,矛盾的特殊性 / 具体问题具体分析,答案细则明确列出“矛盾特殊性”。推动乡村文化振兴不能用同一个景观模板改造所有村落，而要看到不同村落在空间形态、历史记忆、民俗传统和现实冲击上的差异，因村制宜地保护、转化和发展。,2024西城二模,18,False,True,FAIL_NEEDS_FULL_PROMPT_AND_CONCRETE_LANDING
V3-FW-0148,728,label4,矛盾就是对立统一,2024北京朝阳高三一模 第16题（2024朝阳一模政治评标.pptx）,2024,朝阳,一模,第16题,subjective,A,细则/阅卷/评分标准类显性来源,data/preprocessed_corpus/gpt_suite_bundles/2024各区模拟题__2024各区一模__2024朝阳一模.md,found,0,,rubric-source-review,“接受人民监督”主要依靠人民群众和民主制度，从党外施加影响；“勇于自我革命”强调党自身全面从严治党、自我净化、自我完善、自我革新、自我提高。,内外因 / 矛盾分析法,评标细则把“外因”和“内因”作为可给分角度。两者都服务党跳出历史周期率，但作用来源不同：人民监督是外部推动，自我革命是内部动力。材料要求区分二者又说明其联系，因此应把内外因作为矛盾分析中的显性挂点。,2024朝阳一模,16,False,True,FAIL_NEEDS_FULL_PROMPT_AND_CONCRETE_LANDING
V3-FW-0150,739,label4,实践与认识（总）,2025北京丰台高三（上）期末 第16题（丰台期末细则.pptx）,2025,丰台,期末,第16题,subjective,A,细则/阅卷/评分标准类显性来源,data/preprocessed_corpus/gpt_suite_bundles/2025各区模拟题__2025各区期末__2025丰台期末.md,found,1,实践与认识,rubric-source-review,评分标准把“数从哪里来”对应到实践，并指出“数”不是凭空而来，而是通过实践、调查研究获得。,实践与认识,材料先追问“数从哪里来”，再把答案落到实践和实际调查，说明对情况和问题的数量认识必须来自实践。随后又要求用“数”做计划、定方案，形成实践与认识双向作用的链条。,2025丰台期末,16,False,True,FAIL_NEEDS_FULL_PROMPT_AND_CONCRETE_LANDING
V3-FW-0151,743,label4,实践与认识（总）,2025北京朝阳高三（上）期末 第22题（朝阳期末评标.pdf扫描页读图核定）,2025,朝阳,期末,第22题,subjective,A,细则/阅卷/评分标准类显性来源,data/preprocessed_corpus/gpt_suite_bundles/2025各区模拟题__2025各区期末__2025朝阳期末.md,found,0,,rubric-source-review,材料写“实践没有止境，理论创新也没有止境”，评分细则要求坚持实践观点，推进实践基础上的理论创新，以新的理论指导新的实践。,实践与认识,理论创新的起点是国内外形势新变化和实践新要求，形成的新理论又要指导新的实践。材料完整呈现“实践提出问题—理论创新回应—理论再指导实践”的链条，因此稳定触发实践与认识关系。,2025朝阳期末,22,False,True,FAIL_NEEDS_FULL_PROMPT_AND_CONCRETE_LANDING
V3-FW-0159,777,label4,实践是认识的基础,2025北京丰台高三（上）期末 第16题（丰台期末细则.pptx）,2025,丰台,期末,第16题,subjective,B,评标或讲评角度清单，材料链需标整理者解释,data/preprocessed_corpus/gpt_suite_bundles/2025各区模拟题__2025各区期末__2025丰台期末.md,found,0,,angle-list-review,“胸中有‘数’”中的“数”要通过实践获得，只有关注实际进行调查研究，才能获得对“数”的正确认识。,实践是认识的基础,“数”作为对情况和问题的认识，不是头脑中自生的，而是在调查研究和治理实践中形成。材料把“数从哪里来”直接落到实践，构成实践是认识来源的稳定触发。,2025丰台期末,16,False,True,FAIL_NEEDS_FULL_PROMPT_AND_CONCRETE_LANDING
V3-FW-0176,849,label4,认识发展原理,2024北京丰台高三二模 第20题（丰台政治二模阅卷评标.docx）,2024,丰台,二模,第20题,subjective,B,评标或讲评角度清单，材料链需标整理者解释,data/preprocessed_corpus/gpt_suite_bundles/2024各区模拟题__2024各区二模__2024丰台二模.md,found,0,,angle-list-review,我们党在不同历史时期都高度重视统筹发展和安全，革命、建设、改革和新时代的实践反复证明，能否统筹好发展和安全关系国家兴衰、历史走向。,认识发展原理 / 实践推动认识深化,评标说明可从认识论角度作答。材料不是抽象给出一个结论，而是用不同历史时期的实践经验说明党对发展安全关系的认识不断深化；“历史反复证明”提示认识来源于实践检验，并随治国理政实践推进而发展。,2024丰台二模,20,False,True,FAIL_NEEDS_FULL_PROMPT_AND_CONCRETE_LANDING
V3-FW-0178,859,label4,认识对实践的反作用,2025北京丰台高三（上）期末 第16题（丰台期末细则.pptx）,2025,丰台,期末,第16题,subjective,B,评标或讲评角度清单，材料链需标整理者解释,data/preprocessed_corpus/gpt_suite_bundles/2025各区模拟题__2025各区期末__2025丰台期末.md,found,1,认识对实践的反作用,angle-list-review,在工作生活中做计划、定方案，在国家治理中看大数、看长远，都离不开“胸中有数”的工作方法。,认识对实践的反作用,掌握“数”不是为了停留在认识层面，而是为了减少决策和指导中的盲目性与随意性。材料把数量认识和计划方案、国家治理连接起来，说明正确认识能反过来指导实践。,2025丰台期末,16,False,True,FAIL_NEEDS_FULL_PROMPT_AND_CONCRETE_LANDING
