audit_id,line,entry_type,section,source,year,district,stage,question,question_nature,evidence_grade_initial,grade_reason,bundle_path,bundle_state,trigger_hit_count_in_bundle,trigger_hit_terms_in_bundle,review_status,material,trigger,logic,suite_name,question_no_norm,covered_by_v6_question_number,present_by_suite_question_in_v7,quality_gate
V3-FW-0179,863,label4,认识对实践的反作用,2025北京朝阳高三（上）期末 第22题（朝阳期末评标.pdf扫描页读图核定）,2025,朝阳,期末,第22题,subjective,A,细则/阅卷/评分标准类显性来源,data/preprocessed_corpus/gpt_suite_bundles/2025各区模拟题__2025各区期末__2025朝阳期末.md,found,0,,rubric-source-review,评分细则要求推进实践基础上的理论创新，以新的理论指导新的实践。,认识对实践的反作用,习近平新时代中国特色社会主义思想作为重大理论创新，不只是解释时代课题，还要指导党和国家事业发展。材料明确从“理论创新”转向“指导新的实践”，因此稳定触发认识对实践的反作用。,2025朝阳期末,22,False,True,FAIL_NEEDS_FULL_PROMPT_AND_CONCRETE_LANDING
V3-FW-0189,912,label4,改革,2025北京石景山高三一模 第21题（石景山 高三政治评分细则.doc）,2025,石景山,一模,第21题,subjective,A,细则/阅卷/评分标准类显性来源,data/preprocessed_corpus/gpt_suite_bundles/2025各区模拟题__2025各区一模__2025石景山一模.md,found,1,改革的实质,rubric-source-review,进一步全面深化改革进入攻坚期和深水区，党坚持“不立不破、先立后破”，破除旧观念旧体制，确立新理念新机制，推动制度更加成熟定型。,改革的实质 / 社会基本矛盾运动,评分细则把改革实质、全面深化改革总目标和社会发展规律列为可用模块。进一步全面深化改革不是抽象口号，而是通过调整不适应生产力发展的生产关系、完善不适应经济基础的上层建筑，把制度优势转化为治理效能，因此应正式补入改革栏目。,2025石景山一模,21,False,True,FAIL_NEEDS_FULL_PROMPT_AND_CONCRETE_LANDING
V3-FW-0190,916,label4,改革,2024北京东城高三一模 第18题第（1）问（2024东城一模政治评标1.pptx）,2024,东城,一模,第18题第（1）问,subjective,B,评标或讲评角度清单，材料链需标整理者解释,data/preprocessed_corpus/gpt_suite_bundles/2024各区模拟题__2024各区一模__2024东城一模.md,found,1,改革,angle-list-review,北京出台科研项目经费“包干制”、技术攻关“揭榜挂帅”等政策，推动科技体制改革并服务新质生产力发展。,改革 / 生产关系适应生产力 / 上层建筑反作用,评标 PPT 明确指出科技体制改革推动形成与新质生产力相适应的生产关系，以体制机制创新带动科技创新。材料表明改革的落点在于解决生产力发展对制度机制提出的新要求，因此改革栏目不能继续空置。,2024东城一模,18,False,True,FAIL_NEEDS_FULL_PROMPT_AND_CONCRETE_LANDING
V3-FW-0193,930,label4,人民群众,2025北京丰台高三（上）期末 第17题（丰台期末细则.pptx）,2025,丰台,期末,第17题,subjective,A,细则/阅卷/评分标准类显性来源,data/preprocessed_corpus/gpt_suite_bundles/2025各区模拟题__2025各区期末__2025丰台期末.md,found,2,人民群众是历史的创造者;群众观点,rubric-source-review,“人民城市人民建，人民城市为人民”，评分细则在理论层面给出“人民群众是历史的创造者/群众观点”等角度；材料写居民参与社区微更新、市民众创空间、民间湖长参与生态保护和监督。,人民群众是历史的创造者 / 群众观点,材料不是只写政府建设城市，而是反复强调人民参与规划、建设和治理。城市发展依靠人民、服务人民，评分细则也把人民主体地位设为给分点，因此稳定触发人民群众观点。,2025丰台期末,17,False,True,FAIL_NEEDS_FULL_PROMPT_AND_CONCRETE_LANDING
V3-FW-0195,938,label4,人民群众,2025北京朝阳高三（上）期末 第22题（朝阳期末评标.pdf扫描页读图核定）,2025,朝阳,期末,第22题,subjective,A,细则/阅卷/评分标准类显性来源,data/preprocessed_corpus/gpt_suite_bundles/2025各区模拟题__2025各区期末__2025朝阳期末.md,found,2,人民群众;人民立场,rubric-source-review,评分细则要求坚持人民至上，站稳人民立场、把握人民愿望、尊重人民创造、集中人民智慧。,人民群众 / 人民立场,马克思主义中国化时代化要回答党和国家事业发展的重大课题，而这些课题最终指向人民利益和人民实践。细则把人民立场、人民愿望、人民创造和人民智慧连成一组，说明理论创新必须以人民群众为主体和根基。,2025朝阳期末,22,False,True,FAIL_NEEDS_FULL_PROMPT_AND_CONCRETE_LANDING
V3-FW-0199,954,label4,人民群众,2024北京东城高三二模 第16题（阅卷总结/16题/16题二模阅卷总结.docx、16题评分细则.pptx）,2024,东城,二模,第16题,subjective,A,细则/阅卷/评分标准类显性来源,data/preprocessed_corpus/gpt_suite_bundles/2024各区模拟题__2024各区二模__2024东城二模.md,found,2,人民群众;群众观点,rubric-source-review,桑基鱼塘来自群众生产实践，又通过乡村振兴、文化研学、生态保护等方式服务人民福祉，满足人民对美好生活的追求。,人民群众 / 群众观点,阅卷总结明确写到“人民是历史的创造者，是社会的主体”，评分口径列出“人民主体地位、群众观点”。桑基鱼塘千年未老，不只是因为技术系统有效，更因为它产生于人民实践、服务人民生活并在人民需要中延续发展，因此应补入人民群众栏目。,2024东城二模,16,False,True,FAIL_NEEDS_FULL_PROMPT_AND_CONCRETE_LANDING
V3-FW-0200,958,label4,人民群众,2024北京西城高三二模 第18题第（4）问（高三模拟测试思想政治答案细则.docx）,2024,西城,二模,第18题第（4）问,subjective,A,细则/阅卷/评分标准类显性来源,data/preprocessed_corpus/gpt_suite_bundles/2024各区模拟题__2024各区二模__2024西城二模.md,found,1,人民群众的历史作用,rubric-source-review,推动乡村文化振兴要提升审美水平和人文素养，让欣赏美、追求美、塑造美成为乡村文明新风尚；传统村落保护与活化要面向乡村居民真实生活和文明建设。,人民群众的历史作用 / 群众观点,答案细则把“人民群众的历史作用”列为第18（4）问可用角度。材料中的乡村美育、公共文化空间和文化产业不是为景观本身服务，而是要激发乡村主体参与、改善群众文化生活、形成文明新风尚，因此稳定触发人民群众观点。,2024西城二模,18,False,True,FAIL_NEEDS_FULL_PROMPT_AND_CONCRETE_LANDING
V3-FW-0211,1005,label4,价值观的导向作用,2025北京丰台高三（上）期末 第16题（丰台期末细则.pptx）,2025,丰台,期末,第16题,subjective,A,细则/阅卷/评分标准类显性来源,data/preprocessed_corpus/gpt_suite_bundles/2025各区模拟题__2025各区期末__2025丰台期末.md,found,0,,rubric-source-review,评分标准把“数为何所用”关联到正确价值观，强调用“数”减少决策与指导中的盲目性和随意性。,价值观的导向作用,“胸中有数”最终服务于什么目标，决定了数据和方案如何被使用。材料把“数”的运用与国家治理、工作生活中的计划方案联系起来，说明正确价值目标会引导认识和行动方向。,2025丰台期末,16,False,True,FAIL_NEEDS_FULL_PROMPT_AND_CONCRETE_LANDING
V3-FW-0213,1013,label4,价值观的导向作用,2025北京朝阳高三（上）期末 第22题（朝阳期末评标.pdf扫描页读图核定）,2025,朝阳,期末,第22题,subjective,A,细则/阅卷/评分标准类显性来源,data/preprocessed_corpus/gpt_suite_bundles/2025各区模拟题__2025各区期末__2025朝阳期末.md,found,0,,rubric-source-review,评分细则要求坚持人民至上、自信自立、胸怀天下，借鉴吸收人类一切优秀文明成果。,价值观的导向作用,推进理论创新要站在什么立场、坚持什么价值方向，决定理论创新的性质和作用。人民至上、自信自立、胸怀天下共同构成价值导向，指引马克思主义中国化时代化服务中国实践和人类文明进步。,2025朝阳期末,22,False,True,FAIL_NEEDS_FULL_PROMPT_AND_CONCRETE_LANDING
V3-FW-0216,1025,label4,价值观的导向作用,2024北京东城高三二模 第16题（阅卷总结/16题/16题二模阅卷总结.docx、16题评分细则.pptx）,2024,东城,二模,第16题,subjective,A,细则/阅卷/评分标准类显性来源,data/preprocessed_corpus/gpt_suite_bundles/2024各区模拟题__2024各区二模__2024东城二模.md,found,0,,rubric-source-review,桑基鱼塘符合社会发展规律和最广大人民根本利益，促进经济与生态发展，提高人民生活水平。,价值观的导向作用 / 正确价值观,阅卷总结明确写到“科学的价值观符合社会发展规律和最广大人民的根本利益”，评分口径要求用群众观点及价值观体现科学价值观的标准和作用。桑基鱼塘之所以有持久生命力，是因为其价值取向兼顾生态、经济和人民福祉，因此应补入价值观导向栏目。,2024东城二模,16,False,True,FAIL_NEEDS_FULL_PROMPT_AND_CONCRETE_LANDING
V3-FW-0223,1055,label4,价值判断与价值选择,2024北京西城高三二模 第18题第（4）问（高三模拟测试思想政治答案细则.docx）,2024,西城,二模,第18题第（4）问,subjective,A,细则/阅卷/评分标准类显性来源,data/preprocessed_corpus/gpt_suite_bundles/2024各区模拟题__2024各区二模__2024西城二模.md,found,0,,rubric-source-review,在进城置业、移民搬迁冲击传统村落的背景下，政策引导把传统村落保护、乡村美育、文化产业和公共文化空间建设结合起来，推动乡村文化振兴。,价值判断与价值选择,答案细则把“认识世界与价值选择”列为可作答角度。材料要求判断传统村落的价值不只是居住形态或旅游资源，而是历史文化、乡村生活和公共文明的承载体；选择保护、活化、产业融合和美育路径，体现正确价值判断和价值选择。,2024西城二模,18,False,True,FAIL_NEEDS_FULL_PROMPT_AND_CONCRETE_LANDING
V3-FW-0300,1367,table,本轮选择题进展（2025石景山一模三线闭环）,2025北京石景山高三一模 第21题,2025,石景山,一模,第21题,subjective,A,细则/阅卷/评分标准类显性来源,data/preprocessed_corpus/gpt_suite_bundles/2025各区模拟题__2025各区一模__2025石景山一模.md,found,1,改革的实质,rubric-source-review,党加强顶层设计、整体谋划，确立新理念新机制，破除旧观念旧体制，推动制度更加成熟定型。,社会基本矛盾 / 改革的实质 / 上层建筑和生产关系调整,评分细则把改革实质、全面深化改革总目标和社会发展规律列为可用模块。进一步全面深化改革通过调整不适应生产力发展的生产关系、完善不适应经济基础的上层建筑，把制度优势转化为治理效能，因此能推动社会主义现代化建设。,2025石景山一模,21,False,True,FAIL_NEEDS_FULL_PROMPT_AND_CONCRETE_LANDING
V3-FW-0308,1383,table,本轮选择题进展（2025门头沟一模三线闭环）,2025北京门头沟高三一模 第21题（1）,2025,门头沟,一模,第21题（1）,subjective,A,细则/阅卷/评分标准类显性来源,data/preprocessed_corpus/gpt_suite_bundles/2025各区模拟题__2025各区一模__2025门头沟一模.md,found,1,辩证否定,rubric-source-review,门头沟从“千年煤城”转向“京西智谷”，关闭矿山、培育 AI 与生物医药双引擎，并推动产业、生态、社会协同转型。,辩证否定 / 发展观点 / 系统观念,评分细则要求运用辩证思维破解发展矛盾，尤其是辩证否定、整体性和动态性。材料不是简单否定采煤历史，而是在承认旧产业贡献和现实约束基础上破除路径依赖、培育新动能，形成产业转型、生态涵养和民生改善的系统发展链。,2025门头沟一模,21,False,True,FAIL_NEEDS_FULL_PROMPT_AND_CONCRETE_LANDING
V3-FW-0309,1384,table,本轮选择题进展（2025门头沟一模三线闭环）,2025北京门头沟高三一模 第21题（1）,2025,门头沟,一模,第21题（1）,subjective,A,细则/阅卷/评分标准类显性来源,data/preprocessed_corpus/gpt_suite_bundles/2025各区模拟题__2025各区一模__2025门头沟一模.md,found,0,,rubric-source-review,门头沟立足资源约束和首都生态涵养功能定位，预见煤炭产业不可持续，果断关停矿山并发展新质生产力。,尊重客观规律与发挥主观能动性 / 科学思维客观性和预见性,评分细则要求写“遵循科学思维的客观性和预见性，立足实际或遵循客观规律”。材料先给出千年煤城的现实基础和生态涵养定位，再写主动关停矿山、培育新产业，说明高质量转型必须在把握客观条件和发展规律基础上主动作为。,2025门头沟一模,21,False,True,FAIL_NEEDS_FULL_PROMPT_AND_CONCRETE_LANDING
V3-FW-0310,1385,table,本轮选择题进展（2025门头沟一模三线闭环）,2025北京门头沟高三一模 第21题（2）,2025,门头沟,一模,第21题（2）,subjective,A,细则/阅卷/评分标准类显性来源,data/preprocessed_corpus/gpt_suite_bundles/2025各区模拟题__2025各区一模__2025门头沟一模.md,found,1,正确价值判断与价值选择,rubric-source-review,门头沟服务首都发展大局、落实生态涵养功能定位，关闭全部矿山，探索“绿水青山”向“金山银山”转化。,主观与客观具体的历史的统一 / 正确价值判断与价值选择,评分细则第21（2）允许从“主观与客观、认识与实践具体的历史的统一”和“正确价值判断与价值选择”作答。材料把区域发展选择放在首都功能定位、生态规律和人民长远利益中衡量，说明高质量发展不能沿用资源消耗路径，而要在客观条件变化中作出符合人民利益和社会发展方向的选择。,2025门头沟一模,21,False,True,FAIL_NEEDS_FULL_PROMPT_AND_CONCRETE_LANDING
V3-FW-0311,1386,table,本轮选择题进展（2025门头沟一模三线闭环）,2025北京门头沟高三一模 第21题（2）,2025,门头沟,一模,第21题（2）,subjective,A,细则/阅卷/评分标准类显性来源,data/preprocessed_corpus/gpt_suite_bundles/2025各区模拟题__2025各区一模__2025门头沟一模.md,found,2,主观能动性;意识的能动作用,rubric-source-review,门头沟建成算力中心、算法登记服务中心、数智人产业基地，持续培育人工智能、超高清数字视听、医疗器械等新产业。,主观能动性 / 意识的能动作用 / 创新驱动发展,评分细则第21（2）把“意识的能动作用”列入可用哲学角度。材料显示转型不是自然发生，而是通过规划产业方向、搭建平台、引入创新中心和打造 IP，把对未来产业趋势的认识转化为现实建设行动，因此触发主观能动性。,2025门头沟一模,21,False,True,FAIL_NEEDS_FULL_PROMPT_AND_CONCRETE_LANDING
V3-FW-0313,1388,table,本轮选择题进展（2025门头沟一模三线闭环）,2025北京门头沟高三一模 第21题（2）,2025,门头沟,一模,第21题（2）,subjective,A,细则/阅卷/评分标准类显性来源,data/preprocessed_corpus/gpt_suite_bundles/2025各区模拟题__2025各区一模__2025门头沟一模.md,found,2,人民群众;价值判断与价值选择,rubric-source-review,门头沟作为革命老区，在绿色转型和产业升级中努力让老区人民过上好日子。,人民群众 / 价值观导向 / 价值判断与价值选择,评分细则第21（2）把以人民为中心、共同富裕、正确价值判断与价值选择作为可用方向。材料中的“老区人民过上好日子”把转型目标落到人民生活改善，而不是只追求产业指标，说明高质量发展必须坚持人民立场，把人民利益作为价值选择标准。,2025门头沟一模,21,False,True,FAIL_NEEDS_FULL_PROMPT_AND_CONCRETE_LANDING
V3-FW-0350,1473,table,本轮主观题进展（2026海淀期中第22题评分细则链）,2026北京海淀高三（上）期中 第22题（2）,2026,海淀,期中,第22题（2）,subjective,A,细则/阅卷/评分标准类显性来源,data/preprocessed_corpus/gpt_suite_bundles/2026各区模拟题__2026各区期末和期中__2026海淀期中.md,found,0,,rubric-source-review,材料指出当今世界经历百年未有之大变局，但时与势在我们一边，中华民族伟大复兴势不可挡。,发展观点 / 社会历史发展规律 / 历史必然性,评分细则要求先破题，说明“势不可挡”意味着什么。材料不是让学生喊口号，而是要求把复兴放进社会历史发展趋势中理解：它有现实基础、历史积累和时代条件支撑，体现事物发展的前进方向和不可逆转的大势。,2026海淀期中,22,False,True,FAIL_NEEDS_FULL_PROMPT_AND_CONCRETE_LANDING
V3-FW-0351,1474,table,本轮主观题进展（2026海淀期中第22题评分细则链）,2026北京海淀高三（上）期中 第22题（2）,2026,海淀,期中,第22题（2）,subjective,A,细则/阅卷/评分标准类显性来源,data/preprocessed_corpus/gpt_suite_bundles/2026各区模拟题__2026各区期末和期中__2026海淀期中.md,found,2,人民群众;党的领导,rubric-source-review,中国共产党带领中国人民抗战胜利80周年、新中国成立70多年奋斗，持续推进中国式现代化。,人民群众 / 党的领导 / 实践观点,评分细则把“中国共产党的领导、坚持以人民为中心”等列为合格知识。复兴不是自然降临，而是党领导人民在长期实践中创造出来的历史进程；人民群众是历史创造主体，党的领导把人民力量组织起来，形成推进复兴的实践合力。,2026海淀期中,22,False,True,FAIL_NEEDS_FULL_PROMPT_AND_CONCRETE_LANDING
V3-FW-0352,1475,table,本轮主观题进展（2026海淀期中第22题评分细则链）,2026北京海淀高三（上）期中 第22题（2）,2026,海淀,期中,第22题（2）,subjective,A,细则/阅卷/评分标准类显性来源,data/preprocessed_corpus/gpt_suite_bundles/2026各区模拟题__2026各区期末和期中__2026海淀期中.md,found,1,制度优势,rubric-source-review,评分细则列出中国特色社会主义道路、理论、制度、文化等知识，要求说明其对复兴的支撑作用。,社会意识的反作用 / 上层建筑适应经济基础 / 制度优势,道路、理论、制度、文化不是抽象标签，而是中国式现代化能够持续推进的方向、规则和精神支撑。它们作为社会意识和上层建筑的重要内容，会反作用于经济社会实践，把发展优势转化为治理效能和复兴动力。,2026海淀期中,22,False,True,FAIL_NEEDS_FULL_PROMPT_AND_CONCRETE_LANDING
V3-FW-0353,1476,table,本轮主观题进展（2026海淀期中第22题评分细则链）,2026北京海淀高三（上）期中 第22题（2）,2026,海淀,期中,第22题（2）,subjective,A,细则/阅卷/评分标准类显性来源,data/preprocessed_corpus/gpt_suite_bundles/2026各区模拟题__2026各区期末和期中__2026海淀期中.md,found,0,,rubric-source-review,评分细则要求至少运用两个模块知识，并从“为什么、怎么做到”展开；示例还可从人类命运共同体等角度论证。,联系观点 / 系统观念 / 价值判断与价值选择,高分答案不能列点式堆砌“党、制度、人民、世界”，而要把它们组织成系统链：国内看党的领导、人民主体、道路制度文化，国际看和平发展与人类命运共同体；价值上坚持人民立场和民族复兴目标。材料要求的“势不可挡”，本质是多重条件同向发力形成的发展合力。,2026海淀期中,22,False,True,FAIL_NEEDS_FULL_PROMPT_AND_CONCRETE_LANDING
V3-FW-0365,1497,table,本轮进展（2026石景山期末选择题与主观题知识触发补强）,2026北京石景山高三（上）期末 第20题,2026,石景山,期末,第20题,subjective,B,评标或讲评角度清单，材料链需标整理者解释,data/preprocessed_corpus/gpt_suite_bundles/2026各区模拟题__2026各区期末和期中__2026石景山期末.md,found,0,,angle-list-review,“脉冲”试验法利用大流量水流冲刷，优化河道主槽形态，并通过实时监测、影像分析保证试验效果。,尊重客观规律与发挥主观能动性 / 实践检验,评分参考明确可从按规律办事角度回答。治河不能凭主观愿望硬改河道，而要认识水流、泥沙、河槽和生态功能规律，再通过试验、监测、分析不断调整方案；人的能动性体现在顺应并利用规律。,2026石景山期末,20,False,True,FAIL_NEEDS_FULL_PROMPT_AND_CONCRETE_LANDING
V3-FW-0371,1512,table,本轮进展（2024东城一模备课优先知识触发补强）,2024北京东城高三一模 第16题,2024,东城,一模,第16题,subjective,B,评标或讲评角度清单，材料链需标整理者解释,data/preprocessed_corpus/gpt_suite_bundles/2024各区模拟题__2024各区一模__2024东城一模.md,found,2,文化多样性;联系观点,angle-list-review,《论语导读》早期翻译和导读影响孟德斯鸠、伏尔泰等，17至18世纪中国思想、文化、技术“东学西传”，促进欧洲认识中国和改进自身。,矛盾普遍性与特殊性 / 文化多样性 / 联系观点,评标 PPT 要求解释共性和个性的统一，也可从整体与部分理解。中华文化成就既有民族独特性，也能成为世界文明交流的一部分；中国典籍进入欧洲思想语境，说明不同民族文化在保持特色中相互联系、相互启发。,2024东城一模,16,False,True,FAIL_NEEDS_FULL_PROMPT_AND_CONCRETE_LANDING
V3-FW-0372,1513,table,本轮进展（2024东城一模备课优先知识触发补强）,2024北京东城高三一模 第16题,2024,东城,一模,第16题,subjective,B,评标或讲评角度清单，材料链需标整理者解释,data/preprocessed_corpus/gpt_suite_bundles/2024各区模拟题__2024各区一模__2024东城一模.md,found,0,,angle-list-review,中国共产党领导中国人民成功走出中国式现代化道路，创造人类文明新形态，为世界文明交流互鉴贡献中国方案、中国智慧、中国力量。,实践观点 / 文化交流交融 / 社会意识反作用,评标 PPT 明确写到社会生活本质上是实践、文化与文明都是实践的产物。人类文明新形态不是抽象概念，而是党领导人民在革命、建设和现代化实践中创造出来的文明成果；它又作为先进文化和社会意识，为世界文明发展提供思想资源。,2024东城一模,16,False,True,FAIL_NEEDS_FULL_PROMPT_AND_CONCRETE_LANDING
V3-FW-0373,1514,table,本轮进展（2024东城一模备课优先知识触发补强）,2024北京东城高三一模 第16题,2024,东城,一模,第16题,subjective,B,评标或讲评角度清单，材料链需标整理者解释,data/preprocessed_corpus/gpt_suite_bundles/2024各区模拟题__2024各区一模__2024东城一模.md,found,1,文化自信,angle-list-review,题干引用马克思“民族所做的事情，也是为人类社会而做的事情”，要求理解中华文明新形态与全人类共同价值的关系。,价值观导向 / 人民立场 / 文化自信,评标 PPT 要求写科学价值观符合社会发展规律和人民根本利益，中华文明新形态蕴含全人类共同价值。答题不能只说“文化自信”，还要说明这种自信以人民为中心、坚守中华文化立场，并把民族发展同人类文明进步联系起来。,2024东城一模,16,False,True,FAIL_NEEDS_FULL_PROMPT_AND_CONCRETE_LANDING
V3-FW-0374,1515,table,本轮进展（2024东城一模备课优先知识触发补强）,2024北京东城高三一模 第18题（1）,2024,东城,一模,第18题（1）,subjective,B,评标或讲评角度清单，材料链需标整理者解释,data/preprocessed_corpus/gpt_suite_bundles/2024各区模拟题__2024各区一模__2024东城一模.md,found,1,科技创新,angle-list-review,北京人才资源总量增长、R&D经费投入增长、数字经济成为重要引擎，科技体制改革持续深化。,生产力观点 / 科技创新 / 系统观念,评标 PPT 将教育人才、研发投入、数字经济、科技体制改革分别作为优势。新质生产力不是单靠某一个技术点，而是劳动者、技术、数据、产业和制度环境共同作用；材料提示学生要把多要素组合成生产力跃升链条。,2024东城一模,18,False,True,FAIL_NEEDS_FULL_PROMPT_AND_CONCRETE_LANDING
V3-FW-0375,1516,table,本轮进展（2024东城一模备课优先知识触发补强）,2024北京东城高三一模 第18题（1）,2024,东城,一模,第18题（1）,subjective,B,评标或讲评角度清单，材料链需标整理者解释,data/preprocessed_corpus/gpt_suite_bundles/2024各区模拟题__2024各区一模__2024东城一模.md,found,1,改革,angle-list-review,北京出台科研项目经费“包干制”、技术攻关“揭榜挂帅”等政策，推动科技体制改革。,生产关系适应生产力 / 改革 / 上层建筑反作用,评标 PPT 明确指出科技体制改革推动形成与新质生产力相适应的生产关系，以体制机制创新带动科技创新。制度改革不是背景材料，而是调整生产关系和创新机制，使其更适应高科技、高效能、高质量的新质生产力发展。,2024东城一模,18,False,True,FAIL_NEEDS_FULL_PROMPT_AND_CONCRETE_LANDING
