audit_id,line,entry_type,section,source,year,district,stage,question,question_nature,evidence_grade_initial,grade_reason,bundle_path,bundle_state,trigger_hit_count_in_bundle,trigger_hit_terms_in_bundle,review_status,material,trigger,logic,suite_name,question_no_norm,covered_by_v6_question_number,present_by_suite_question_in_v7,quality_gate
V3-FW-0376,1517,table,本轮进展（2024东城一模备课优先知识触发补强）,2024北京东城高三一模 第21题,2024,东城,一模,第21题,subjective,B,评标或讲评角度清单，材料链需标整理者解释,data/preprocessed_corpus/gpt_suite_bundles/2024各区模拟题__2024各区一模__2024东城一模.md,found,2,联系观点;整体与部分,angle-list-review,京津冀十年携手，提速通勤圈、优化功能圈、打造产业圈，构建综合交通网络和现代化首都都市圈。,联系观点 / 系统观念 / 整体与部分,评标 PPT 明确给出系统优化、整体部分等角度。“三圈”不是三个孤立项目，而是交通、功能疏解、产业协同共同构成的区域发展系统；各圈层作为部分协同，服务现代化首都都市圈整体高质量发展。,2024东城一模,21,False,True,FAIL_NEEDS_FULL_PROMPT_AND_CONCRETE_LANDING
V3-FW-0377,1518,table,本轮进展（2024东城一模备课优先知识触发补强）,2024北京东城高三一模 第21题,2024,东城,一模,第21题,subjective,B,评标或讲评角度清单，材料链需标整理者解释,data/preprocessed_corpus/gpt_suite_bundles/2024各区模拟题__2024各区一模__2024东城一模.md,found,2,主次矛盾;优势互补,angle-list-review,通勤圈促进人流物流和资源要素流动，功能圈抓住疏解非首都功能和一核两翼，产业圈推动北京研发、津冀制造。,具体问题具体分析 / 主次矛盾 / 优势互补,评标 PPT 在功能圈中提示主次矛盾、两点论、整体部分。区域协同不能平均用力，要根据三地功能定位和比较优势安排交通、功能、产业任务；抓住关键功能和优势互补，才能把局部资源转化为整体效能。,2024东城一模,21,False,True,FAIL_NEEDS_FULL_PROMPT_AND_CONCRETE_LANDING
V3-FW-0378,1519,table,本轮进展（2024东城一模备课优先知识触发补强）,2024北京东城高三一模 第21题,2024,东城,一模,第21题,subjective,B,评标或讲评角度清单，材料链需标整理者解释,data/preprocessed_corpus/gpt_suite_bundles/2024各区模拟题__2024各区一模__2024东城一模.md,found,0,,angle-list-review,京津冀协同发展服务人民通勤、区域资源配置、产业升级和现代化产业体系建设。,人民中心 / 价值判断与价值选择 / 发展观点,评标 PPT 示例把以人民为中心、新发展理念和区域协调相连。首都都市圈建设不是为了画概念图，而是围绕人民出行、公共服务、区域协调和产业升级作价值选择，体现发展为了人民并通过系统协同推动高质量发展。,2024东城一模,21,False,True,FAIL_NEEDS_FULL_PROMPT_AND_CONCRETE_LANDING
V3-FW-0388,1546,table,本轮进展（2024朝阳一模备课优先知识触发补强）,2024北京朝阳高三一模 第16题,2024,朝阳,一模,第16题,subjective,B,评标或讲评角度清单，材料链需标整理者解释,data/preprocessed_corpus/gpt_suite_bundles/2024各区模拟题__2024各区一模__2024朝阳一模.md,found,1,对立统一,angle-list-review,“接受人民监督”和“勇于自我革命”都围绕党如何跳出历史周期率、永葆先进性和纯洁性展开。,对立统一 / 关系类设问方法,评标 PPT 明确要求用辩证思维看两者关系。答题第一步不是分别背政治制度和党的建设，而是先总判“辩证统一”：两个答案指向同一个治理难题，既有区别又有联系，共同服务党长期执政和人民利益。,2024朝阳一模,16,False,True,FAIL_NEEDS_FULL_PROMPT_AND_CONCRETE_LANDING
V3-FW-0389,1547,table,本轮进展（2024朝阳一模备课优先知识触发补强）,2024北京朝阳高三一模 第16题,2024,朝阳,一模,第16题,subjective,A,细则/阅卷/评分标准类显性来源,data/preprocessed_corpus/gpt_suite_bundles/2024各区模拟题__2024各区一模__2024朝阳一模.md,found,0,,rubric-source-review,接受人民监督主要依靠人民群众和民主制度，从党外施加影响；勇于自我革命强调全面从严治党、自我净化、自我完善、自我革新、自我提高。,内外因 / 矛盾分析法 / 党的建设,评分细则把“外因”和“内因”作为可给分角度。材料中的两个答案不能混成一句话：人民监督从外部制度和人民力量推动党改进，自我革命从党自身建设解决问题；二者分开写，才能拿到“相互区别”的分。,2024朝阳一模,16,False,True,FAIL_NEEDS_FULL_PROMPT_AND_CONCRETE_LANDING
V3-FW-0390,1548,table,本轮进展（2024朝阳一模备课优先知识触发补强）,2024北京朝阳高三一模 第16题,2024,朝阳,一模,第16题,subjective,A,细则/阅卷/评分标准类显性来源,data/preprocessed_corpus/gpt_suite_bundles/2024各区模拟题__2024各区一模__2024朝阳一模.md,found,0,,rubric-source-review,人民监督能够鞭策自我革命，自我革命能弥补外在监督不足；两者都来自初心使命、坚持人民至上和党的领导。,联系观点 / 人民立场 / 价值导向,评分细则要求写相互作用或共性。材料提示学生不要停在“一个外部、一个内部”，还要写二者相互促进并统一于人民立场、党的领导和跳出历史周期率的目标，这样关系类答案才完整。,2024朝阳一模,16,False,True,FAIL_NEEDS_FULL_PROMPT_AND_CONCRETE_LANDING
V3-FW-0413,1607,table,本轮进展（2024丰台一模备课优先知识触发补强）,2024北京丰台高三一模 第21题,2024,丰台,一模,第21题,subjective,A,细则/阅卷/评分标准类显性来源,data/preprocessed_corpus/gpt_suite_bundles/2024各区模拟题__2024各区一模__2024丰台一模.md,found,1,全人类共同价值,rubric-source-review,“克明俊德、协和万邦”、马克思恩格斯关于世界历史的论述和“和平与发展、公平正义、民主自由”共同指向人类普遍交往与共同追求。,联系观点 / 文化交流互鉴 / 全人类共同价值,评标细则允许从唯物辩证法、构建人类命运共同体等角度作答。材料把中国古典思想、马克思主义世界历史理论和当代共同价值放在一起，说明不同文明、不同民族在交往中形成共同关切，不能把共同价值理解成单一国家的口号。,2024丰台一模,21,False,True,FAIL_NEEDS_FULL_PROMPT_AND_CONCRETE_LANDING
V3-FW-0448,1672,table,本轮进展（2024朝阳二模备课优先知识触发补强）,2024北京朝阳高三二模 第19题（3）,2024,朝阳,二模,第19题（3）,subjective,A,细则/阅卷/评分标准类显性来源,data/preprocessed_corpus/gpt_suite_bundles/2024各区模拟题__2024各区二模__2024朝阳二模.md,found,2,中华优秀传统文化;中国式现代化,rubric-source-review,“生生之宇宙观”强调宇宙生生不息、永久变易、不断革新、生命成长更新和展开。,发展观点 / 中华优秀传统文化 / 中国式现代化,阅卷总结要求从材料概括出发展创新特质1分，并分析其对中国式现代化的作用1分。材料不是让学生背“源远流长”，而是把中华文化中的变化发展意识转化为中国式现代化不断创造新路、创造人类文明新形态的思想底蕴。,2024朝阳二模,19,False,True,FAIL_NEEDS_FULL_PROMPT_AND_CONCRETE_LANDING
V3-FW-0449,1673,table,本轮进展（2024朝阳二模备课优先知识触发补强）,2024北京朝阳高三二模 第19题（3）,2024,朝阳,二模,第19题（3）,subjective,A,细则/阅卷/评分标准类显性来源,data/preprocessed_corpus/gpt_suite_bundles/2024各区模拟题__2024各区二模__2024朝阳二模.md,found,3,人与自然和谐共生;共同富裕;和平发展,rubric-source-review,“一体之天人观”认为人类与天地为一体，所有人都是天地生育的子女，万物和人类一样也是天地所生。,人与自然和谐共生 / 共同富裕 / 和平发展,阅卷总结要求概括尊重万物、他人皆自己同胞，并分析其对中国式现代化的作用。材料把人与自然、人与他人放进共同体关系中，能支撑中国式现代化中人与自然和谐共生、全体人民共同富裕、和平发展的价值底蕴。,2024朝阳二模,19,False,True,FAIL_NEEDS_FULL_PROMPT_AND_CONCRETE_LANDING
V3-FW-0450,1674,table,本轮进展（2024朝阳二模备课优先知识触发补强）,2024北京朝阳高三二模 第19题（3）,2024,朝阳,二模,第19题（3）,subjective,A,细则/阅卷/评分标准类显性来源,data/preprocessed_corpus/gpt_suite_bundles/2024各区模拟题__2024各区二模__2024朝阳二模.md,found,0,,rubric-source-review,“法天地之人生观”强调人应效法天地之德，自强不息、厚德载物。,价值观导向 / 民族精神 / 实践奋斗,阅卷总结给出两条可用链：尊重自然、顺应自然；或自强不息、厚德载物的人生观价值观。材料提示学生把传统人生观转化为现代化实践动力：既顺应自然规律，也在砥砺自我、独立自主中推进现代化。,2024朝阳二模,19,False,True,FAIL_NEEDS_FULL_PROMPT_AND_CONCRETE_LANDING
V3-FW-0451,1675,table,本轮进展（2024朝阳二模备课优先知识触发补强）,2024北京朝阳高三二模 第19题（3）,2024,朝阳,二模,第19题（3）,subjective,A,细则/阅卷/评分标准类显性来源,data/preprocessed_corpus/gpt_suite_bundles/2024各区模拟题__2024各区二模__2024朝阳二模.md,found,2,创造性转化;创新性发展,rubric-source-review,题目要求理解中华优秀传统文化的特质如何赋予中国式现代化深厚底蕴，并在“怎么做”中要求推进双创或两个结合。,创造性转化、创新性发展 / 两个结合 / 文化自信,阅卷总结“怎么做”给2分。答题不能只说传统文化有价值，还要写新时代如何用：推进中华优秀传统文化创造性转化、创新性发展，把马克思主义基本原理同中国具体实际、同中华优秀传统文化相结合。,2024朝阳二模,19,False,True,FAIL_NEEDS_FULL_PROMPT_AND_CONCRETE_LANDING
V3-FW-0456,1708,table,本轮进展（2024东城二模三线闭环补强）,2024北京东城高三二模 第16题,2024,东城,二模,第16题,subjective,A,细则/阅卷/评分标准类显性来源,data/preprocessed_corpus/gpt_suite_bundles/2024各区模拟题__2024各区二模__2024东城二模.md,found,3,一切从实际出发;辩证否定;人民群众,rubric-source-review,桑基鱼塘可上溯到2500年前，在低洼处深挖为鱼塘、塘泥堆基种桑，形成桑、蚕、鱼、塘相辅相成的生态农业系统；新时代又把生态保护、产业融合、文化研学和乡村振兴统筹起来。,一切从实际出发 / 尊重规律与发挥主观能动性 / 联系系统 / 发展观点 / 辩证否定 / 人民群众 / 价值观导向,阅卷细则要求从形成、发展、价值三层论证。形成层抓“因地制宜、尊重规律”，发展层抓“保护利用、产业融合、研学课程”的联系和创新，价值层抓“服务乡村振兴、塑造人、人民福祉”。高分答案不是背一堆原理，而是把三层材料分别扣回三个给分方向。,2024东城二模,16,False,True,FAIL_NEEDS_FULL_PROMPT_AND_CONCRETE_LANDING
V3-FW-0457,1709,table,本轮进展（2024东城二模三线闭环补强）,2024北京东城高三二模 第18题（2）,2024,东城,二模,第18题（2）,subjective,A,细则/阅卷/评分标准类显性来源,data/preprocessed_corpus/gpt_suite_bundles/2024各区模拟题__2024各区二模__2024东城二模.md,found,2,上层建筑适应经济基础;具体问题具体分析,rubric-source-review,平台用工等新就业形态发展后，传统劳动关系认定标准难以完全适用，劳动关系领域出现拖欠薪酬、休假权受损、技能不适应等挑战。,上层建筑适应经济基础 / 具体问题具体分析 / 主体措施链,阅卷细则明确政府和司法机关建议可写“上层建筑适应经济基础的发展”。新就业形态属于经济社会实践变化，劳动法律规范、政府认定依据和司法解释必须随之细化完善；答题要按人大、政府、司法机关、党、用人单位、劳动者等主体分别给措施，不能一套话包打天下。,2024东城二模,18,False,True,FAIL_NEEDS_FULL_PROMPT_AND_CONCRETE_LANDING
V3-FW-0458,1710,table,本轮进展（2024东城二模三线闭环补强）,2024北京东城高三二模 第21题,2024,东城,二模,第21题,subjective,A,细则/阅卷/评分标准类显性来源,data/preprocessed_corpus/gpt_suite_bundles/2024各区模拟题__2024各区二模__2024东城二模.md,found,0,,rubric-source-review,我国发展具备党的坚强领导、制度优势、持续快速发展和坚实基础、长期稳定社会环境、自信自强精神力量等战略性有利条件。,联系观点 / 系统观念 / 意识能动作用 / 从实际出发和遵循社会发展规律,阅卷总结要求“战略性有利条件 -> 路径 -> 民族复兴”，至少写三个点。多个条件不是平均罗列，而是构成推进复兴的合力：党的领导定方向，制度优势转化为治理效能，物质基础和稳定环境提供现实支撑，自信自强的民族精神转化为奋斗动力；哲学角度可替措施环节写从中国实际出发、遵循社会发展规律。,2024东城二模,21,False,True,FAIL_NEEDS_FULL_PROMPT_AND_CONCRETE_LANDING
