atom_id,bucket,core_point,expression_variant,source_question,scoring_position,evidence_level,source_boundary,material_trigger_fusion,answer_sentence_fusion,merge_action,boundary_note,promotion_status,source_ledger_refs,_file,final_bucket,final_core_cluster
ATOM-B01,政治多极化,共商共建共享的全球治理观,共商共建共享全球治理观,2026通州期末 Q20,评分细则第1点1分,P0_formal_scoring_rule,formal_scoring_ppt,设问追问全球治理倡议为什么能指引方向，材料把倡议定位为完善全球治理的中国方案，触发全球治理应该由各国共同商量、共同建设、共同分享这一治理观。,全球治理倡议秉持共商共建共享的全球治理观，推动各国平等参与全球治理体系改革和建设，为完善全球治理提供中国方向。,merge_core,do_not_merge_with_Q17_loose_cooperation,candidate_with_fixes,2026通州期末_Q20_SRC_35ef9424281a,scoring_atom_table_batch01.csv,政治多极化,共商共建共享的全球治理观
ATOM-B02,时代背景,和平与发展仍是时代主题,时代主题；和平与发展成为时代主题；顺应各国人民愿望；经济全球化深入发展,2026通州期末 Q20;2025海淀期中 Q21(2),通州评分细则第2点2分;海淀图片表格细则世界之变2分,P0_formal_scoring_rule;user_confirmed_image_scoring_material,mixed_scoring_sources_labeled,当设问要求说明倡议正逢其时或外交为什么随时代而变时，材料呈现百年变局、治理赤字、政治多极化和经济全球化，就要先写和平与发展的时代背景及其受到冲击后的治理需求。,和平与发展仍是时代主题，政治多极化、经济全球化深入发展，各国人民渴望和平稳定和共同发展；全球治理倡议回应治理赤字，因而正逢其时。,merge_across_questions_preserve_variants,do_not_merge_with_China_foreign_policy_purpose,candidate_with_fixes,2026通州期末_Q20_SRC_35ef9424281a;2025海淀期中_Q21_SRC_cda046c2d36d,scoring_atom_table_batch01.csv,时代背景,和平与发展仍是时代主题
ATOM-B03,联合国,符合《联合国宪章》宗旨和原则,符合《联合国宪章》,2026通州期末 Q20,评分细则第3点1分,P0_formal_scoring_rule,formal_scoring_ppt,材料把全球治理倡议同联合国宪章宗旨和原则相连，设问追问倡议的方向性和正当性，触发联合国宪章框架。,全球治理倡议符合《联合国宪章》宗旨和原则，在维护国际和平与安全、促进国际合作上具有正当性基础。,merge_core,may_later_merge_with_Haidian_UN_charter_after_recheck,candidate_with_fixes,2026通州期末_Q20_SRC_35ef9424281a,scoring_atom_table_batch01.csv,联合国,《联合国宪章》宗旨和原则
ATOM-B04,政治多极化,推动构建国际新秩序；倡导国际关系民主化；践行多边主义,推动构建更加公正合理的国际新秩序；国际关系民主化；多边主义,2026通州期末 Q20,评分细则第4点任一点1分共2分,P0_formal_scoring_rule,formal_scoring_ppt,设问中的指引方向要求回答全球治理秩序应朝哪里走，材料中的主权平等、国际法治和多边主义触发国际秩序方向术语。,全球治理倡议倡导国际关系民主化、践行多边主义，推动构建更加公正合理的国际新秩序，使全球治理体系朝公平合理方向发展。,split_same_optional_group,correct_yiliguan_split_to_China,candidate_with_fixes,2026通州期末_Q20_SRC_35ef9424281a,scoring_atom_table_batch01.csv,政治多极化,推动国际关系民主化，坚持真正的多边主义，推动国际秩序朝公正合理方向发展
ATOM-B05,中国,坚持正确义利观；兼顾各方利益,正确义利观；兼顾他国合理关切,2026通州期末 Q20;2026朝阳期中 Q17,通州评分细则第4点可选组;朝阳期中第三层分说2,P0_formal_scoring_rule,formal_scoring_docx_or_ppt,当材料强调中国方案既回应世界治理需求又兼顾各方合理利益，或者中国发展成果惠及全球南方，触发中国对外合作中的正确义利观。,中国坚持正确义利观，在推进全球治理和人工智能国际合作中兼顾各方合理利益，以中国发展助力世界共同发展。,merge_core_preserve_sources,same_Tongzhou_optional_group_as_ATOM_B04,candidate_with_fixes,2026通州期末_Q20_SRC_35ef9424281a;2026朝阳期中_Q17_SRC_763b7470b96b,scoring_atom_table_batch01.csv,中国,坚持正确义利观，在发展合作中义利相兼、互利共赢
ATOM-B06,中国,推动构建人类命运共同体,人类命运共同体,2026通州期末 Q20;2026朝阳期中 Q17,通州评分细则第5点1分;朝阳期中第三层分说2,P0_formal_scoring_rule,formal_scoring_docx_or_ppt,设问要求说明中国倡议如何彰显担当，或中国发展如何与世界发展相协调时，材料中的公共产品、全球南方能力建设、治理赤字回应都指向人类命运共同体。,中国提出全球治理倡议并推动人工智能合作，服务于推动构建人类命运共同体，为应对全球治理赤字和全球智能鸿沟贡献中国力量。,merge_core,not_subordinate_to_four_global_initiatives,candidate_with_fixes,2026通州期末_Q20_SRC_35ef9424281a;2026朝阳期中_Q17_SRC_763b7470b96b;2024东城一模_Q16_SRC_1f17f2c91d92,scoring_atom_table_batch01.csv,中国,推动构建人类命运共同体
ATOM-B07,中国,贡献中国智慧、中国方案；勇于大国担当,中国智慧；中国方案；大国担当,2026通州期末 Q20,评分细则第6点1分,P0_formal_scoring_rule,formal_scoring_ppt,材料把全球治理倡议写成中国向世界提供的重要公共产品，设问中的彰显担当直接触发中国智慧、中国方案和大国担当。,全球治理倡议作为中国提供的重要国际公共产品，贡献中国智慧、中国方案，展现中国勇于承担国际责任的大国担当。,merge_core,may_merge_with_later_Haidian_Q21_after_recheck,candidate_with_fixes,2026通州期末_Q20_SRC_35ef9424281a,scoring_atom_table_batch01.csv,中国,贡献中国智慧、中国方案、中国力量与全球倡议体系
ATOM-B08,理论,处理好自力更生和对外开放的关系,自力更生与对外开放,2026朝阳期中 Q17,第一层总说1分,P0_formal_scoring_rule,formal_scoring_docx,设问要求处理人工智能发展中的重要关系，材料同时呈现核心技术自主可控与不能闭门造车，形成自主和开放两端的张力。,推进人工智能发展既要依靠核心技术自主可控掌握主动，又要通过开放合作融入国际分工，因此要处理好自力更生和对外开放的关系。,keep_question_relation_container,Q17_relation_container_not_generic_term,candidate_with_fixes,2026朝阳期中_Q17_SRC_763b7470b96b,scoring_atom_table_batch01.csv,理论,处理好自力更生和对外开放的关系
ATOM-B09,理论,核心技术自主可控；把握创新主动权,核心技术自主可控；自主研发；核心竞争力,2026朝阳期中 Q17,第一层分说1,P0_formal_scoring_rule,formal_scoring_docx,材料写外部环境复杂、人工智能关键环节不能受制于人，回答自主端时触发核心技术自主可控和创新主动权。,面对人工智能关键环节和外部竞争压力，我国要推进核心技术自主可控、把握创新主动权，增强人工智能发展的核心竞争力。,keep_as_subpoint,exclude_new_development_concept_boundary,candidate_with_fixes,2026朝阳期中_Q17_SRC_763b7470b96b,scoring_atom_table_batch01.csv,理论,核心技术自主可控；把握创新主动权
ATOM-B10,经济全球化,参与经济全球化；参与国际分工；充分利用国内国际两个市场、两种资源,国际交流合作；两个市场两种资源；国际分工,2026朝阳期中 Q17,第一层分说2,P0_formal_scoring_rule,formal_scoring_docx,材料说明自主可控不是闭门造车，也不要求所有环节由本国独立完成，触发在经济全球化和国际分工中推进人工智能发展的开放端。,我国在坚持自主创新的同时，应积极参与经济全球化和国际分工，联动国内国际两个市场、两种资源，形成自主与开放相互支撑的发展路径。,merge_with_two_markets_core,remove_open_economy_and_dual_circulation_as_core,candidate_with_fixes,2026朝阳期中_Q17_SRC_763b7470b96b,scoring_atom_table_batch01.csv,经济全球化,充分利用国内国际两个市场、两种资源，增强国内国际循环联动
ATOM-B11,理论,处理好发展和安全的关系；统筹发展和安全,发展与安全,2026朝阳期中 Q17,第二层总说1分,P0_formal_scoring_rule,formal_scoring_docx,材料一端呈现人工智能带来效率提升和发展动能，另一端呈现数据泄露、模型缺陷、伦理失控等风险，触发发展和安全关系。,发展人工智能必须统筹发展和安全，在释放降本增效和发展动能的同时，有效防范数据安全、科技安全等风险。,keep_question_relation_container,Layer2_economy_subpoint_boundary_record_required,candidate_with_fixes,2026朝阳期中_Q17_SRC_763b7470b96b,scoring_atom_table_batch01.csv,理论,处理好发展和安全的关系；统筹发展和安全
ATOM-B12,中国,总体国家安全观；维护国家经济安全、科技安全,底线思维；应对风险,2026朝阳期中 Q17,第二层分说1,P0_formal_scoring_rule,formal_scoring_docx,材料列举人工智能安全事件和非传统安全风险，回答安全端时触发总体国家安全观及经济安全、科技安全。,我国应坚持总体国家安全观和底线思维，维护国家经济安全、科技安全，为人工智能发展守住安全底线。,keep_as_subpoint,government_regulation_and_laws_not_core_xuanbiyi,candidate_with_fixes,2026朝阳期中_Q17_SRC_763b7470b96b,scoring_atom_table_batch01.csv,中国,中国特色大国外交、独立自主和平外交政策与周边命运共同体
ATOM-B13,理论,处理好中国发展和世界发展的关系,中国发展与世界发展,2026朝阳期中 Q17,第三层总说1分,P0_formal_scoring_rule,formal_scoring_docx,材料把我国人工智能发展与全球南方能力建设、全球智能鸿沟联系起来，触发本国发展和世界发展之间的关系。,我国推进人工智能发展要处理好中国发展和世界发展的关系，在谋求本国发展的同时促进世界共同发展。,keep_question_relation_container,domestic_industry_upgrade_boundary_support_only,candidate_with_fixes,2026朝阳期中_Q17_SRC_763b7470b96b,scoring_atom_table_batch01.csv,理论,处理好中国发展和世界发展的关系
ATOM-B14,经济全球化,利用国际组织赋予的权利；积极参与全球经济治理和规则制定,为企业出海营造良好国际环境,2025海淀期中 Q16(2),内嵌图片image2第3点贸易摩擦2分,user_confirmed_image_scoring_material,embedded_docx_image_verified,设问要求为企业出海提建议，材料呈现商标权败诉和国际贸易风险，说明出海不能只靠企业经营策略，还要利用国际组织和全球治理规则维护权益。,面对海外市场贸易摩擦和知识产权风险，企业和政府可利用国际组织赋予的权利，积极参与全球经济治理和规则制定，为中国咖啡企业出海营造良好的国际环境。,merge_core,do_not_upgrade_text_reference_answers,candidate_with_fixes,2025海淀期中_Q16_SRC_cda046c2d36d,scoring_atom_table_batch01.csv,经济全球化,建设开放型世界经济，参与全球经济治理和规则制定
ATOM-B15,时代背景,政治多极化、经济全球化深入发展，和平与发展成为时代主题,世界之变；和平与发展仍是时代主题,2025海淀期中 Q21(2),内嵌图片image8变4分-世界之变2分,user_confirmed_image_scoring_material,embedded_docx_image_verified,设问分析新中国外交的变，材料按历史阶段呈现中国面对的外部世界变化，触发世界格局与时代主题变化。,新中国外交面对的时代背景不断变化，政治多极化、经济全球化深入发展，和平与发展成为时代主题，推动外交在不同阶段调整重点。,merge_into_ATOM_B02,not_China_policy_purpose,candidate_with_fixes,2025海淀期中_Q21_SRC_cda046c2d36d,scoring_atom_table_batch01.csv,政治多极化,世界多极化深入发展与平等有序的世界多极化
ATOM-B16,中国,中国综合国力不断增强，国际地位不断提升，承担越来越多国际责任,国际影响力、话语权不断提升,2025海淀期中 Q21(2),内嵌图片image8变4分-中国之变实力1分,user_confirmed_image_scoring_material,embedded_docx_image_verified,材料从站起来、富起来、强起来展示中国实力和地位变化，回答外交的变要说明中国自身实力基础变化。,中国综合国力不断增强、国际地位不断提升，承担越来越多国际责任，推动中国特色大国外交不断发展。,merge_core,image8_remark_classified_as_usable_variant,candidate_with_fixes,2025海淀期中_Q21_SRC_cda046c2d36d,scoring_atom_table_batch01.csv,理论,当前国际竞争的实质是以经济和科技实力为基础的综合国力较量
ATOM-B17,中国,习近平外交思想为新时代中国特色大国外交提供根本遵循和行动指南,外交指导思想与时俱进；人类命运共同体作为思想层可得分表述,2025海淀期中 Q21(2),内嵌图片image8变4分-中国之变思想1分,user_confirmed_image_scoring_material,embedded_docx_image_verified,材料写新时代外交理论和实践创新，形成习近平外交思想，说明外交指导思想随着中国和世界发展而变。,习近平外交思想为新时代中国特色大国外交提供根本遵循和行动指南，指引中国形成全方位、多层次、立体化的外交布局。,keep_as_China_diplomacy_core,HMC_here_is_thought_layer_expression_not_standalone_core,candidate_with_fixes,2025海淀期中_Q21_SRC_cda046c2d36d,scoring_atom_table_batch01.csv,中国,推动构建人类命运共同体
ATOM-B18,中国,新中国外交始终服务于我国人民民主专政的国家性质,国家性质；国家利益/维护主权安全发展利益为非累计替代表述,2025海淀期中 Q21(2),内嵌图片image8不变第1项1分,user_confirmed_image_scoring_material,embedded_docx_image_verified,设问要求说明不变，材料虽然呈现外交任务变化，但外交服务国家性质和国家根本利益的基础没有变。,新中国外交始终服务于我国人民民主专政的国家性质，以维护我国主权、安全和发展利益为重要依据。,keep_core,state_interest_non_cumulative_reminder_not_new_core,candidate_with_fixes,2025海淀期中_Q21_SRC_cda046c2d36d,scoring_atom_table_batch01.csv,中国,中国特色大国外交、独立自主和平外交政策与周边命运共同体
ATOM-B19,中国,坚持独立自主的基本立场,独立自主的和平外交政策,2025海淀期中 Q21(2),内嵌图片image8不变第2组基本立场2分,user_confirmed_image_scoring_material,embedded_docx_image_verified,材料中各阶段外交重点不同，但都体现中国自主决定对外方针，触发独立自主基本立场。,新中国外交始终坚持独立自主的基本立场，按照不同阶段国家发展需要自主决定外交方针。,keep_core,may_merge_with_foreign_policy_section,candidate_with_fixes,2025海淀期中_Q21_SRC_cda046c2d36d,scoring_atom_table_batch01.csv,中国,中国特色大国外交、独立自主和平外交政策与周边命运共同体
ATOM-B20,中国,维护世界和平、促进共同发展的宗旨；和平共处五项原则,促进世界和平与发展为基本目标,2025海淀期中 Q21(2),内嵌图片image8不变第2组宗旨目标准则,user_confirmed_image_scoring_material,embedded_docx_image_verified,设问要求分析外交不变，材料中不同阶段都围绕和平、发展、和平共处展开，触发中国外交政策宗旨、目标和基本准则。,新中国外交始终贯彻维护世界和平、促进共同发展的宗旨，以促进世界和平与发展为基本目标，坚持和平共处五项原则作为对外关系基本准则。,keep_core,do_not_merge_with_era_theme_ATOM_B02,candidate_with_fixes,2025海淀期中_Q21_SRC_cda046c2d36d,scoring_atom_table_batch01.csv,中国,中国特色大国外交、独立自主和平外交政策与周边命运共同体
ATOM-B21,政治多极化,推进构建新型国际关系（国际关系民主化）,国际关系民主化；新型国际关系,2024东城一模 Q16,试题分析PPT slide26阅卷细则中论证层可得1分,P2_teaching_or_lecture,teaching_analysis_ppt_with_marking_details,题目以民族贡献人类社会为核心，材料写中国创造人类文明新形态并贡献中国智慧，中国对国际关系和共同体建设的贡献成为可给分论证角度。,中国共产党领导中国人民创造人类文明新形态、促进世界文明交流互鉴，也推进构建新型国际关系、倡导国际关系民主化，为人类社会贡献中国智慧。,keep_P2_candidate,cross_book_prompt_not_standard_xuanbiyi_question,candidate_with_fixes,2024东城一模_Q16_SRC_1f17f2c91d92;2024东城一模_Q16_SRC_a1c55f582bad,scoring_atom_table_batch01.csv,政治多极化,推动建设相互尊重、公平正义、合作共赢的新型国际关系
ATOM-B22,中国,推动构建人类命运共同体,人类命运共同体,2024东城一模 Q16,试题分析PPT slide26阅卷细则中论证层可得1分,P2_teaching_or_lecture,teaching_analysis_ppt_with_marking_details,同一论证层要求说明中国实践对人类社会的意义，触发人类命运共同体作为中国方案的价值指向。,中国推动构建人类命运共同体，把中国发展同人类社会共同进步联系起来，为世界发展贡献中国方案。,merge_with_ATOM_B06_as_P2_variant,keep_evidence_level_visible,candidate_with_fixes,2024东城一模_Q16_SRC_1f17f2c91d92;2024东城一模_Q16_SRC_a1c55f582bad,scoring_atom_table_batch01.csv,中国,推动构建人类命运共同体
ATOM-B23,经济全球化,对标国际规则，推进制度型开放，深入融入经济全球化,制度型开放;深入融入经济全球化,2024东城一模 Q20,试题分析PPT slide64第3点,P2_teaching_or_lecture,teaching_analysis_ppt_with_scoring_info,题目问开放措施如何通过构建新发展格局助力高质量发展，材料写主动对标国际规则、规制、管理和标准，触发制度型开放与经济全球化链条。,我国主动对标国际规则、规制、管理和标准，推进制度型开放、深入融入经济全球化，为外循环提速和新发展格局构建提供开放条件。,keep_P2_candidate,high_level_opening_excluded_as_boundary,candidate_with_fixes,2024东城一模_Q20_SRC_1f17f2c91d92;2024东城一模_Q20_SRC_a1c55f582bad,scoring_atom_table_batch01.csv,经济全球化,建设开放型世界经济，参与全球经济治理和规则制定
ATOM-B24,经济全球化,增强国内国际两个市场两种资源联动效应,以国内大循环吸引全球资源要素；两个市场两种资源,2024东城一模 Q20,试题分析PPT slide64第4点,P2_teaching_or_lecture,teaching_analysis_ppt_with_scoring_info,材料写放宽外资准入并依托超大规模市场优势，题目要求说明开放措施如何促进国内国际循环联动。,我国放宽外资准入、依托超大规模市场优势，以国内大循环吸引全球资源要素，增强国内国际两个市场两种资源联动效应。,merge_with_ATOM_B10_two_markets_core,keep_P2_label,candidate_with_fixes,2024东城一模_Q20_SRC_1f17f2c91d92;2024东城一模_Q20_SRC_a1c55f582bad,scoring_atom_table_batch01.csv,经济全球化,充分利用国内国际两个市场、两种资源，增强国内国际循环联动
ATOM-B25,经济全球化,提升贸易投资合作质量和水平,贸易投资合作质量和水平,2024东城一模 Q20,试题分析PPT slide64第4点,P2_teaching_or_lecture,teaching_analysis_ppt_with_scoring_info,材料把外循环提速落实到市场准入、营商环境和外资流入，触发贸易投资合作质量提升对高质量发展的作用。,我国优化市场准入和营商环境，提升贸易投资合作质量和水平，使外循环更好服务经济高质量发展。,keep_P2_candidate,boundary_with_required_economics_terms,candidate_with_fixes,2024东城一模_Q20_SRC_1f17f2c91d92;2024东城一模_Q20_SRC_a1c55f582bad,scoring_atom_table_batch01.csv,经济全球化,提升贸易投资合作质量和水平
BOUNDARY-B01,模块边界,2026朝阳期中 Q17 第二层分说2：必修二/一般经济治理边界，已排除,经济平稳可持续发展；高质量发展；注入新动能；降本增效；提高效率；优化资源配置；经济增长；政府履行经济职能监管；完善法律法规,2026朝阳期中 Q17,第二层发展端分说2，本项目不作为选必一主链术语,P0_formal_scoring_rule_boundary,formal_scoring_docx_but_cross_module_boundary,材料确有人工智能发展效益和治理监管内容，但本项目只积累选必一《当代国际政治与经济》主链术语，故将这些必修二/一般治理表达保留为边界记录。,,excluded_boundary_subpoint,prevents_false_missing_subpoint_without_promoting_cross_module_terms,excluded_boundary_subpoint,2026朝阳期中_Q17_SRC_763b7470b96b,scoring_atom_table_batch01.csv,经济全球化,促进生产要素全球流动、资源优化配置、优势互补和国际分工合作
ATOM-C01,理论,当前国际竞争的实质是以经济和科技实力为基础的综合国力较量；坚持创新驱动战略,综合国力较量；经济和科技实力；创新驱动战略,2026朝阳一模 Q20,第20题第①点2分(1+1)必答点,P0_formal_scoring_rule,formal_scoring_docx,设问问中国为什么能为全球发展提供稳定性和正能量，镜头一用AI、大模型和创新药说明中国科技创新能力，触发能力来源型答题。,当前国际竞争的实质是以经济和科技实力为基础的综合国力较量，中国坚持创新驱动战略，科技实力日益增强，能够为全球产业链供应链稳定和全球发展提供支撑。,new_core_theory,not_merge_with_generic_global_supply_chain_result,candidate_with_fixes,2026朝阳一模_Q20_SRC_ebbe85a1ee6f;2026朝阳一模_Q20_SRC_fd08ca4014c0,scoring_atom_table_batch02.csv,理论,当前国际竞争的实质是以经济和科技实力为基础的综合国力较量
ATOM-C02,中国,贡献中国智慧、中国方案；勇于大国担当,大国责任与担当；正确义利观；共享发展经验,2026朝阳一模 Q20,第20题第②点1分,P0_formal_scoring_rule,formal_scoring_docx,镜头二呈现鲁班工坊、菌草和现代化经验走向多国，要求说明中国怎样把自身发展经验转化为国际公共贡献。,中国通过鲁班工坊、菌草技术和现代化经验共享助力共同繁荣，秉持正确义利观，贡献中国智慧和中国方案，展现大国责任与担当。,merge_with_M07_and_crossref_M05,avoid_duplicate_count_with_HMC_same_section,candidate_with_fixes,2026朝阳一模_Q20_SRC_ebbe85a1ee6f;2026朝阳一模_Q20_SRC_fd08ca4014c0,scoring_atom_table_batch02.csv,中国,贡献中国智慧、中国方案、中国力量与全球倡议体系
ATOM-C03,中国,改善发展中国家民生,发展中国家民生改善;全球发展内生动力,2026朝阳一模 Q20,第20题第②点1分,P0_formal_scoring_rule,formal_scoring_docx,镜头二集中呈现中国职业教育和农业技术服务发展中国家，回答正能量时要说明这些合作对当地发展和民生的实际作用。,中国职业教育国际合作和菌草种植技术帮助发展中国家培养技术人才、减贫和生态治理，改善发展中国家民生，增强全球发展内生动力。,new_expression_under_china_responsibility,not_a_general_empty_result_phrase,candidate_with_fixes,2026朝阳一模_Q20_SRC_ebbe85a1ee6f;2026朝阳一模_Q20_SRC_fd08ca4014c0,scoring_atom_table_batch02.csv,中国,国际发展合作、南南合作与“小而美”项目
ATOM-C04,中国,推动构建人类命运共同体,人类命运共同体,2026朝阳一模 Q20,第20题第②点1分,P0_formal_scoring_rule,formal_scoring_docx,材料写中国同世界分享发展成果、助力各国探索适合自身国情的发展道路，触发中国面向全球共同发展的理念表达。,中国同世界分享减贫技术、发展成果和现代化经验，推动构建人类命运共同体，使全球发展更具包容性和稳定性。,merge_with_M06,independent_core_not_initiative_subordinate,candidate_with_fixes,2026朝阳一模_Q20_SRC_ebbe85a1ee6f;2026朝阳一模_Q20_SRC_fd08ca4014c0,scoring_atom_table_batch02.csv,中国,推动构建人类命运共同体
ATOM-C05,经济全球化,充分利用国内国际两个市场、两种资源,两个市场、两种资源,2026朝阳一模 Q20,第20题第③点发展潜力角度1分,P0_formal_scoring_rule,formal_scoring_docx,镜头三写中国市场、制造业、货物贸易、自贸协定和免签政策，说明中国发展通过市场资源联动形成开放发展潜力。,中国依托超大规模市场和全球贸易网络，联动国内国际两个市场、两种资源，为各国共享中国发展机遇提供稳定空间。,merge_with_M12,keep_P0_source_variant,candidate_with_fixes,2026朝阳一模_Q20_SRC_ebbe85a1ee6f;2026朝阳一模_Q20_SRC_fd08ca4014c0,scoring_atom_table_batch02.csv,经济全球化,充分利用国内国际两个市场、两种资源，增强国内国际循环联动
