atom_id,bucket,core_point,expression_variant,source_question,scoring_position,evidence_level,source_boundary,material_trigger_fusion,answer_sentence_fusion,merge_action,boundary_note,promotion_status,source_ledger_refs,_file,final_bucket,final_core_cluster
ATOM-HDQZ06,政治多极化,反对霸权主义和强权政治,反霸权主义；反强权政治；维护国际公平正义,2024海淀期中 Q21(2),不变侧变通1分,P0_formal_scoring_rule_pdf_text,formal_scoring_pdf_with_visual_paper_prompt,评分细则在不变侧列出反对霸权主义强权政治 作为中国外交原则立场的可得分表达,新中国外交一贯反对霸权主义和强权政治 主张在和平共处五项原则基础上维护国际公平正义,merge_with_anti_hegemony_expression_pool_constant_frame,作为不变侧可得分表达积累 不反向泛化为所有外交题必答；属不变侧框架 不得与时代背景之变混同,candidate_with_fixes,2024海淀期中_Q21_2_SRC_e3f88f68dd56;2024海淀期中_Q21_2_SRC_132d9a876bce,scoring_atom_table_batch04E_haidian_qizhong_prelim.csv,政治多极化,推动国际关系民主化，坚持真正的多边主义，推动国际秩序朝公正合理方向发展
ATOM-FT01,中国,中国以最大发展中国家身份积极参与全球治理并推动全球南方现代化,国际政治经济格局中的重要力量；全球南方现代化；中国参与全球治理,2025丰台二模 Q20,评分标准说明角度一2分,P0_formal_scoring_rule_docx,formal_marking_docx_with_paper_text_support,材料写全球南方群体性崛起和全球南方为发展而起 回答中国力量首先要说明中国以发展中国家身份参与全球治理并推动全球南方现代化,中国作为世界上最大的发展中国家 是国际政治经济格局中的重要力量 积极参与全球治理 为推动全球南方实现现代化发挥作用,merge_with_china_global_governance_global_south,不能只写全球南方关键词；必须保留中国身份+参与全球治理+推动现代化的解释链,candidate_with_fixes,2025丰台二模_Q20_SRC_1543d8baa151;2025丰台二模_Q20_SRC_770de383c911,scoring_atom_table_batch04F_fengtai_prelim.csv,中国,中国作为负责任大国积极参与全球治理并推动全球南方现代化
ATOM-FT02,中国,中国积极参与国际组织并成为全球治理体系的重要参与者贡献者改革者,联合国；金砖国家；二十国集团；博鳌亚洲论坛；国际组织作用；全球治理体系变革,2025丰台二模 Q20,评分标准说明角度二2分,P0_formal_scoring_rule_docx,formal_marking_docx_with_paper_text_support,材料分别出现国际组织会议讲话 金砖+ 二十国集团 博鳌亚洲论坛 回答中国力量要说明中国通过国际组织平台推动全球治理体系变革,中国积极参与国际组织 在联合国、金砖国家、二十国集团、博鳌亚洲论坛等国际组织中的作用日益显著 成为全球治理体系的重要参与者、贡献者和改革者,merge_with_china_global_governance_actor_via_international_organizations,这里是中国通过国际组织参与全球治理的角色点 不等同于联合国常任理事国专门角度；二者需分开,candidate_with_fixes,2025丰台二模_Q20_SRC_1543d8baa151;2025丰台二模_Q20_SRC_770de383c911,scoring_atom_table_batch04F_fengtai_prelim.csv,政治多极化,推动国际关系民主化，坚持真正的多边主义，推动国际秩序朝公正合理方向发展
ATOM-FT03,联合国,中国作为联合国常任理事国遵守联合国宪章宗旨原则并践行多边主义维护多边体制,联合国常任理事国；联合国宪章宗旨原则；践行多边主义；维护多边体制权威性和有效性,2025丰台二模 Q20,评分标准说明角度三2分,P0_formal_scoring_rule_docx,formal_marking_docx_with_paper_text_support,材料写联合国成立80周年 维护联合国权威 发挥联合国作用 回答中国力量要落到中国作为常任理事国维护以联合国为核心的多边体制,中国作为联合国常任理事国 遵守《联合国宪章》宗旨原则 践行多边主义 维护多边体制的权威性和有效性,merge_with_un_charter_multilateralism_core,不能只写联合国；必须说明常任理事国身份+宪章原则+多边主义+体制权威有效,candidate_with_fixes,2025丰台二模_Q20_SRC_1543d8baa151;2025丰台二模_Q20_SRC_770de383c911,scoring_atom_table_batch04F_fengtai_prelim.csv,联合国,《联合国宪章》宗旨和原则
ATOM-FT04,政治多极化,中国推动构建人类命运共同体并推动全球治理体制向更加公正合理方向发展,平等、开放、合作、共享；共商共建共享全球治理观；全球治理体制更加公正合理；完善全球治理原则和目标,2025丰台二模 Q20,评分标准说明角度四2分,P0_formal_scoring_rule_docx,formal_marking_docx_with_paper_text_support,材料写推动构建人类命运共同体 共迎全球挑战 推动全球治理朝着更加公正合理方向发展 回答中国力量要说明中国倡导的共同体理念、治理原则和目标方向,中国推动构建人类命运共同体 遵循平等、开放、合作、共享等原则 同世界各国一起推动全球治理体制向着更加公正合理的方向发展,merge_with_hmc_global_governance_direction_crossref_china,保留平等开放合作共享和更加公正合理；主功能是全球治理方向 人类命运共同体作为中国理念交叉引用；统一使用共商共建共享 不继承ClaudeCode原始条目的共建共商共享错序；不要压缩成中国方案或全球治理正确方向,candidate_with_fixes,2025丰台二模_Q20_SRC_1543d8baa151;2025丰台二模_Q20_SRC_770de383c911,scoring_atom_table_batch04F_fengtai_prelim.csv,政治多极化,共商共建共享的全球治理观
ATOM-MTG01,经济全球化,中国市场成为世界市场并与各国共享发展机遇，推动经济全球化朝互利共赢和开放包容普惠平衡共赢方向发展,广大而充满创新活力的市场；超大规模市场红利；共享发展机遇；贸易投资自由化便利化；开放、包容、普惠、平衡、共赢,2025门头沟一模 Q19,角度一每条2分中的经济赋能1+1,P0_formal_scoring_rule_doc,formal_scoring_doc_with_paper_text_support,材料写中国市场成为世界市场 最不发达国家零关税和外资准入清零 回答世界意义要说明市场红利和全球化方向,中国为世界提供广大而充满创新活力的市场 与各国共享发展机遇 促进贸易投资自由化便利化 推动经济全球化朝着更加开放、包容、普惠、平衡、共赢的方向发展,merge_with_open_inclusive_universal_balanced_winwin_globalization,充分利用两个市场两种资源在本题明确不给分 不得作为本题核心；必须保留市场红利+共享发展机遇+全球化方向的解释链,candidate_with_fixes,2025门头沟一模_Q19_SRC_70713581c0c6;2025门头沟一模_Q19_SRC_41b9c310bed6,scoring_atom_table_batch04G_mengtougou_prelim.csv,经济全球化,推动经济全球化朝着更加开放、包容、普惠、平衡、共赢方向发展
ATOM-MTG02,中国,中国以科技助力发展中国家发展，提升自主发展能力、改善民生并促进全球可持续发展,技术赋能；发展中国家；全球南方；自主发展能力；民生改善；全球可持续发展；解决全球发展不平衡,2025门头沟一模 Q19,角度二每条2分中的技术共享和民生改善1+1,P0_formal_scoring_rule_doc,formal_scoring_doc_with_paper_text_support,材料写雅万高铁 沙漠灌溉 小豆子项目 触发中国技术助力发展中国家发展和改善民生,中国以创新优势和领先技术助力发展中国家发展 提升其自主发展能力 促进民生改善 为全球可持续发展贡献力量,merge_with_china_global_south_development_support,不能只写中国技术先进；必须写对发展中国家自主发展和民生/可持续的世界意义,candidate_with_fixes,2025门头沟一模_Q19_SRC_70713581c0c6;2025门头沟一模_Q19_SRC_41b9c310bed6,scoring_atom_table_batch04G_mengtougou_prelim.csv,中国,国际发展合作、南南合作与“小而美”项目
ATOM-MTG03,中国,中国提供国际公共产品并贡献中国智慧中国方案，以实际行动维护世界和平、促进共同发展、推动构建人类命运共同体,国际公共产品；中国智慧中国方案；维护世界和平；促进共同发展；人类命运共同体,2025门头沟一模 Q19,角度三每条2分中的全球治理实践路径1+1,P0_formal_scoring_rule_doc,formal_scoring_doc_with_paper_text_support,材料写地球生命共同体 人工智能能力建设普惠计划 全球安全倡议 触发中国提供全球公共产品和全球治理实践路径,中国提供国际公共产品 贡献中国智慧和中国方案 以实际行动维护世界和平、促进共同发展 推动构建人类命运共同体,merge_with_public_goods_china_solution_hmc,国际公共产品/中国智慧中国方案是1分槽 维护和平促进发展/HMC是另1分槽 同角度保留1+1 不拆成多个独立频次,candidate_with_fixes,2025门头沟一模_Q19_SRC_70713581c0c6;2025门头沟一模_Q19_SRC_41b9c310bed6,scoring_atom_table_batch04G_mengtougou_prelim.csv,中国,推动构建人类命运共同体
ATOM-MTG04,政治多极化,倡导文明平等互鉴、弘扬全人类共同价值，推动国际秩序和全球治理体系向更加公正合理方向发展,文明平等互鉴；全人类共同价值；国际秩序更加公正合理；全球治理体系更加公正合理；国际政治新秩序；合作共赢的新型国际关系,2025门头沟一模 Q19,角度四每条2分中的国际治理价值体系1+1,P0_formal_scoring_rule_doc,formal_scoring_doc_with_paper_text_support,材料写发展道路多样化和现代化道路一个都不能少 触发文明平等互鉴和国际秩序价值方向,中国倡导文明平等互鉴 弘扬全人类共同价值 推动国际秩序和全球治理体系向着更加公正合理的方向发展 并推动共建以合作共赢为核心的新型国际关系,merge_with_civilization_value_and_global_governance_order_fair_reasonable,国家关系民主化、世界多极化、多边主义在本题明确不给分；文明平等互鉴/全人类共同价值与DC04同表达家族但本题是独立1分子点 必须保留；不能用这些低信息标签替代文明互鉴+共同价值+公正合理秩序,candidate_with_fixes,2025门头沟一模_Q19_SRC_70713581c0c6;2025门头沟一模_Q19_SRC_41b9c310bed6,scoring_atom_table_batch04G_mengtougou_prelim.csv,政治多极化,推动建设相互尊重、公平正义、合作共赢的新型国际关系
ATOM-MTG26-01,中国,坚持对外开放基本国策和互利共赢开放战略，以高水平对外开放主动顺应并推动经济全球化,对外开放基本国策；互利共赢战略；经济全球化；高水平对外开放；高水平制度型开放,2026门头沟一模 Q20,原因2分,P0_formal_scoring_rule_docx,formal_scoring_docx_with_paper_text_support,设问问为何能注入新动能和新活力 需要先用开放政策和经济全球化解释封关的理论原因,海南自贸港全岛封关是我国坚持对外开放基本国策、实施互利共赢开放战略、推进高水平对外开放的重要举措，有利于主动顺应并推动经济全球化发展,merge_with_china_high_level_opening_and_globalization_cause,原因2分是综合术语阐释 不能只堆概念；必须接上海南自贸港封关背景,candidate_with_fixes,2026门头沟一模_Q20_SRC_f6e59c8eee71;2026门头沟一模_Q20_SRC_e34a259c7765,scoring_atom_table_batch04H_mengtougou2026_prelim.csv,经济全球化,建设开放型世界经济，参与全球经济治理和规则制定
ATOM-MTG26-02,经济全球化,封关通过扩大零关税范围、降低企业成本和优化通关管理，促进贸易自由化便利化并提升开放便利度,零关税商品范围；降低企业成本；径予放行；压缩申报项目；贸易自由化便利化；营商环境,2026门头沟一模 Q20,中国意义2分中的材料点一和点三,P0_formal_scoring_rule_docx,formal_scoring_docx_with_paper_text_support,材料写零关税范围扩大 进口商品径予放行 二线申报项目压缩 触发贸易便利化和营商环境,封关扩大零关税商品范围、降低企业成本，优化口岸管理并压缩通关时间，能够促进贸易自由化便利化、提升营商环境，为中国经济发展注入新动能,merge_with_trade_liberalization_facilitation_hainan_scenario,这是中国侧意义 不能只写世界开放；也不能把贸易自由化便利化抽空成低信息标签,candidate_with_fixes,2026门头沟一模_Q20_SRC_f6e59c8eee71;2026门头沟一模_Q20_SRC_e34a259c7765,scoring_atom_table_batch04H_mengtougou2026_prelim.csv,经济全球化,推动贸易和投资自由化便利化
ATOM-MTG26-03,中国,封关以加工增值和国内国际双循环联动培育开放型经济新优势，带动产业集聚、产业链升级和新质生产力,加工增值政策；产业集聚；产业链升级；新质生产力；国内国际双循环；国内国际两种市场两种资源联动；开放型经济新优势,2026门头沟一模 Q20,中国意义2分中的材料点二和点四,P0_formal_scoring_rule_docx,formal_scoring_docx_with_paper_text_support,材料写加工增值达到30%免关税销往内地 一线放开二线管住 触发双循环联动和开放型经济新优势,封关通过加工增值政策吸引产业集聚、推动产业链升级，增强国内国际双循环联动和两种市场两种资源联动，培育开放型经济新优势,merge_with_dual_circulation_open_economy_advantage,新质生产力是材料意义表述 不把它扩展成《经济与社会》主线；两种市场两种资源联动在本题中国侧正面赋分 但不得迁移到世界意义题裸写,candidate_with_fixes,2026门头沟一模_Q20_SRC_f6e59c8eee71;2026门头沟一模_Q20_SRC_e34a259c7765,scoring_atom_table_batch04H_mengtougou2026_prelim.csv,经济全球化,充分利用国内国际两个市场、两种资源，增强国内国际循环联动
ATOM-MTG26-04,经济全球化,封关扩大市场准入并推动制度型开放，为世界提供更大市场空间和高水平开放新范例,扩大市场准入；更大市场空间；制度型开放；高水平开放新范例；中国开放机遇,2026门头沟一模 Q20,世界意义2分中的材料点一和点二,P0_formal_scoring_rule_docx,formal_scoring_docx_with_paper_text_support,材料写清单管理透明度和开放度提升 取消许可证管理 允许保税维修 触发市场准入和制度型开放示范,封关扩大市场准入，为世界提供更大市场空间，并以制度型开放为全球提供高水平开放新范例，为世界经济开放发展注入新活力,merge_with_institutional_opening_world_market_space,世界侧意义必须单独写出；不能只停在中国发展新动能,candidate_with_fixes,2026门头沟一模_Q20_SRC_f6e59c8eee71;2026门头沟一模_Q20_SRC_e34a259c7765,scoring_atom_table_batch04H_mengtougou2026_prelim.csv,经济全球化,建设开放型世界经济，参与全球经济治理和规则制定
ATOM-MTG26-05,经济全球化,封关稳定全球产业链供应链、深化国际分工与合作，推动建设开放型世界经济,全球产业链供应链稳定畅通；国际分工与合作；开放型世界经济；世界经济开放发展,2026门头沟一模 Q20,世界意义2分中的材料点三和点四,P0_formal_scoring_rule_docx,formal_scoring_docx_with_paper_text_support,材料写一线放开二线管住 货物贸易开放度和透明度提升 触发供应链稳定和国际分工合作,封关有利于促进全球产业链供应链稳定畅通，深化国际分工与合作，推动建设开放型世界经济,merge_with_open_world_economy_and_supply_chain_stability,开放型世界经济必须保留完整表达 不合并成模糊的经济全球化正确方向,candidate_with_fixes,2026门头沟一模_Q20_SRC_f6e59c8eee71;2026门头沟一模_Q20_SRC_e34a259c7765,scoring_atom_table_batch04H_mengtougou2026_prelim.csv,经济全球化,促进生产要素全球流动、资源优化配置、优势互补和国际分工合作
ATOM-FT26-01,中国,中国秉持人类命运共同体理念并坚持胸怀天下，携手各国落实联合国2030年可持续发展议程，做全球发展的贡献者,人类命运共同体；胸怀天下；联合国2030年可持续发展议程；全球发展的贡献者；全球可持续发展,2026丰台一模 Q19,PPTX slide42 paragraph1 guarded,P0_scoring_pptx_reference_answer_guarded,scoring_pptx_reference_answer_without_point_slots,材料写联合国发展峰会和2030年可持续发展议程 中国在减贫教育卫生领域作出贡献 触发HMC和全球发展贡献者,中国秉持人类命运共同体理念 坚持胸怀天下 携手各国落实联合国2030年可持续发展议程 做全球发展的贡献者,merge_with_hmc_china_global_development_contributor,不把slide42当逐点细则；作为高信息表述积累 guarded,candidate_with_guard,2026丰台一模_Q19_SRC_44f3b42c2caf;2026丰台一模_Q19_SRC_31e84e4e2ec2,scoring_atom_table_batch04I_fengtai2026_prelim.csv,中国,中国特色大国外交、独立自主和平外交政策与周边命运共同体
ATOM-FT26-02,联合国,中国维护联合国宪章宗旨和原则并落实联合国2030年可持续发展议程,联合国宪章的宗旨和原则；联合国2030年可持续发展议程；联合国发展峰会,2026丰台一模 Q19,PPTX slide42 paragraph1-2 guarded,P0_scoring_pptx_reference_answer_guarded,scoring_pptx_reference_answer_without_point_slots,材料与答案均出现联合国发展峰会 2030议程 联合国宪章宗旨原则 触发联合国框架下中国担当,中国坚定维护联合国宪章的宗旨和原则 携手各国落实联合国2030年可持续发展议程,merge_with_un_charter_and_un2030_sustainable_development,联合国2030议程是本题高信息场景 不等同于一般联合国关键词,candidate_with_guard,2026丰台一模_Q19_SRC_44f3b42c2caf;2026丰台一模_Q19_SRC_31e84e4e2ec2,scoring_atom_table_batch04I_fengtai2026_prelim.csv,联合国,《联合国宪章》宗旨和原则
ATOM-FT26-03,中国,中国坚持正确义利观、真正的多边主义与合作共赢，扩大同各国利益汇合点,正确义利观；真正的多边主义；合作共赢；扩大同各国利益的汇合点；共同利益,2026丰台一模 Q19,PPTX slide42 paragraph2 guarded,P0_scoring_pptx_reference_answer_guarded,scoring_pptx_reference_answer_without_point_slots,全球可持续发展需要兼顾各国利益 答案明确正确义利观 真正多边主义 合作共赢 利益汇合点,中国坚持正确义利观 积极践行真正的多边主义 坚持合作共赢 致力于扩大同各国利益的汇合点,merge_with_correct_yili_true_multilateralism_common_interests,真正的多边主义和正确义利观要保留完整 不压缩成多边主义或义利观短标签,candidate_with_guard,2026丰台一模_Q19_SRC_44f3b42c2caf;2026丰台一模_Q19_SRC_31e84e4e2ec2,scoring_atom_table_batch04I_fengtai2026_prelim.csv,政治多极化,推动国际关系民主化，坚持真正的多边主义，推动国际秩序朝公正合理方向发展
ATOM-FT26-04,政治多极化,中国坚持共商共建共享的全球治理观并以可持续发展成就展现负责任大国担当,共商共建共享的全球治理观；全球治理；全球可持续发展；负责任大国；大国情怀与担当,2026丰台一模 Q19,PPTX slide42 paragraph3 guarded,P0_scoring_pptx_reference_answer_guarded,scoring_pptx_reference_answer_without_point_slots,材料列出中国减贫教育卫生成就和国际合作 答案落到共商共建共享全球治理观和负责任大国担当,中国坚持共商共建共享的全球治理观 以减贫、教育普及、卫生健康等领域成就和国际合作 展现对全球可持续发展的积极贡献和负责任大国担当,merge_with_global_governance_view_responsible_major_country,共商共建共享保留正确词序且后缀必须为全球治理观；本题是表达积累 guarded 不是逐点评分主频,candidate_with_guard,2026丰台一模_Q19_SRC_44f3b42c2caf;2026丰台一模_Q19_SRC_31e84e4e2ec2,scoring_atom_table_batch04I_fengtai2026_prelim.csv,政治多极化,共商共建共享的全球治理观
ATOM-YQ26-01,理论,共同利益是国家间合作的基础 / 维护国家利益是主权国家对外活动的出发点 / 正确的义利观,共同利益；维护国家利益；正确的义利观；能源治理利益共同体,2026延庆一模 Q19(2),评分细则理论逻辑①国家利益角度 1+1中的一组角度,P0_formal_scoring_rule_docx,formal_scoring_docx_with_visual_paper_prompt,设问问理论逻辑 实质是在问绿色能源合作为什么能成立 中国与共建国家在能源开发利用绿色转型和可持续发展上存在共同利益,国家间共同利益是国家合作的基础 中国与共建国家在绿色能源开发利用和可持续发展上存在共同利益 中国坚持正确义利观 推动形成能源治理利益共同体,merge_with_common_interest_and_correct_yili_distinguish_function,共同利益解释合作成立 正确义利观解释中国怎样合作 二者同属本题国家利益角度但在总框架中需分功能积累; A/B closure completed and guarded status preserved,candidate_with_fixes,2026延庆一模_Q19_2_SRC_5bf6b7387198;2026延庆一模_Q19_2_SRC_944b03f9c3be,scoring_atom_table_batch04J_yanqing2026_prelim.csv,中国,推动构建人类命运共同体
ATOM-YQ26-02,时代背景,时代主题 / 经济全球化趋势,和平发展合作共赢的历史潮流；经济全球化进程；融入经济全球化,2026延庆一模 Q19(2),评分细则理论逻辑②历史潮流角度 1+1中的一组角度,P0_formal_scoring_rule_docx,formal_scoring_docx_with_visual_paper_prompt,设问问理论逻辑 绿色能源国际合作跨越国界并以一带一路为平台推动技术资金产品和治理经验流动 触发时代主题与经济全球化趋势,中国深化绿色能源国际合作 顺应和平发展合作共赢的历史潮流 推动自身与共建国家融入经济全球化进程,merge_with_times_theme_and_globalization_trend_with_crossref,主桶放时代背景 同时在经济全球化桶交叉积累“融入经济全球化进程” 不拆成两个并列频次; A/B closure completed and guarded status preserved,candidate_with_fixes,2026延庆一模_Q19_2_SRC_5bf6b7387198;2026延庆一模_Q19_2_SRC_944b03f9c3be,scoring_atom_table_batch04J_yanqing2026_prelim.csv,中国,国际发展合作、南南合作与“小而美”项目
ATOM-YQ26-03,政治多极化,共商共建共享的全球治理观,共商共建共享；全球治理观；指标共商 策略共研 成效共评；能源治理多边协同转型,2026延庆一模 Q19(2),评分细则价值意蕴 1点2分 2点4分 可选点之一,P0_formal_scoring_rule_docx,formal_scoring_docx_with_visual_paper_prompt,材料中绿色发展指数被多国采用并成为联合国环境署参考标准 又形成指标共商策略共研成效共评机制 触发共商共建共享的全球治理观,中国推动绿色发展指数被多国采用并成为联合国环境署参考标准 践行共商共建共享的全球治理观 推动全球能源治理向多边协同转型,merge_with_global_governance_view_core,必须保留后缀“全球治理观” 不能写成发展理念或发展格局; A/B closure completed and guarded status preserved,candidate_with_fixes,2026延庆一模_Q19_2_SRC_5bf6b7387198;2026延庆一模_Q19_2_SRC_944b03f9c3be,scoring_atom_table_batch04J_yanqing2026_prelim.csv,政治多极化,共商共建共享的全球治理观
ATOM-YQ26-04,政治多极化,相互尊重、公平正义、合作共赢的新型国际关系,新型国际关系；相互尊重；公平正义；合作共赢；一带一路绿色能源合作,2026延庆一模 Q19(2),评分细则价值意蕴 1点2分 2点4分 可选点之一,P0_formal_scoring_rule_docx,formal_scoring_docx_with_visual_paper_prompt,中国以一带一路为载体与巴基斯坦肯尼亚等国开展绿色基建能源转型和技术合作 体现平等合作与共同受益 触发新型国际关系完整五词,中国以“一带一路”为平台同共建国家开展绿色基建和能源转型合作 推动构建相互尊重、公平正义、合作共赢的新型国际关系,merge_with_new_type_ir_cooperation_winwin_core,保留完整“相互尊重、公平正义、合作共赢” 不压成“新型国际关系”短标签; A/B closure completed and guarded status preserved,candidate_with_fixes,2026延庆一模_Q19_2_SRC_5bf6b7387198;2026延庆一模_Q19_2_SRC_944b03f9c3be,scoring_atom_table_batch04J_yanqing2026_prelim.csv,政治多极化,推动建设相互尊重、公平正义、合作共赢的新型国际关系
ATOM-YQ26-05,中国,人类命运共同体,人类命运共同体；全球能源可持续发展；具有公共产品属性的中国方案,2026延庆一模 Q19(2),评分细则价值意蕴 1点2分 2点4分 可选点之一；答案段含公共产品属性中国方案表达,P0_formal_scoring_rule_docx,formal_scoring_docx_with_visual_paper_prompt,材料说中国携手各国共建可持续发展的未来 并为其他国家提供发展与保护平衡的可复制方案 触发人类命运共同体和中国方案表达,中国以绿色能源合作为全球能源可持续发展提供具有公共产品属性的中国方案 推动构建人类命运共同体,merge_with_hmc_and_china_solution_expression_pool,人类命运共同体为正式评分点 中国方案在答案段出现但不作为独立评分槽；主放中国桶并交叉引用政治多极化; A/B closure completed and guarded status preserved,candidate_with_fixes,2026延庆一模_Q19_2_SRC_5bf6b7387198;2026延庆一模_Q19_2_SRC_944b03f9c3be,scoring_atom_table_batch04J_yanqing2026_prelim.csv,中国,推动构建人类命运共同体
