atom_id,bucket,core_point,expression_variant,source_question,scoring_position,evidence_level,source_boundary,material_trigger_fusion,answer_sentence_fusion,merge_action,boundary_note,promotion_status,source_ledger_refs
ATOM-E01,经济全球化,推动贸易投资自由化便利化,贸易投资便利化；贸易投资自由化,2024海淀一模 Q18(1),Q18(1)措施加知识替代表,P0_formal_scoring_rule_text,formal_scoring_docx_with_paper_text_support,扩大免签和口岸签证便利中外人员往来并服务高水平对外开放时触发贸易投资便利化自由化,便利中外人员往来能够降低来华旅游商务投资创业等活动成本 促进贸易投资便利化自由化,merge_with_existing_trade_investment_facilitation,do_not_count_Q17_loose_opening_phrase,candidate_with_fixes,2024海淀一模_Q18_SRC_24a14c0c2355;2024海淀一模_Q18_SRC_22a9fc350542
ATOM-E02,经济全球化,吸引全球资源要素自由流动；充分利用国际国内两种资源两个市场,商品服务技术资金劳务要素自由流动；两个市场两种资源；国内国际双循环,2024海淀一模 Q18(1),Q18(1)措施加知识替代表,P0_formal_scoring_rule_text,formal_scoring_docx_with_paper_text_support,免签便利和支付便利等措施促进跨境人员商务往来进而带动全球资源要素流动和市场联通,中外人员往来更加便利 有利于吸引商品服务技术资金劳务等全球资源要素自由流动 充分利用国际国内两种资源两个市场,merge_with_two_markets_two_resources_and_factor_flow,keep_high_information_phrase_not_compress_to_opening,candidate_with_fixes,2024海淀一模_Q18_SRC_24a14c0c2355;2024海淀一模_Q18_SRC_22a9fc350542
ATOM-E03,经济全球化,扩大制度型开放；更好利用国内国际两个市场两种资源,制度型开放；高水平对外开放；两个市场两种资源；产业链竞争力,2026海淀一模 Q20,Q20结构化答案第1层,P1_structured_answer_in_scoring_file_plus_P3_visual_prompt,structured_answer_pdf_plus_visual_prompt_support,题面写国际标准是全球产业界通用语言并说明中国标准走出国门融入全球产业发展体系 触发制度型开放和两个市场两种资源,中国标准走出国门有利于扩大制度型开放 推进高水平对外开放 更好利用国内国际两个市场两种资源 增强产品服务和产业链全球竞争力,merge_with_two_markets_two_resources_as_standard_rule_variant,keep_P1_plus_P3_not_auto_P0_after_visual_prompt_check,candidate_with_fixes,2026海淀一模_Q20_SRC_14176e949dd0;2026海淀一模_Q20_SRC_184e191a3ddd
ATOM-E04,经济全球化,积极参与全球经济治理和规则制定，推动全球治理体制更加公正合理,国际标准贡献；标准共通；技术共享；全球经济治理规则制定,2026海淀一模 Q20,Q20结构化答案第2层,P1_structured_answer_in_scoring_file_plus_P3_visual_prompt,structured_answer_pdf_plus_visual_prompt_support,题面呈现中国在低碳能源人工智能等领域提交国际标准提案和发布国际标准 触发规则标准和全球经济治理参与,中国在低碳能源人工智能等领域贡献国际标准 促进标准共通和技术共享 积极参与全球经济治理和规则制定 推动全球治理体制向更加公正合理方向发展,merge_with_global_economic_governance_rulemaking,keep_P1_plus_P3_not_auto_P0_and_do_not_genericize_standard_material,candidate_with_fixes,2026海淀一模_Q20_SRC_14176e949dd0;2026海淀一模_Q20_SRC_184e191a3ddd
ATOM-E-B01,开放题迁移,时代主题；世界多极化；人类命运共同体；国际组织,开放述评可选角度,2024海淀二模 Q18(1),Q18(1)宽泛答案角度,P1_answer_in_scoring_file_needs_boundary,answer_only_open_comment_no_detailed_rubric,民主与全球治理述评题给出宽泛可选角度 不能当作严格评分原子,开放述评中可围绕世界多极化和全球治理代表性不足说明推动人类命运共同体和国际组织改革的意义,boundary_only_open_transfer,not_counted_as_frequency_or_core_atom,boundary_only,2024海淀二模_Q18_1_SRC_e6f22d1048fc;2024海淀二模_Q18_1_SRC_a83c70cbad37
ATOM-E-B02,参考边界,开放战略；贸易自由化便利化；绿色贸易数字贸易；互利共赢,参考答案支持加负向评分警示,2025海淀一模 Q21(2),Q21(2)参考答案与学生错误提醒,P1_reference_plus_P0_marking_caution,reference_answer_not_formal_rubric,外贸进出口增长材料可触发开放战略和贸易便利化 但细则文件主要提示不要堆政治多极化独立自主等错误方向,我国实施更加积极主动的开放战略 促进贸易自由化便利化 发展绿色贸易数字贸易 依托超大规模市场优势实现互利共赢,boundary_reference_support_only,positive_answer_not_promoted_to_P0;negative_warning_kept_as_boundary,reference_only,2025海淀一模_Q21_2_SRC_a043a3fcb259;2025海淀一模_Q21_2_SRC_20820628be28
ATOM-E-B03,参考边界,全球治理倡议五大理念；联合国宪章；共商共建共享全球治理观,全球治理倡议参考迁移,2026海淀期中 Q22,Q22纸面答案无正式细则,P3_paper_answer_doc_no_scoring_source,paper_answer_only_no_scoring_source,全球治理倡议题面和答案有迁移价值但未定位正式评分细则,全球治理倡议顺应和平与发展 奉行主权平等遵守国际法治践行多边主义 捍卫联合国宪章宗旨和原则 秉持共商共建共享全球治理观,boundary_reference_transfer_only,do_not_count_as_P0_frequency_until_scoring_source_found,reference_only,2026海淀期中_Q22_SRC_647418e573f7
