target_id,suite_id,qno,section_scope_from_A,codexA_choice_precheck_result,detected_answer,option_coverage,logic_term_hits,other_book_hits,paper_source_id,answer_source_ids_checked,paper_snippet,answer_source_snippet,student_permission
Q-2025西城二模-7,S-2025西城二模,7,推理,CODEX_A_CHOICE_ANSWER_OPTIONS_CANDIDATE,C,ABCD①②③④,推理;演绎,,037_Desktop_2025模拟题_2025各区二模_2025西城二模_试卷_试卷.pdf,038_Desktop_2025模拟题_2025各区二模_2025西城二模_细则_细则.docx;039_GaokaoPolitics_2025各区模拟题_2025各区二模_2025西城二模_讨论定稿-答案细则_-25.5西城高三政治二模-1.docx,B．景山公园：北京市 C．谷雨：节气 D．红楼梦：四大名著 7．花粉是导致一些人出现过敏症状的常见因素。 ▪ 只有接触过敏源，才会引发过敏。某病人未接触过花粉，甲医生据此断定其症状不属于花粉过敏。 ▪ 某病人一到春天开花季，就会出现咳嗽等症状，过了开花季，症状就消失。乙医生据此断定其症状由花 粉过敏引起。 ▪ 某中年女性被确诊为花粉过敏型哮喘，丙医生据此推断另一名年纪相仿女性出现的哮喘也应该是花粉过 敏引起的。 从逻辑学的角度看 ①甲医生运用了演绎法，推理结构正确能确保这类推理得出正确结论 ②乙医生正确运用了求异法，但其结论不具有必然性 ③与乙、丙相比，甲医生的推理方式在科学领域更有利于得出新结论 ④三名医生结论的可信度由高到低依次应该是甲、乙、丙 A．①② B． ①③ C．②④ D． ③④ ===== PAGE 3 ===== 第3页/共10页 8．新修改的《中华人民共和国全国人民代表大会和地方各级人民代表大 会代表法》拓展和深化了“两个联系”制度机制，即密切国家机关同 人大代表的联系，密切人大代表同人民群众的联系。拓展和深化“两 个联系”制度机制 ①突出了法在国家治理中的社会职能 ②强化了人大常设机关与“一府一委两院”的关系 ③细化了人大代表的履职规范，突出了对代表履职的 政治要求 ④有利于充分发挥代表作用，坚持好、完善好、运行好人民代表大会制度 A．①② B． ①③,038_Desktop_2025模拟题_2025各区二模_2025西城二模_细则_细则.docx: 城 区 高 三 模 拟 测 试 试 卷 思想政治答案及评分参考 2025.5 第一部分共 15 题，每题 3 分，共 45 分。 1．A 2．D 3．A 4．C 5．B 6．C 7．C 8．D 9．D 10．C 11．A 12．B 13．A 14．D 15．B 第二部分共 5 题，共 55 分。 16．（14分） （1）（6分）可从尊重规律、正确发挥主观能动性、具体问题具体分析、树立正确的生态价值观等角度作答。 如：角度1：把发挥主观能动性与尊重客观规律相结合。规律是客观的，人们正确发挥意识的能动作用，认识和把握自然规律，有效地指导生态保护的实践，把废弃水井变成了动物乐园。 角度2：具体问题具体分析。在矛盾普遍性原理的指导下，分析矛盾的特殊性，找到解决问题的办法。管理处工作人员充分利用村落遗址的条件，具体分析不同体型动物的需求特点，营造攀爬台阶和蓄水池，化不利为有利，实现了生态保护的目的。 角度3：发挥价值观的导向作用。价值观对人们认识改造世界的活动有重要的导向作用，影响人们对事物的评价和行为选择。工作人员树立了人与自然和谐的生态价值观，尊重自然、保护自然，有效保护了生物多样性。 其他合理角度，言之有理，参照以上标准。 【细则】 3分 以上任意一个角度，观点1分，对应的展开+材料解释2分 6分 以上任意两个角度，都能深入分析 得6分 说明：一点未深入分析得2分；两点均未深入分析得4分；写三点均未深入分析得4-5分； 其他情况0~2分。 （2）（4分）无法确定一定有岩松鼠行动。（1,NO_STUDENT_DRAFT
Q-2026东城一模-6,S-2026东城一模,6,交叉,CODEX_A_CHOICE_ANSWER_OPTIONS_CANDIDATE,B,ABCD①②③④,,,046_Desktop_2026模拟题_2026各区一模_2026东城一模_试卷_试卷.pdf,048_Desktop_2026模拟题_2026各区一模_2026东城一模_细则_细则.pdf;049_Desktop_2026模拟题_2026各区一模_2026东城一模_细则_分题细则_东城一模评标细则_勿传__16.pptx;050_Desktop_2026模拟题_2026各区一模_2026东城一模_细则_分题细则_东城一模评标细则_勿传__17.pptx;051_Desktop_2026模拟题_2026各区一模_2026东城一模_细则_分题细则_东城一模评标细则_勿传__18_选择7_13.pptx;052_Desktop_2026模拟题_2026各区一模_2026东城一模_细则_分题细则_东城一模评标细则_勿传__19_1_.pptx;053_Desktop_2026模拟题_2026各区一模_2026东城一模_细则_分题细则_东城一模评标细则_勿传__19_2_.pptx;054_Desktop_2026模拟题_2026各区一模_2026东城一模_细则_分题细则_东城一模评标细则_勿传__19_3_.pptx;055_Desktop_2026模拟题_2026各区一模_2026东城一模_细则_分题细则_东城一模评标细则_勿传__19_4_.pptx;056_Desktop_2026模拟题_2026各区一模_2026东城一模_细则_分题细则_东城一模评标细则_勿传__20.pptx,===== PAGE 1 ===== 第1页/共10页 2026 北京东城高三一模 政 治 2026.4 本试卷共10 页，共100 分。考试时长90 分钟。考生务必将答案答在答题卡上，在试卷上作 答无效。考试结束后，将本试卷和答题卡一并交回。 第一部分选择题 本部分共15 题，每题3 分，共45 分。在每题列出的四个选项中，选出最符合题目要求的一 项。 1．2025 年，面对复杂严峻的国内外环境，我国经济交出“六字”亮眼成绩单，展现强劲韧性与活力。 对这份成绩单的看法正确的有 ①在党的全面领导下，制度优势转化为经济治理效能 ②以生产关系的根本改变夯实粮食安全和产业优化的基础 ③只有一切从实际出发，实事求是，才能持续向新向优 ④破解发展中的难题与挑战始终是我们的奋斗目标 A．①② B．①③ C．②④ D．③④ 2．北京隆福寺街区老字号餐饮、文创产品、新式饮品深受年轻群体青睐。潮流市集，非遗沉浸体验，机 器人注入科技活力，老街区成为兼具烟火气与时尚感的城市地标。这表明 ①传统商业与新型消费场景深度融合，有效释放消费潜力 ②挖掘传统文化的经济价值，是实现文化传承的必要前提 ③文化与经济的对立统一推动街区业态迭代与功能升级 ④时尚潮流引领科技创新，文化繁荣激活城市内生动力 A．①③ B．①④ C．②③ D．②④ 3．北京市某中学生团队自主研发的“脑电智慧轮椅”，历时四年攻关，为渐冻症患者及残障人士带来了自 主出行的新可能。该团队学生代表在国际舞台上与各国青年进行了成果交流。从课堂到国际舞台，北京青 年 ①以科技创新积极推动教育对外开放，主动讲好中国故事 ②在国际对话交流中拓宽全球视,048_Desktop_2026模拟题_2026各区一模_2026东城一模_细则_细则.pdf: ===== PAGE 1 ===== ===== PAGE 2 ===== ===== PAGE 3 ===== ===== PAGE 4 ===== ===== PAGE 5 ===== ===== PAGE 6 ===== ===== PAGE 7 ===== ===== PAGE 8 ===== ===== PAGE 9 ===== ===== PAGE 10 ===== ===== PAGE 11 ===== ===== PAGE 12 ===== ===== PAGE 13 ===== ===== PAGE 14 ===== ===== PAGE 15 ===== ===== PAGE 16 ===== || 049_Desktop_2026模拟题_2026各区一模_2026东城一模_细则_分题细则_东城一模评标细则_勿传__16.pptx: ===== SLIDE 1 ===== 2025-2026B东城高三政治综合练习（一） 主观题细则 2026.4 ===== SLIDE 2 ===== 16.（7 分） 文艺是时代前进的号角。 当今时代，大众情绪多样复杂、变化迅速，时代情感则恢弘深沉、浸润人心。 （配图：文艺晚会、电视剧台词 “道之所在，虽千万人，吾往矣。若一去不回，便一去不回”、诗集《手持人间一束光》） 一场饱含深沉家国之兴的文艺晚会，一部彰显 “若一去不回，便一去不回” 烈士豪情的电视剧，一本洋溢着 “劳动者之歌” 情怀的诗集…… 这些文艺作品，因贴近大众情绪,NO_STUDENT_DRAFT
Q-2026顺义一模-5,S-2026顺义一模,5,交叉,CODEX_A_CHOICE_NEEDS_ANSWER_SOURCE,,①②③④,,,001_Desktop_2026模拟题_2026各区一模_2026顺义一模_试卷_试卷.pdf,002_Desktop_2026模拟题_2026各区一模_2026顺义一模_细则_细则.pptx,误信息ꎬ科技公司就应承担赔偿责任 ③用户对ＡＩ生成信息负有合理核实义务ꎬ未尽注意义务导致的损失应自行承担 ④法院判决既鼓励生成式人工智能服务的创新发展ꎬ也保护当事人的合法权益 Ａ􀆰①③ Ｂ􀆰①④ Ｃ􀆰②③ Ｄ􀆰②④ ===== PAGE 5 ===== 高三思想政治试卷 第５ 页(共１０页) １１􀆰９岁的小江ꎬ在母亲陈某的监护下从事童模工作ꎬ拍摄的 多张具有商业价值照片发布在社交平台ꎮ某服饰公司在 其网店中ꎬ擅自将小江肖像照片用于童装商品的宣传页 面ꎬ陈某向法院提起诉讼ꎬ该公司辩称“图片来源于网络ꎬ 误以为是可以免费使用的素材ꎬ且使用范围有限ꎬ未造成 严重影响”ꎮ对此ꎬ以下理解正确的是 ①小江属于限制民事行为能力人ꎬ因此应由被告承担举证责任 ②陈某如果缺乏法律知识与技能ꎬ可委托辩护人帮助其进行诉讼 ③未经监护人同意就擅自使用来源于网络的未成年人肖像进行商业宣传ꎬ构成侵权 ④本案属于涉未成年人人格权纠纷ꎬ陈某可以代理小江要求公司停止侵害并赔偿损失 Ａ􀆰①② Ｂ􀆰①③ Ｃ􀆰②④ Ｄ􀆰③④ １２􀆰新时代以来ꎬ在党中央坚强领导下ꎬ我国走出了一条基础研究高质量发展之路ꎬ基础研 究整体水平迈上新台阶ꎮ“人造太阳”ＥＡＳＴ创造“亿度千秒”世界纪录ꎬ未来一旦实现应 用ꎬ将彻底改变世界能源格局ꎬ保障我国未来能源安全ꎻ钍基熔盐堆建成ꎬ为我国能源安 全提供全新解决方案ꎮ下列说法正确的是 ①通过强化基础研究ꎬ有助于提升产业链供应链韧性ꎬ为高质量发展注入新动能 ②这标志着我国经济发展的动力已由传统要素驱动转向全要素生产率的单独驱动 ③我国科技资源的配置已经完全市场化ꎬ企业在技术创新中的主体地位已经确立 ,002_Desktop_2026模拟题_2026各区一模_2026顺义一模_细则_细则.pptx: 的原则、首要原则保护劳动者的合法权益） ③事实依据：该公司因性别对求职者进行差别对待，属于就业歧视，（任意一个1分）违反公平、平等原则， （1分） 损害了闫某平等地获得就业机会的权益。（任意一个1分） （共2分） ===== SLIDE 5 ===== ①表态：张某不能获得法院支持。（1分） ②法律依据：根据竞业限制协议，张某应按照约定履行竞业限制义务。 （1分）（替代：全面、正确履行协议/劳动合同法） ③事实依据：张某之妻作为B公司投资人，其投资行为发生在张某从A公司离职后，而且在经营业务上与A公司存在竞争关系，属于竞业限制单位。（1分）张某与配偶在婚姻关系存续期间的生产、经营所得属于夫妻共同财产，具有利益一致性。 (替代：B公司的关联公司为张某缴纳社保，存在利益关系）（共2分） 18题评分细则 主体2张某 两个案件共同价值意义：有利于引导劳动者坚持权利义务相统一，在维护自身劳动群益的同时，也要承担相应的义务，有利于平衡劳动者和用人单位利益，构建和谐劳动关系（可加1分，满分不超过8分） ===== SLIDE 6 ===== 19（1）“十五五”开局之年，我国将加快培育和发展未来产业，以现代化产业新优势把握未来发展主动权。 材料一 未来产业由前沿技术驱动，具有前瞻性、战略性、颠覆性等特点。 “十五五” 规划建议提出，推动量子科技、生物制造、氢能和核聚变能、脑机接口、具身智能、第六代移动通信等成为新的经济增长点，这些领域正是未来产业的典型代表。 据此，某同学得出以下推论: 所有由,NO_STUDENT_DRAFT
Q-2024朝阳期中-1,S-2024朝阳期中,1,推理,CODEX_A_CHOICE_NEEDS_ANSWER_SOURCE,,ABCD①②③④,,,017_Desktop_2024模拟题_2024朝阳期中_试卷_试卷.pdf,018_Desktop_2024模拟题_2024朝阳期中_细则_细则.docx;019_Desktop_2024模拟题_2024朝阳期中_细则_补充材料_2024.11期中政治朝阳评标2.docx;020_Desktop_2024模拟题_2024朝阳期中_细则_补充材料_细则.rtf,"===== PAGE 1 ===== 高三思想政治试卷 第1 页(共8 页) 北京市朝阳区2024 ~ 2025 学年度第一学期期中质量检测 高三思想政治试卷 2024. 11 (考试时间90 分钟 满分100 分) 第一部分 本部分共15 题,每题3 分,共45 分。在每题列出的四个选项中,选出最符合题目要 求的一项。 1. 为了庆祝中华人民共和国成立75 周年,隆重表彰为新中国建设和发展作出杰出贡献 的功勋模范人物,弘扬民族精神和时代精神,根据《中华人民共和国宪法》和《中华人 民共和国国家勋章和国家荣誉称号法》,第十四届全国人民代表大会常务委员会第十 一次会议决定:授予王永志、王振义、李振声、黄宗德“共和国勋章”,授予王小谟、赵忠 贤等10 人国家荣誉称号。功勋模范人物忠诚、执着、朴实的优秀品格值得全党全国各 族人民学习。向功勋模范人物学习 ①要胸怀强国之志,在为国尽责、为民服务中实现个人价值 ②要勇建强国之功,迎难而上,依据价值选择作出价值判断 ③要锤炼强国之技,学习新知识、掌握新技能、练就真本领 ④要铸牢强国之基,把时代精神作为人生奋斗的根本立足点 A. ①② B. ①③ C. ②④ D. ③④ 2. 在中国,各式传统民居饱含“一方水土养育一方人”的智慧,让人们对家的情感有了寄 托。江南水乡多为“粉墙黛瓦”的外观,“小桥流水人家”的意境浑然天成;闽西圆如明 月的土楼依偎在青山绿水间,见证了客家人对“天圆地方、天人合一” 的哲思和对“万 事和合、子孙团圆”的珍视;点缀在沟梁峁塬间的窑洞,承载黄土地上的繁衍生息与家 风绵延,安抚着陕北人",018_Desktop_2024模拟题_2024朝阳期中_细则_细则.docx: 16题 评分细则 16.（8分） 结合材料，运用历史唯物主义的相关知识，谈谈你对改革开放以来中国共产党十次三中全会中的决策部署的“变”与“不变”的理解。 知识1分 + 结合材料1分 ①社会存在决定社会意识，社会存在的变化决定社会意识的变化。（1分） 中国共产党抓住社会历史发展的阶段性特征，根据时代的经济和社会发展的需要出台改革举措，历次会议的主题和内容随着时代的发展而不断变化。（1分） ②人民群众是社会历史的主体和创造者，坚持群众观点和群众路线。（1分） 中国共产党始终坚持以人民为中心，坚持人民主体地位，尊重人民群众的首创精神，不断满足人民群众需要。（1分） ③要使生产关系适应生产力的发展，使上层建筑适应经济基础的发展。（1分） 中国共产党始终高举改革开放的旗帜，不断调整决议的主题和内容，促进经济和社会的发展。（1分）(可以替换：社会的基本矛盾) ④改革是社会主义社会发展的直接动力，改革是社会主义制度的自我完善和发展。（1分） 在实现中华民族伟大复兴的新征程中，必须紧紧围绕推进中国式现代化进一步全面深化改革。（1分） 注： ①社会存在决定社会意识、或者 社会存在的变化决定社会意识的变化， 学生写出任意一句就给1分。 ②人民群众是社会历史的主体和创造者，或者 坚持群众观点和群众路线， 学生写出任意一句就给1分。 ③要使生产关系适应生产力的发展，或者 使上层建筑适应经济基础的发展，或者 社会基本矛盾， 学生写出任意一个角度就给1分。 ④改革是社会主义社会发展的直接动力，或者 改革是社会主义制度的自我完,NO_STUDENT_DRAFT
Q-2024朝阳期中-5,S-2024朝阳期中,5,推理,CODEX_A_CHOICE_NEEDS_ANSWER_SOURCE,,ABCD①②③④,,,017_Desktop_2024模拟题_2024朝阳期中_试卷_试卷.pdf,018_Desktop_2024模拟题_2024朝阳期中_细则_细则.docx;019_Desktop_2024模拟题_2024朝阳期中_细则_补充材料_2024.11期中政治朝阳评标2.docx;020_Desktop_2024模拟题_2024朝阳期中_细则_补充材料_细则.rtf,"===== PAGE 1 ===== 高三思想政治试卷 第1 页(共8 页) 北京市朝阳区2024 ~ 2025 学年度第一学期期中质量检测 高三思想政治试卷 2024. 11 (考试时间90 分钟 满分100 分) 第一部分 本部分共15 题,每题3 分,共45 分。在每题列出的四个选项中,选出最符合题目要 求的一项。 1. 为了庆祝中华人民共和国成立75 周年,隆重表彰为新中国建设和发展作出杰出贡献 的功勋模范人物,弘扬民族精神和时代精神,根据《中华人民共和国宪法》和《中华人 民共和国国家勋章和国家荣誉称号法》,第十四届全国人民代表大会常务委员会第十 一次会议决定:授予王永志、王振义、李振声、黄宗德“共和国勋章”,授予王小谟、赵忠 贤等10 人国家荣誉称号。功勋模范人物忠诚、执着、朴实的优秀品格值得全党全国各 族人民学习。向功勋模范人物学习 ①要胸怀强国之志,在为国尽责、为民服务中实现个人价值 ②要勇建强国之功,迎难而上,依据价值选择作出价值判断 ③要锤炼强国之技,学习新知识、掌握新技能、练就真本领 ④要铸牢强国之基,把时代精神作为人生奋斗的根本立足点 A. ①② B. ①③ C. ②④ D. ③④ 2. 在中国,各式传统民居饱含“一方水土养育一方人”的智慧,让人们对家的情感有了寄 托。江南水乡多为“粉墙黛瓦”的外观,“小桥流水人家”的意境浑然天成;闽西圆如明 月的土楼依偎在青山绿水间,见证了客家人对“天圆地方、天人合一” 的哲思和对“万 事和合、子孙团圆”的珍视;点缀在沟梁峁塬间的窑洞,承载黄土地上的繁衍生息与家 风绵延,安抚着陕北人的乡愁。下列对此理解最贴切的是 A. ",018_Desktop_2024模拟题_2024朝阳期中_细则_细则.docx: ，新技术、产业转型升级—→提效率、优配置、创模式 将数字技术运用于传统产业， 实现传统产业的转型升级（变通：产业优化升级或产业融合发展）， 提高生产效率、 优化资源配置、 创新商业模式、 促进产业链供应链现代化水平或建设现代化产业体系。 （5选2，2分） ④数字化治理（有为政府），能够 让政府更好地发挥经济职能（变通：政府科学的宏观调控，有效市场和有为政府相结合）， 提高政府行政效率， 优化政府公共服务， 打造更加良好的营商环境（或市场环境）。（4选2，2分） 总结：数字经济的四个部分相互关联，相互促进，可以共同推动我国经济高质量发展。（变通：利于构建新发展格局或现代化经济体系建设）（1分） 203题细则 20.（23分） （3）（10分） 能运用经济全球化、提高开放型经济水平、完善全球治理等知识作答。 示例一： 全球数字贸易博览会聚焦创新、开放、共赢，具有重要的意义。 数字贸易博览会促进了数字科技产品的贸易，推动新技术的研发和广泛应用，为全球经济发展注入新的动力 数字贸易博览会为全球数字贸易搭建交流与合作平台，促进数字经济领域投资和贸易的自由化、便利化，实现资源优化配置，有利于各国更好地利用两个资源两个市场。 中国电子商务平台促进世界的商贸联通，让全球贸易变得更加便捷，让世界共享中国发展新机遇。 我国要坚持办好数字贸易博览会，以此为契机推动经济全球化朝着更加开放、包容、普惠、平衡、共赢的方向发展。 示例二： （总评） 全博览会是聚焦数字产品贸易的一场国际盛会，展现了全球数字经济发展的巨大活力。 ,NO_STUDENT_DRAFT
Q-2024海淀二模-14,S-2024海淀二模,14,推理,CODEX_A_CHOICE_ANSWER_OPTIONS_CANDIDATE,C,ABCD①②③④,,,027_Desktop_2024模拟题_海淀二模_试卷_试卷.pdf,028_Desktop_2024模拟题_海淀二模_细则_细则.docx;029_Desktop_2024模拟题_海淀二模_细则_补充材料_高三二模_政治答案_2_.docx,台经济、低空经济等相结合的物流新模式 ②优化交通基础设施建设，大力发展临空经济、临港经济 ③鼓励电商企业自建物流、制定物流包装标准和服务标准 ④强化人力资源要素保障，大力支持劳动密集型物流企业 A．①② B．①④ C．②③ D．③④ 14．2024 年2 月，欧盟理事会通过《关键原材料法案》。法案的材料清单中包含稀土、锂、镍等 对绿色转型、数字化转型、国防和航天工业至关重要的34 种关键材料，其中包括17 种战 略原材料。该法案为战略原材料供应链上的本土产能设定明确的目标：10% 来自本地开采， 40% 在欧盟加工，25% 来自本土回收材料。据此可判断 A．欧盟理事会作为欧盟最高决策机构，对维护欧盟经济安全负有主要责任 B．实施该法案有利于欧洲本土原材料企业降低成本，提升企业国际竞争力 C．该法案将降低欧盟对外部供应的依赖，但妨碍资源要素在全球自由流动 D．该法案的实施能充分发挥欧盟在原材料产业的比较优势，扩大市场规模 15．每年3 月22 日是联合国设立的“世界水日”，2024 年“世界水日”主题为“Water for Peace” （以水促和平）。今年“世界水日”开放日活动在杭州举办，此次开放日各国代表通过沙龙对 话，共同探讨全球水资源可持续发展，强调水在促进和平与繁荣、实现可持续性发展中的重 要作用。可见，此次活动 ①推动各国政策协调一致，实现水资源均衡和可持续发展 ②发挥联合国对国际事务的决定作用，提高水资源利用率 ③加强水资源保护，以水为媒，推进构建人类命运共同体 ④为不同水文化之间开展交流对话、互学互鉴搭建了平台 A．①② B．①③ C．②④ D．③④ ===== ,"028_Desktop_2024模拟题_海淀二模_细则_细则.docx: 2024学年第二学期期末练习高三思想政治参考答案 2024.5 本部分共15题，每题3分，共45分。 1．C 2．D 3．C 4．B 5．A 6．C7．D 8．B 9．D10．B11．A 12．B 13．A 14．C15．D 本部分共6题，共55分。 16.（6分） 【答案】 联系是普遍的，在人际关系和社交领域，“同频”更容易使人们达成共识，形成合力。矛盾双方是对立统一的，人与人在思想、价值观、生活方式或行为方式上有不同，也有共同点，在对立中把握统一，更能相互理解和引起共鸣。价值观不同，人们面对冲突时作出的选择也不同，人生价值要在个人与社会的统一中创造和实现。 【细则】 17.（11分） （1）【答案】 此次时间利用调查是为了全面、真实、准确了解我国居民时间利用情况，追求认识的客观性。与前两次调查相比，此次调查思路新、方法新，具有探索性；调查范围广，调查对象多，内容更丰富，敢用新手段，试用新工具，创造性地解决问题。调查工作的安排具有整体性，分阶段实施，每个阶段主要任务明确。 （1）【细则】 注：如果只有一个角度，理例结合较好，给3分 （2）【答案】 调查了解阶段对事物的认识属于感性具体，认识要向前发展，就需要通过分析研究对事物进行思维抽象，并使认识发展到思维具体。调查研究的这两个阶段相互依赖、不可分割。 （2）【细则】 调查了解阶段对事物的认识属于感性具体（1分），认识要向前发展，就需要通过分析研究对事物进行思维抽象,并使认识发展到思维具体。（1分） 感性具体（感性认识）：1分，思维抽象/思维具体（理性认",NO_STUDENT_DRAFT
