question_id,year,district,exam_stage,question_no,evidence_level,framework_entry_nodes,ask_text,material_trigger,minimum_judgment,must_have_keywords,clean_rubric_atom_ids,complete_answer_generated,status,clean_exam_answer,full_score_sentence_bank,rewrite_cautions,student_first_judgment_v5_5,student_score_checklist_v5_5,display_index,batch_id,batch_name,batch_subtype
CC0045_2024_海淀_二模_19,2024,海淀,二模,19,formal,主卡=推价值；辅卡=分关系·定责任,结合材料，运用《法律与生活》知识，分析本案判决的社会价值。,19．（6 分）遗赠扶养协议纠纷案宣判。 【案情简介】某社区居委会与曹某签订协议，约定由某居委会定时定员结对子照看关心曹某， 每月给予曹某基本生活费，免费看病诊治，逢年过节给予曹某各类生活补助及慰问生活用品等， 养老至寿终；曹某现有的动产和不动产在曹某寿终后，产权移交某居委会。此后，某居委会按照 约定履行扶养义务。曹某去世后，曹某的四个子女要求继承遗产，与该居委会产生争议。该居委 会遂将曹某的四个子女等人诉至法院，请求判令：（1）确认某居委会与曹某签订的协议有效；（2） 曹…,主卡=推价值；辅卡=分关系·定责任；先判：先判断遗赠扶养协议是否有效、居委会是否实际履行扶养照料义务，再把个案公平推到养老和价值引导。,遗赠扶养协议、协议有效、履行扶养义务、养老送终、个案公平正义、助力养老、尊老敬老爱老助老、社会主义核心价值观,R_CC0045_2024_海淀_二模_19_01,本案判决确认居委会与曹某签订的遗赠扶养协议有效，并认定居委会已经按照约定履行扶养义务，体现了对依法订立、依法履行的遗赠扶养安排的尊重。居委会长期定时定员照看关心曹某，提供基本生活费、看病诊治、节日慰问等扶养照料，曹某去世后由居委会取得协议约定的财产，符合法律关于遗赠扶养协议的规定。 | 这一判决实现了个案公平正义，肯定了基层组织参与养老、助老和养老送终的积极作用；也向社会表明，遗产处理要尊重被继承人生前真实合法安排，不能让未尽扶养义务者当然取得全部利益。判决有利于倡导全社会积极助力养老，弘扬尊老、敬老、爱老、助老的中华传统美德，推动社会主义核心价值观转化为人们的自觉行动和社会风尚。,v5_5_student_battle_enhanced,本案判决确认居委会与曹某签订的遗赠扶养协议有效，并认定居委会已经按照约定履行扶养义务，体现了对依法订立、依法履行的遗赠扶养安排的尊重。居委会长期定时定员照看关心曹某，提供基本生活费、看病诊治、节日慰问等扶养照料，曹某去世后由居委会取得协议约定的财产，符合法律关于遗赠扶养协议的规定。 | 这一判决实现了个案公平正义，肯定了基层组织参与养老、助老和养老送终的积极作用；也向社会表明，遗产处理要尊重被继承人生前真实合法安排，不能让未尽扶养义务者当然取得全部利益。判决有利于倡导全社会积极助力养老，弘扬尊老、敬老、爱老、助老的中华传统美德，推动社会主义核心价值观转化为人们的自觉行动和社会风尚。,法院确认遗赠扶养协议有效，是对合法协议和真实意思安排的尊重。 | 居委会已经按约照看、扶养曹某，履行了养老送终义务。 | 判决让履行扶养义务的一方取得约定财产，实现个案公平正义。 | 本案肯定基层组织在养老助老中的作用，倡导社会力量积极参与养老。 | 判决弘扬尊老、敬老、爱老、助老的传统美德，推动社会主义核心价值观落地。,不要把本题写成普通法定继承排序题。重点是遗赠扶养协议有效、居委会履行扶养义务，以及判决对养老风尚和核心价值观的引导。,先判断遗赠扶养协议是否有效、居委会是否实际履行扶养照料义务，再把个案公平推到养老和价值引导。,协议有效 | 居委会履行扶养义务 | 尊重真实合法安排 | 肯定基层养老作用 | 落到尊老助老和价值引导,3,BATCH_03_INNOVATION_AI_VALUE,创新竞争、AI边界、价值收束,value
CC0103_2025_丰台_一模_19,2025,丰台,一模,19,formal,主卡=推价值；辅卡=认产权·抓侵权,结合材料，运用法治相关知识，分析本案作为人民法院保护科技创新典型案例的意义。,19. 2024 年6 月，最高人民法院知识产权法庭对一起因技术秘密侵权纠纷上诉案作出判决。原告方下 属公司的近40 名高级管理人员及技术人员离职后加入被告方，并利用在原单位接触的技术信息申请了12 件实用新型专利。 根据《中华人民共和国反不正当竞争法》，最高人民法院知识产权法庭依法适用2 倍惩罚性赔偿，判 决被告方赔偿原告方经济损失及维权合理开支合计6.4 亿余元，创下我国知识产权侵权诉讼判赔数额新 高。 该案在停止侵害民事责任承担的具体方式、内容、范围，以及拒绝履行、停…,主卡=推价值；辅卡=认产权·抓侵权；先判：先判断保护对象是技术秘密等知识产权，再按保护权利人、严惩侵权、规范竞争、提供司法范例四层写意义。,知识产权、技术秘密、严惩侵权行为、市场竞争秩序、公平市场环境、鼓励创新、同类案件范例、司法公信力,R_CC0103_2025_丰台_一模_19_01,本案作为人民法院保护科技创新典型案例，首先有利于维护原告方等当事人的合法权益，保护知识产权。被告方利用原单位技术信息申请专利，侵害技术秘密，法院依法适用惩罚性赔偿并判令其承担高额赔偿责任，体现了对侵权行为的严厉打击。 | 其次，本案有利于规范市场竞争秩序，营造公平的市场环境。技术秘密是企业创新成果的重要组成部分，司法机关通过依法保护知识产权、制裁不正当竞争行为，能够让创新者敢投入、能受益，以法治力量鼓励科技创新。 | 再次，本案在停止侵害责任承担方式、非金钱给付义务迟延履行金等方面作出探索，为同类案件提供范例和参考，有利于提高审判质量和效率，增强司法公信力，彰显司法权威。 | 最后，该案也引导企业和公民依法办事，增强法治信仰；这一价值来自法院对知识产权侵权和不正当竞争的具体制裁，不能脱离本案空喊法治中国。,v5_5_student_battle_enhanced,本案作为人民法院保护科技创新典型案例，首先有利于维护原告方等当事人的合法权益，保护知识产权。被告方利用原单位技术信息申请专利，侵害技术秘密，法院依法适用惩罚性赔偿并判令其承担高额赔偿责任，体现了对侵权行为的严厉打击。 | 其次，本案有利于规范市场竞争秩序，营造公平的市场环境。技术秘密是企业创新成果的重要组成部分，司法机关通过依法保护知识产权、制裁不正当竞争行为，能够让创新者敢投入、能受益，以法治力量鼓励科技创新。 | 再次，本案在停止侵害责任承担方式、非金钱给付义务迟延履行金等方面作出探索，为同类案件提供范例和参考，有利于提高审判质量和效率，增强司法公信力，彰显司法权威。 | 最后，该案也引导企业和公民依法办事，增强法治信仰；这一价值来自法院对知识产权侵权和不正当竞争的具体制裁，不能脱离本案空喊法治中国。,法院依法保护原告方知识产权，维护当事人合法权益。 | 对技术秘密侵权适用惩罚性赔偿，体现了对侵权行为的严厉打击。 | 判决规范市场竞争秩序，营造公平市场环境，以法治力量鼓励创新。 | 典型案例为同类案件提供范例和参考，有利于提高审判质量和效率。 | 本案彰显司法权威，增强司法公信力，引导社会依法办事、增强法治信仰。,不要写成泛泛的“维护社会公平正义”。要先限定为保护原告方知识产权和严惩侵权，再写市场竞争、科技创新、同类案件范例和法治信仰。,先判断保护对象是技术秘密等知识产权，再按保护权利人、严惩侵权、规范竞争、提供司法范例四层写意义。,保护原告知识产权 | 严惩侵权 | 规范公平竞争和鼓励创新 | 提供同类案件范例 | 提升司法公信力,6,BATCH_03_INNOVATION_AI_VALUE,创新竞争、AI边界、价值收束,innovation_competition
CC0206_2025_西城_期末_19,2025,西城,期末,19,formal,主卡=认产权·抓侵权；辅卡=分关系·定责任,运用法律知识分析法院的判决。,19．（8 分） 【案情回放】 “小爱同学，今天天气怎么样？”“小爱同学，讲个故事”……随着M 公司2017 年7 月推出的“小爱 同学”智能语音设备后，“小爱同学”越来越多的参与到我们的生活中。截至2020 年12 月，其月活跃用 户数达到8670 万人，累计唤醒约495 亿次。 陈某于2017 年8 月至2020 年6 月间，在不同商品类别上抢先大量申请注册相关商标，并向M 科技关 联企业发函，要求停止使用“小爱同学”商标。同时与深圳市Y 公司合作，在运动手表、闹钟等商…,主卡=认产权·抓侵权；辅卡=分关系·定责任；先判：先判断是否让消费者混淆、是否虚假宣传、是否损害品牌商誉，再落到不正当竞争责任。,有一定影响、混淆、虚假宣传、不正当竞争、诚实信用、品牌商誉、法治化营商环境,R_CC0206_2025_西城_期末_19_01,法院判决陈某和深圳市Y公司承担责任是正确的。“小爱同学”已经作为有一定影响力的唤醒词、人工智能引擎名称和相关商品名称被广泛使用，能够使消费者将其与M公司的产品和服务相联系，依法应受反不正当竞争法保护。陈某明知他人已经使用并形成影响，仍抢先大量申请注册相关商标，并与Y公司在运动手表、闹钟等商品上使用“小爱同学”标识、发布相关宣传，容易使消费者误认为其商品与M公司存在特定联系，构成混淆和引人误解的宣传，属于不正当竞争。该行为违背诚实信用原则和商业道德，也损害了科技创新企业的品牌商誉。人民法院判令停止侵权并承担赔偿责任，有利于规制滥用权利和“搭便车”行为，保护创新成果和品牌信誉，维护公平竞争的市场秩序，为数字经济和新业态发展营造良好的法治化营商环境。,v5_5_student_battle_enhanced,法院判决陈某和深圳市Y公司承担责任是正确的。“小爱同学”已经作为有一定影响力的唤醒词、人工智能引擎名称和相关商品名称被广泛使用，能够使消费者将其与M公司的产品和服务相联系，依法应受反不正当竞争法保护。陈某明知他人已经使用并形成影响，仍抢先大量申请注册相关商标，并与Y公司在运动手表、闹钟等商品上使用“小爱同学”标识、发布相关宣传，容易使消费者误认为其商品与M公司存在特定联系，构成混淆和引人误解的宣传，属于不正当竞争。该行为违背诚实信用原则和商业道德，也损害了科技创新企业的品牌商誉。人民法院判令停止侵权并承担赔偿责任，有利于规制滥用权利和“搭便车”行为，保护创新成果和品牌信誉，维护公平竞争的市场秩序，为数字经济和新业态发展营造良好的法治化营商环境。,“小爱同学”已具有一定影响力，能够指向M公司的相关产品和服务。 | 陈某抢先注册并使用他人已有影响的标识，具有不当攀附他人商誉的性质。 | 在相关商品上使用相同标识并宣传，容易造成消费者混淆或误认。 | 该行为构成不正当竞争，违背诚实信用原则和商业道德。 | 法院判令停止侵权、赔偿损失，有利于保护科技创新企业的品牌商誉。 | 该判决能够维护公平竞争秩序，优化数字经济发展的法治化营商环境。,不要把本案写成普通商标侵权即可结束。 | 必须落到反不正当竞争、混淆或引人误解宣传。 | 价值表达要绑定数字经济、创新和公平竞争，不要空喊法治。,先判断是否让消费者混淆、是否虚假宣传、是否损害品牌商誉，再落到不正当竞争责任。,有一定影响的标识 | 造成混淆 | 虚假宣传 | 诚实信用 | 品牌商誉和营商环境,12,BATCH_03_INNOVATION_AI_VALUE,创新竞争、AI边界、价值收束,innovation_competition
CC0223_2025_顺义_一模_19,2025,顺义,一模,19,formal,主卡=推价值；辅卡=分关系·定责任,运用法治知识，设问指向是阐释定分止争的价值，运用 《法律与生活》的知识进行说明。,19．(1)案例1 通过法院调解解决纠纷。 案例2 通过行政裁决和行政诉讼解决纠纷。 (2)①有利于明确权利边界。案例2 市监局纠正侵权名称，保障市场主体和公民的合法权益。 ②有利于化解社会矛盾。案例1 的调解修复人际关系，体现 “和合”理念，促进社会和谐。 ③有利于维护公平正义。让公平正义在人与人相互理解的土壤中生根发芽。,主卡=推价值；辅卡=分关系·定责任；先判：先判断争议中的权利边界和相邻关系，再说明调解或裁判怎样定分止争。,权利边界、相邻关系、合理使用、法院调解、合法权益、多元纠纷解决、社会和谐,R_CC0223_2025_顺义_一模_19_M17_01|R_CC0223_2025_顺义_一模_19_M17_02|R_CC0223_2025_顺义_一模_19_M17_03|R_CC0223_2025_顺义_一模_19_M17_04|R_CC0223_2025_顺义_一模_19_M17_05|R_CC0223_2025_顺义_一模_19_M17_06,定分止争的价值，首先在于明确权利边界。案例1中，楼道通道属于建筑物共有部分，刘某一家在门口堆放杂物、生活垃圾，影响他人通行，超出了合理使用共有部分的界限，也不符合相邻关系中有利生产、方便生活、团结互助、公平合理的要求。法院通过调解促成双方握手言和，既解决了相邻纠纷，也修复了邻里关系。其次，定分止争有利于保护合法权益、维护公平正义。案例2中，乙公司使用与甲公司相似的企业名称，损害他人合法权益，行政裁决和行政诉讼通过纠正侵权名称，明确市场主体行使权利不得损害他人权益。最后，定分止争不是简单判输赢，而是通过调解、行政裁决、诉讼等多元纠纷解决机制协调利益、化解矛盾，引导公民和市场主体依法行使权利，践行文明、和谐的价值追求，提升社会治理水平。,v5_5_student_battle_enhanced,定分止争的价值，首先在于明确权利边界。案例1中，楼道通道属于建筑物共有部分，刘某一家在门口堆放杂物、生活垃圾，影响他人通行，超出了合理使用共有部分的界限，也不符合相邻关系中有利生产、方便生活、团结互助、公平合理的要求。法院通过调解促成双方握手言和，既解决了相邻纠纷，也修复了邻里关系。其次，定分止争有利于保护合法权益、维护公平正义。案例2中，乙公司使用与甲公司相似的企业名称，损害他人合法权益，行政裁决和行政诉讼通过纠正侵权名称，明确市场主体行使权利不得损害他人权益。最后，定分止争不是简单判输赢，而是通过调解、行政裁决、诉讼等多元纠纷解决机制协调利益、化解矛盾，引导公民和市场主体依法行使权利，践行文明、和谐的价值追求，提升社会治理水平。,定分止争能够明确权利边界，防止权利行使超过正当限度。 | 楼道共有部分应合理使用，堆放杂物影响通行，不符合相邻关系处理原则。 | 相邻各方应按照有利生产、方便生活、团结互助、公平合理的原则处理关系。 | 法院调解有利于实质化解纠纷，修复邻里关系。 | 企业名称纠纷中，纠正侵权名称有利于保护市场主体合法权益。 | 多元纠纷解决机制协调运行，有利于化解社会矛盾、实现社会和谐。 | 依法解决纠纷体现文明、和谐等价值追求。,不要只写“化解矛盾”，要把两个案例分别落到相邻关系和名称权纠纷。 | 不要把定分止争写成抽象口号，要写权利边界、纠纷途径和治理价值。 | 不要把行政裁决、诉讼、调解混成一种方式。,先判断争议中的权利边界和相邻关系，再说明调解或裁判怎样定分止争。,权利边界 | 相邻关系 | 合理使用 | 法院调解 | 定分止争和社会和谐,13,BATCH_03_INNOVATION_AI_VALUE,创新竞争、AI边界、价值收束,value
CC0229_2026_东城_一模_18,2026,东城,一模,18,formal,主卡=认产权·抓侵权；辅卡=推价值,结合材料，运用《法律与生活》知识，谈谈法院是如何以司法之力守护“向新力”的。,18．（8 分）人民法院以司法之力守护“向新力”。 案例一 某科技公司三名创始人，因专利权归属纠纷，陷入长期诉讼，公司发展因此停滞。对此，办 案合议庭没有“一判了之”，而是居中斡旋，弥合分歧。当事人最终达成和解，全身心投入创新创业，实 现了多方共赢。 案例二 甲公司系某水稻植物新品种的权利人。乙公司擅自将甲公司享有植物新品种权的稻种更换包 装后对外销售。经人民法院查明，乙公司侵权行为覆盖范围广。人民法院判令乙公司立即停止侵害，并对 其适用惩罚性赔偿，赔偿甲公司经济损失300…,主卡=认产权·抓侵权；辅卡=推价值；先判：先把三个案例分开：调解知识产权纠纷、惩罚侵权、制止恶意诉讼，不能混成一句保护创新。,公正司法、诉讼调解、知识产权、惩罚性赔偿、恶意诉讼、诚信原则、创新活力,R_CC0229_2026_东城_一模_18_01|R_CC0229_2026_东城_一模_18_02|R_CC0229_2026_东城_一模_18_03|R_CC0229_2026_东城_一模_18_04|R_CC0229_2026_东城_一模_18_05|R_CC0229_2026_东城_一模_18_06|R_CC0229_2026_东城_一模_18_07|R_CC0229_2026_东城_一模_18_08,人民法院以司法之力守护“向新力”，首先体现在公正司法，坚持以事实为依据、以法律为准绳，发挥裁判的导向作用。案例一中，面对专利权归属纠纷，法院没有简单“一判了之”，而是通过诉讼调解弥合分歧，促成当事人和解，使创新主体重新投入创业，既实质化解纠纷，也节约司法资源。案例二中，乙公司擅自销售更换包装后的植物新品种稻种，侵害权利人合法权益，法院判令停止侵害并适用惩罚性赔偿，严惩知识产权侵权，提高侵权成本，维护市场秩序和公平竞争。案例三中，丙公司在丁公司上市关键期提起缺乏依据、反复变更诉求的诉讼，法院依法驳回并谴责恶意诉讼，规制滥用诉讼权利，维护诚信原则和司法秩序。保护知识产权就是保护创新，法院通过调解、严惩侵权、规制恶意诉讼，既保护创新主体合法权益，也为新质生产力发展营造稳定、公平、诚信的法治环境。,v5_5_student_battle_enhanced,人民法院以司法之力守护“向新力”，首先体现在公正司法，坚持以事实为依据、以法律为准绳，发挥裁判的导向作用。案例一中，面对专利权归属纠纷，法院没有简单“一判了之”，而是通过诉讼调解弥合分歧，促成当事人和解，使创新主体重新投入创业，既实质化解纠纷，也节约司法资源。案例二中，乙公司擅自销售更换包装后的植物新品种稻种，侵害权利人合法权益，法院判令停止侵害并适用惩罚性赔偿，严惩知识产权侵权，提高侵权成本，维护市场秩序和公平竞争。案例三中，丙公司在丁公司上市关键期提起缺乏依据、反复变更诉求的诉讼，法院依法驳回并谴责恶意诉讼，规制滥用诉讼权利，维护诚信原则和司法秩序。保护知识产权就是保护创新，法院通过调解、严惩侵权、规制恶意诉讼，既保护创新主体合法权益，也为新质生产力发展营造稳定、公平、诚信的法治环境。,法院公正司法，坚持以事实为依据、以法律为准绳，发挥司法裁判导向作用。 | 诉讼调解能够实质化解专利权纠纷，促成创新主体回到创新创业中。 | 对故意侵害植物新品种权的行为适用惩罚性赔偿，可以提高侵权成本。 | 惩罚性赔偿具有警示和规范作用，保护权利人合法权益。 | 驳回并谴责恶意诉讼，有利于规制滥用诉讼权利。 | 权利行使有边界，诉讼权利也应遵循诚信原则。 | 保护知识产权就是保护创新，有利于提升创新活力。,三个案例都要回应，不能只写知识产权保护。 | “向新力”的价值必须由调解、惩罚性赔偿、规制恶意诉讼三条事实支撑。 | 不要把恶意诉讼写成普通败诉。,先把三个案例分开：调解知识产权纠纷、惩罚侵权、制止恶意诉讼，不能混成一句保护创新。,公正司法总帽 | 案例一写调解 | 案例二写惩罚性赔偿 | 案例三写制止恶意诉讼 | 落到创新活力,14,BATCH_03_INNOVATION_AI_VALUE,创新竞争、AI边界、价值收束,innovation_competition
