queue_id,heading,node,evidence_note,new_why_chars,new_answer_chars,new_why,new_answer
T0210,32. 2025朝阳期末 第16题（主观题）,发展的观点 / 发展的普遍性,PPT评分细则第134行明列“发展”，当前矩阵 M1034 以强细则支持该节点。,154,150,材料中的《论语》、汉代文物、春节等不是被静态展示为旧物，而是通过当代阐释、互动展览、国际传播进入新的交流场景。PPT评分细则明列“发展”，说明作答不能只写传统文化值得传播，还要看到传统文化在历史延续中不断获得新的表现形式和生命力。看到“过去、现在、未来连续起来”“传统资源进入当代对话”，就应落到发展的观点。,①事物是变化发展的，中华优秀传统文化也要放在历史延续和时代创新的过程中理解。②用文化同世界对话，既要讲清《论语》、汉代文物、春节等传统文化资源的历史根脉，也要通过当代阐释、互动展览和国际传播让其进入现代生活和世界交流。③这样才能使传统文化在创新发展中获得新的生命力，推动不同文化在交流互鉴中共同发展。
T0417,32. 2025朝阳期末 第22题（主观题）,实践是认识的基础,PPT评分细则第337-340行明列实践观点和实践基础上的理论创新，当前矩阵 M1044 以强细则支持该节点。,141,139,设问要求说明如何不断谱写马克思主义中国化时代化新篇章，材料抓手是国内外形势新变化、中国具体实践新要求和实践经验总结。PPT评分细则明确把“实践观点/实践基础上的理论创新”列为得分角度，因此这里不是抽象谈理论自我更新，而是要说明新的理论认识来自实践、服务实践，并在回答现实课题中发展。,①实践是认识的来源和发展动力，理论创新必须建立在中国具体实践基础上。②面对国内外形势新变化和中国实践新要求，要深入总结实践经验、研究实践中的新问题，把人民创造和时代课题转化为理论概括。③只有坚持从实践中来、到实践中去，才能形成新的理论认识，持续谱写马克思主义中国化时代化新篇章。
T0180,32. 2026丰台期末 第22题（主观题）,系统观念 / 系统优化,正式细则第452行明列“系统优化”，当前矩阵 M1214 以正式细则支持该节点。,140,139,五年规划不是单个部门的孤立计划，而是把发展目标、阶段任务、资源配置、政策工具和执行主体组织成一个治理系统。正式细则第452行明列“系统优化”，材料也写到中央统筹、地方分解、部门协同和全国一盘棋。由这些词可以判断，答题重点应放在立足整体、统筹要素、优化结构，而不是只写一般计划管理。,①系统优化方法要求立足整体，把各要素、各层级、各环节统筹起来，形成整体功能。②五年规划通过中央统筹确定总目标，地方分解落实任务，部门协同配置政策和资源，把长期战略、阶段安排和具体行动连接为统一系统。③这种“一盘棋”治理能够避免各自为政和局部失衡，使国家治理在整体协同中提高效能。
T0048,32. 2026海淀期中 第22题第（2）问（主观题）,主观能动性 / 意识的能动作用,正式阅卷细则 page_094 Q22(2) 常见知识列明“发挥主观能动性”，当前矩阵 M1315 以正式阅卷细则宽角度支持该节点。,139,139,材料围绕中华民族伟大复兴的“势”展开，既强调历史大势和发展规律，也强调信心、目标和主动奋斗。阅卷细则 page_094 明列“发挥主观能动性”，并要求分析扣在“势”上，说明不能把有利态势当作自动实现的结果。学生需要写清：尊重规律是前提，主动奋斗和正确意识把可能性转化为现实成果。,①发挥主观能动性必须以尊重客观规律和历史大势为基础，不能脱离现实条件空喊目标。②中华民族伟大复兴有历史趋势和发展基础，但这种“势”还需要通过坚定信心、明确目标、主动作为来把握和推动。③把民族复兴的目标、信念和行动统一起来，才能把有利态势转化为现实成果，在主动奋斗中推进复兴进程。
T0497,32. 2026海淀期中 第22题第（2）问（主观题）,人民群众,正式阅卷细则 page_094 Q22(2) 常见知识列明“人民群众主体地位”，当前矩阵 M1317 以正式阅卷细则支持该节点。,138,131,同一道题在“势”的分析中还要求看到主体力量。阅卷细则 page_094 明列“人民群众主体地位”，示例也写到人民群众是推动中华民族伟大复兴的力量之源。材料若只写历史大势，会漏掉谁来顺势而为、谁来把趋势变成现实的问题；因此应把复兴大势同人民主体地位、群众智慧和群众力量联系起来。,①人民群众是社会历史的主体，是推动中华民族伟大复兴的根本力量。②复兴大势不是少数人单独推动的结果，必须坚持人民主体地位，尊重人民创造，凝聚全体人民的智慧、力量和奋斗热情。③只有把历史趋势同人民群众的实践力量结合起来，才能把复兴的有利态势转化为现实力量和持续成果。
T0211,33. 2025朝阳期末 第22题（主观题）,发展的观点 / 发展的普遍性,PPT评分细则第332-336行明列“发展的观点”，当前矩阵 M1042 以强细则支持该节点。,141,134,材料不是要求背诵既有理论结论，而是要求说明在新形势、新实践、新课题中怎样继续推进理论创新。PPT评分细则明列“发展的观点”，说明马克思主义中国化时代化要被理解为随实践和时代课题不断丰富发展的过程。看到“新变化”“新要求”“新篇章”，就应从发展的普遍性和理论与时代共同前进来组织答案。,①事物是变化发展的，理论创新也必须随着实践和时代的发展而不断前进。②国内外形势新变化和中国具体实践新要求不断出现，要求马克思主义中国化时代化在坚持基本立场观点方法的基础上不断丰富和发展。③用发展着的理论回答发展着的时代课题，才能使理论保持生命力，持续指导新的伟大实践。
T0533,33. 2025海淀期末 第22题（主观题）,价值观的导向作用,PPT细则第520-521行将“价值观”列为必修四可选知识，当前矩阵 M1111 以强细则/PPT评标细则支持该节点。,136,138,愚公移山精神之所以能用于写作，不只是因为故事感人，而是因为它提供了面对困难时怎样判断目标价值、怎样选择行动方向的价值引领。PPT细则把“价值观”列为可选知识，说明可以从价值观导向作用切入。材料中的国家发展、民族复兴、人民幸福和坚持不懈奋斗，都是价值目标对认识和行动的引导。,①价值观对人们认识世界和改造世界具有导向作用，影响人们的价值判断、目标选择和行动方式。②愚公移山精神引导我们把国家发展、民族复兴和人民幸福作为值得追求的目标，在困难面前不退缩、不懈怠。③用正确价值观凝聚坚持不懈、团结奋斗的行动力量，才能把精神认同转化为推进事业发展的现实行动。
T0108,33. 2026丰台期末 第16题（主观题）,联系的普遍性 / 联系的观点（总）,正式细则第51-53行明列留白与周围事物相互联系、相互影响以及坚持联系的观点，当前矩阵 M1207 以正式细则支持该节点。,125,133,“留白”容易被学生误解为空缺或少画一点，但细则明确写到留白与周围事物相互联系、相互影响，并要求坚持联系的观点。材料中的留白、景物、空间节奏和生活情境共同形成审美效果，说明它的意义来自关系结构，而不是孤立存在。因此答题要抓住联系的普遍性和整体审美效果。,①联系具有普遍性，事物总是在同其他事物的相互联系中存在和发挥作用。②留白不是孤立的空缺，而是与周围景物、画面空间、节奏层次和生活情境相互作用，共同构成有张弛、有意境的审美整体。③分析留白要把它放在整体关系中理解，看到它如何通过与周边元素的联系增强画面表达和文化意味。
