queue_id,heading,node,heading_para,why_para,answer_para,before_why_chars,after_why_chars,before_answer_chars,after_answer_chars,evidence_note,old_answer_excerpt
T0386,8. 2025朝阳期末 第22题（主观题）,认识对实践的反作用,3184,3187,3188,78,146,93,181,矩阵 M1047：PPT评分细则第337-340行明列“以新的理论指导新的实践”。,新的理论认识形成后，要反作用于实践、指导新的实践。谱写马克思主义中国化时代化新篇章，要用党的创新理论指导党治国理政和推进中国式现代化的实践，把理论优势转化为认识世界、改造世界的实践力量。
T0142,8. 2026丰台一模 第16题（主观题）,系统观念 / 系统优化,1267,1270,1271,70,143,79,189,矩阵 M0051/M0130：丰台一模主观题正式阅卷细则Q16第（2）点明确“坚持联系的观点，立足整体，统筹部分”，要求统筹科技、伦理与社会公平。,推动人工智能健康发展，要坚持联系观点和系统观念，统筹科技创新、文化传承、伦理治理、社会公平和民生福祉，让技术进步服务整体文明进步，而不是只追求某个环节的效率。
T0425,8. 2026丰台期末 第22题（主观题）,社会发展的两大基本规律和基本矛盾,3494,3497,3498,39,139,69,195,矩阵 M1212：正式细则第444行列“上层建筑”；材料《国家发展规划法》提供法律支撑。,从社会基本矛盾看，国家发展规划法和规划制度属于上层建筑的重要内容。通过完善制度和法律支撑，使上层建筑更好服务经济社会发展和现代化建设需要。
T0405,8. 2026西城期末 第16题第（2）问（主观题）,真理观,3346,3349,3350,36,126,47,180,矩阵 M1400：正式评分细则page_002认识论角度写明追求真理是人类认识活动根本任务，并在酌情原则列出真理最基本属性。,真实认识经实践检验后才能获得真理，真理具有客观性，因而能够跨越偏见和隔阂，产生直抵人心的力量。
T0005,8. 2026通州期末 第16题（主观题）,物质决定意识,99,102,103,32,132,38,187,矩阵 M1438：正式细则第16题唯物论角度写明“体现了物质决定意识”。,治水方案不是主观臆造，而是由当地自然条件和水利实际所规定，体现物质决定意识。
T0012,9. 2025丰台期末 第16题（主观题）,一切从实际出发 / 实事求是 / 主观与客观具体的历史的统一,147,150,151,70,133,108,183,矩阵 M0995：2025丰台期末正式PPT细则第205-263行支持实践、实际出发、联系观、量变质变、矛盾观等；本条落到从实际出发。,“数”来自对客观情况的调查统计，不能凭主观感觉编造；“数”应根据事物质量和数量界限来确定，不能脱离具体条件；“数”要服务计划制定、国家治理和长远发展，所以胸中有数本质上就是从客观实际出发，使主观方案同真实情况相符合。
T0218,9. 2026丰台一模 第16题（主观题）,辩证否定 / 守正创新,1901,1904,1905,68,137,104,196,矩阵 M0049/M0052：丰台一模正式阅卷细则Q16要求全面辩证看AI积极作用和风险挑战，并以正确价值观引导其健康发展；本条落到扬弃式创新。,面对人工智能，应坚持辩证否定观，保留和发展其促进文物修复、数字创作、公共服务和文明进步的积极作用，同时通过规则、伦理和价值引导克服信息失真、文化窄化、智能鸿沟等风险，使技术创新真正服务人的全面发展和文明进步。
T0335,9. 2026朝阳期中 第19题（主观题）,实践与认识（总）,2779,2782,2783,79,140,54,191,矩阵 M1258：正式评分细则第100-102行在“如何弘扬”中列“立足实践、知行合一”。,要立足新时代强国建设的实践弘扬抗战精神，把爱国情怀、民族气节、英雄气概化为接续奋斗的实际行动，做到知行合一。
