queue_id,heading,node,heading_para,why_para,answer_para,before_why_chars,after_why_chars,before_answer_chars,after_answer_chars,evidence_note,old_answer_excerpt
T0048,34. 2026西城期末 第16题第（2）问（主观题）,主观能动性 / 意识的能动作用,450,453,454,43,138,53,151,矩阵 M1394：正式评分细则 page_002 Q16(2) 唯物论角度写明正确意识有效发挥能动作用、正确指导实践。,符合客观真实的正确意识能够有效发挥能动作用，正确指导实践、打破偏见、凝聚共识，所以真实具有直抵人心的力量。
T0519,35. 2026朝阳期中 第18题（主观题）,价值观的导向作用,3974,3977,3978,32,126,69,165,矩阵 M1245：正式评分细则第63-66、72-85行在“如何做”中列正确价值观的导向作用。,使用AI提供情绪价值要发挥正确价值观的导向作用，坚持科技服务人的健康成长，让AI成为辅助疏导工具，而不是引导人逃避现实关系、沉溺虚拟安慰。
T0106,35. 2026朝阳期中 第19题（主观题）,联系的普遍性 / 联系的观点（总）,926,929,930,39,121,62,147,矩阵 M1261：正式评分细则第100-102行在如何弘扬抗战精神中列联系的观点，证据等级为正式细则宽角度/术语支持。,弘扬抗战精神要坚持联系观点，把中华民族家国传统、全民族抗战实践和新时代强国复兴使命联系起来理解，使伟大精神在现实奋斗中延续。
T0204,35. 2026朝阳期中 第19题（主观题）,发展的观点 / 发展的普遍性,1651,1654,1655,45,117,65,154,矩阵 M1257：正式评分细则第100-102行在如何弘扬抗战精神中列发展的观点，证据等级为正式细则宽角度/术语支持。,弘扬抗战精神要坚持发展的观点。既看到它是中华民族精神在抗战实践中的发展升华，也要在新时代强国建设中不断继承、弘扬和发展其精神价值。
T0377,35. 2026海淀期末 第16题（主观题）,实践与认识（总）,2930,2933,2934,46,129,63,151,矩阵 M1351：正式评分标准 page_001 Q16 列明“实践的观点”，且设问要求结合材料或个人体验作答。,对技术的认识和使用能力要在实践中形成并检验，学生应在学习、表达和问题解决实践中训练独立探索，而不是停留在复制粘贴和即时答案上。
T0486,35. 2026西城期末 第21题（主观题）,人民群众,3724,3727,3728,38,126,49,163,矩阵 M1389：正式评分细则 page_005 Q21 角度2变通写明“人民至上/人民群众观点等”，证据等级为正式评分标准宽角度/术语支持。,科学制定五年规划要坚持人民群众观点，广泛听取人民意见、凝聚共识，使规划反映人民需要并服务人民利益。
T0049,35. 2026通州期末 第16题（主观题）,主观能动性 / 意识的能动作用,455,458,459,25,124,40,153,矩阵 M1431：正式细则第16题写明“同时发挥人的主观能动性，实现人与自然的和谐共生”。,人在尊重规律基础上能动设计、修建、维护并创新表达治水智慧，推动工程持续发挥作用。
T0107,36. 2026朝阳期末 第16题（主观题）,联系的普遍性 / 联系的观点（总）,931,934,935,50,122,64,142,矩阵 M1285：正式阅卷细则第19-21行写传统戏曲连接过去、现在与未来，并补充“联系”，证据等级为正式细则宽角度/术语支持。,理解传统戏曲焕发生命力要坚持联系观点，把过去的戏曲传统、当代艺术表达和未来文化发展联系起来，在传统与现代元素融合中实现传承创新。
