rubric_atom_id,question_id,rubric_or_answer_phrase,evidence_type,evidence_level,plain_reward_description,related_material_atom_ids,what_expression_is_rewarded,what_judgment_student_must_make_before_writing,legal_knowledge_or_rule_if_explicit,value_expression_if_explicit,knowledge_material_value_type,can_be_written_without_material,source_locator,uncertainty
R_CC0001_2024_丰台_一模_16_01,CC0001_2024_丰台_一模_16,16.结合材料，运用《政治与法治》知识，谈谈新时代“四下基层”如何为社会主义现代化建设注入强劲动力。,evaluation_standard,formal,16.结合材料，运用《政治与法治》知识，谈谈新时代“四下基层”如何为社会主义现代化建设注入强劲动力。,M_CC0001_2024_丰台_一模_16_01|M_CC0001_2024_丰台_一模_16_02,16.结合材料，运用《政治与法治》知识，谈谈新时代“四下基层”如何为社会主义现代化建设注入强劲动力。,判断法律关系/行为性质/责任承担或程序路径(回源细化),,,material+value,no,F0044:text | F0045:page 4 | F0045:page 8 | F0267:page 4 | F0267:page 8 | F0268:text,heuristic_atom_split_from_text_layer; needs回源核细则原文
R_CC0001_2024_丰台_一模_16_02,CC0001_2024_丰台_一模_16,参考答案： 中国共产党是中国特色社会主义事业的领导核心，“四下基层”是党坚持群众路线、密切联系群众的重要抓手，能为社会主义现代化建设注入强进动力。,evaluation_standard,formal,参考答案： 中国共产党是中国特色社会主义事业的领导核心，“四下基层”是党坚持群众路线、密切联系群众的重要抓手，能为社会主义现代化建设注入强进动力。,M_CC0001_2024_丰台_一模_16_01|M_CC0001_2024_丰台_一模_16_02,参考答案： 中国共产党是中国特色社会主义事业的领导核心，“四下基层”是党坚持群众路线、密切联系群众的重要抓手，能为社会主义现代化建设注入强进动力。,判断法律关系/行为性质/责任承担或程序路径(回源细化),,,value,uncertain,F0044:text | F0045:page 4 | F0045:page 8 | F0267:page 4 | F0267:page 8 | F0268:text,heuristic_atom_split_from_text_layer; needs回源核细则原文
R_CC0001_2024_丰台_一模_16_03,CC0001_2024_丰台_一模_16,通过宣传，使党的路线、方针、政策直达基层，落地生根；,evaluation_standard,formal,通过宣传，使党的路线、方针、政策直达基层，落地生根；,M_CC0001_2024_丰台_一模_16_01|M_CC0001_2024_丰台_一模_16_02,通过宣传，使党的路线、方针、政策直达基层，落地生根；,判断法律关系/行为性质/责任承担或程序路径(回源细化),,,uncertain,uncertain,F0044:text | F0045:page 4 | F0045:page 8 | F0267:page 4 | F0267:page 8 | F0268:text,heuristic_atom_split_from_text_layer; needs回源核细则原文
R_CC0001_2024_丰台_一模_16_04,CC0001_2024_丰台_一模_16,党员和干部坚持人民至上，坚持实事求是、求真务实，定人基层，融入百姓，为群众办实事解难题。,evaluation_standard,formal,党员和干部坚持人民至上，坚持实事求是、求真务实，定人基层，融入百姓，为群众办实事解难题。,M_CC0001_2024_丰台_一模_16_01|M_CC0001_2024_丰台_一模_16_02,党员和干部坚持人民至上，坚持实事求是、求真务实，定人基层，融入百姓，为群众办实事解难题。,判断法律关系/行为性质/责任承担或程序路径(回源细化),,,uncertain,uncertain,F0044:text | F0045:page 4 | F0045:page 8 | F0267:page 4 | F0267:page 8 | F0268:text,heuristic_atom_split_from_text_layer; needs回源核细则原文
R_CC0001_2024_丰台_一模_16_05,CC0001_2024_丰台_一模_16,“四下基层”创新工作机制方法，起干部与群众之间的“连心桥”，既能有效促进党的路线、方针、政策贯彻落实，提高决策质量水平，又能畅通民意诉求通道，直抵民心，推动干部作风转变。,evaluation_standard,formal,“四下基层”创新工作机制方法，起干部与群众之间的“连心桥”，既能有效促进党的路线、方针、政策贯彻落实，提高决策质量水平，又能畅通民意诉求通道，直抵民心，推动干部作风转变。,M_CC0001_2024_丰台_一模_16_01|M_CC0001_2024_丰台_一模_16_02,“四下基层”创新工作机制方法，起干部与群众之间的“连心桥”，既能有效促进党的路线、方针、政策贯彻落实，提高决策质量水平，又能畅通民意诉求通道，直抵民心，推动干部作风转变。,判断法律关系/行为性质/责任承担或程序路径(回源细化),,促进,value,uncertain,F0044:text | F0045:page 4 | F0045:page 8 | F0267:page 4 | F0267:page 8 | F0268:text,heuristic_atom_split_from_text_layer; needs回源核细则原文
R_CC0001_2024_丰台_一模_16_06,CC0001_2024_丰台_一模_16,拓展答案： 促进治理能力、治理体系现代化，更好地履行政府职能，建设服务型政府，更好地维护人民群众的权利或利益，提高政府工作的效率，化解社会矛盾、促进社会和谐稳定。,evaluation_standard,formal,拓展答案： 促进治理能力、治理体系现代化，更好地履行政府职能，建设服务型政府，更好地维护人民群众的权利或利益，提高政府工作的效率，化解社会矛盾、促进社会和谐稳定。,M_CC0001_2024_丰台_一模_16_01|M_CC0001_2024_丰台_一模_16_02,拓展答案： 促进治理能力、治理体系现代化，更好地履行政府职能，建设服务型政府，更好地维护人民群众的权利或利益，提高政府工作的效率，化解社会矛盾、促进社会和谐稳定。,判断法律关系/行为性质/责任承担或程序路径(回源细化),,维护；促进,value,uncertain,F0044:text | F0045:page 4 | F0045:page 8 | F0267:page 4 | F0267:page 8 | F0268:text,heuristic_atom_split_from_text_layer; needs回源核细则原文
R_CC0001_2024_丰台_一模_16_07,CC0001_2024_丰台_一模_16,评分标准说明： 共性角度：3分 “四下基层”创新工作机制方法（替代促进治理能力、治理体系现代化）（1分），发挥党的领导核心作用（1分），是党坚持群众路线、密切联系群众的重要抓手（替代贯彻群众观点、群众路线或以人民为中心）（1分），能为社会主义现代化建设注入强进动力。,evaluation_standard,formal,评分标准说明： 共性角度：3分 “四下基层”创新工作机制方法（替代促进治理能力、治理体系现代化）（1分），发挥党的领导核心作用（1分），是党坚持群众路线、密切联系群众的重要抓手（替代贯彻群众观点、群众路线或以人民为中心）（1分），能为社会主义现代化建设注入强进动力。,M_CC0001_2024_丰台_一模_16_01|M_CC0001_2024_丰台_一模_16_02,评分标准说明： 共性角度：3分 “四下基层”创新工作机制方法（替代促进治理能力、治理体系现代化）（1分），发挥党的领导核心作用（1分），是党坚持群众路线、密切联系群众的重要抓手（替代贯彻群众观点、群众路线或以人民为中心）（1分），能为社会主义现代化建设注入强进动力。,判断法律关系/行为性质/责任承担或程序路径(回源细化),,促进,value,uncertain,F0044:text | F0045:page 4 | F0045:page 8 | F0267:page 4 | F0267:page 8 | F0268:text,heuristic_atom_split_from_text_layer; needs回源核细则原文
R_CC0001_2024_丰台_一模_16_08,CC0001_2024_丰台_一模_16,个性角度：（3个角度，每个角度2分，最高5分） 宣传角度：通过宣传，使党的路线方针政策直达基层、促进贯彻落实。,evaluation_standard,formal,个性角度：（3个角度，每个角度2分，最高5分） 宣传角度：通过宣传，使党的路线方针政策直达基层、促进贯彻落实。,M_CC0001_2024_丰台_一模_16_01|M_CC0001_2024_丰台_一模_16_02,个性角度：（3个角度，每个角度2分，最高5分） 宣传角度：通过宣传，使党的路线方针政策直达基层、促进贯彻落实。,判断法律关系/行为性质/责任承担或程序路径(回源细化),,促进,value,uncertain,F0044:text | F0045:page 4 | F0045:page 8 | F0267:page 4 | F0267:page 8 | F0268:text,heuristic_atom_split_from_text_layer; needs回源核细则原文
R_CC0001_2024_丰台_一模_16_09,CC0001_2024_丰台_一模_16,从群众来角度：通过调查研究使党和政府更好地了解群众需求、提高决策质量水平。,evaluation_standard,formal,从群众来角度：通过调查研究使党和政府更好地了解群众需求、提高决策质量水平。,M_CC0001_2024_丰台_一模_16_01|M_CC0001_2024_丰台_一模_16_02,从群众来角度：通过调查研究使党和政府更好地了解群众需求、提高决策质量水平。,判断法律关系/行为性质/责任承担或程序路径(回源细化),,,uncertain,uncertain,F0044:text | F0045:page 4 | F0045:page 8 | F0267:page 4 | F0267:page 8 | F0268:text,heuristic_atom_split_from_text_layer; needs回源核细则原文
R_CC0001_2024_丰台_一模_16_10,CC0001_2024_丰台_一模_16,到群众中去角度：通过信访接待、现场办公等为群众办实事解难题、维护群众权利，化解社会矛盾、促进社会和谐稳定。,evaluation_standard,formal,到群众中去角度：通过信访接待、现场办公等为群众办实事解难题、维护群众权利，化解社会矛盾、促进社会和谐稳定。,M_CC0001_2024_丰台_一模_16_01|M_CC0001_2024_丰台_一模_16_02,到群众中去角度：通过信访接待、现场办公等为群众办实事解难题、维护群众权利，化解社会矛盾、促进社会和谐稳定。,判断法律关系/行为性质/责任承担或程序路径(回源细化),,维护；促进,value,uncertain,F0044:text | F0045:page 4 | F0045:page 8 | F0267:page 4 | F0267:page 8 | F0268:text,heuristic_atom_split_from_text_layer; needs回源核细则原文
R_CC0001_2024_丰台_一模_16_11,CC0001_2024_丰台_一模_16,说明：共性角度中，创新工作机制方法这一分最难，是必采点，学生其他角度都答得很好，缺少这个角度最多给7分。,evaluation_standard,formal,说明：共性角度中，创新工作机制方法这一分最难，是必采点，学生其他角度都答得很好，缺少这个角度最多给7分。,M_CC0001_2024_丰台_一模_16_01|M_CC0001_2024_丰台_一模_16_02,说明：共性角度中，创新工作机制方法这一分最难，是必采点，学生其他角度都答得很好，缺少这个角度最多给7分。,判断法律关系/行为性质/责任承担或程序路径(回源细化),,,uncertain,uncertain,F0044:text | F0045:page 4 | F0045:page 8 | F0267:page 4 | F0267:page 8 | F0268:text,heuristic_atom_split_from_text_layer; needs回源核细则原文
R_CC0001_2024_丰台_一模_16_12,CC0001_2024_丰台_一模_16,在个性角度中，学生要强调出相关措施是如何为社会主义现代化建设注入强劲活力的，才能给5分。,evaluation_standard,formal,在个性角度中，学生要强调出相关措施是如何为社会主义现代化建设注入强劲活力的，才能给5分。,M_CC0001_2024_丰台_一模_16_01|M_CC0001_2024_丰台_一模_16_02,在个性角度中，学生要强调出相关措施是如何为社会主义现代化建设注入强劲活力的，才能给5分。,判断法律关系/行为性质/责任承担或程序路径(回源细化),,,value,uncertain,F0044:text | F0045:page 4 | F0045:page 8 | F0267:page 4 | F0267:page 8 | F0268:text,heuristic_atom_split_from_text_layer; needs回源核细则原文
R_CC0001_2024_丰台_一模_16_13,CC0001_2024_丰台_一模_16,只分析具体的作用的，最多给4分。,evaluation_standard,formal,只分析具体的作用的，最多给4分。,M_CC0001_2024_丰台_一模_16_01|M_CC0001_2024_丰台_一模_16_02,只分析具体的作用的，最多给4分。,判断法律关系/行为性质/责任承担或程序路径(回源细化),,,uncertain,uncertain,F0044:text | F0045:page 4 | F0045:page 8 | F0267:page 4 | F0267:page 8 | F0268:text,heuristic_atom_split_from_text_layer; needs回源核细则原文
R_CC0001_2024_丰台_一模_16_14,CC0001_2024_丰台_一模_16,结合材料，运用《法律与生活》知识，谈谈法院酌情减轻被告赔偿责任的法理依据和现实意义。,evaluation_standard,formal,结合材料，运用《法律与生活》知识，谈谈法院酌情减轻被告赔偿责任的法理依据和现实意义。,M_CC0001_2024_丰台_一模_16_16|M_CC0001_2024_丰台_一模_16_17,结合材料，运用《法律与生活》知识，谈谈法院酌情减轻被告赔偿责任的法理依据和现实意义。,判断法律关系/行为性质/责任承担或程序路径(回源细化),被告；法律与生活,,knowledge+material,no,F0044:text | F0045:page 4 | F0045:page 8 | F0267:page 4 | F0267:page 8 | F0268:text,heuristic_atom_split_from_text_layer; needs回源核细则原文
R_CC0001_2024_丰台_一模_16_15,CC0001_2024_丰台_一模_16,参考答案：法院判决应以事实为依据，以法律为准绳。,evaluation_standard,formal,参考答案：法院判决应以事实为依据，以法律为准绳。,M_CC0001_2024_丰台_一模_16_01|M_CC0001_2024_丰台_一模_16_02,参考答案：法院判决应以事实为依据，以法律为准绳。,判断法律关系/行为性质/责任承担或程序路径(回源细化),,,material,no,F0044:text | F0045:page 4 | F0045:page 8 | F0267:page 4 | F0267:page 8 | F0268:text,heuristic_atom_split_from_text_layer; needs回源核细则原文
R_CC0001_2024_丰台_一模_16_16,CC0001_2024_丰台_一模_16,本案中，驾驶人乙某和搭乘人甲某之间形成好意同乘关系。,evaluation_standard,formal,本案中，驾驶人乙某和搭乘人甲某之间形成好意同乘关系。,M_CC0001_2024_丰台_一模_16_01|M_CC0001_2024_丰台_一模_16_02,本案中，驾驶人乙某和搭乘人甲某之间形成好意同乘关系。,判断法律关系/行为性质/责任承担或程序路径(回源细化),,,material,no,F0044:text | F0045:page 4 | F0045:page 8 | F0267:page 4 | F0267:page 8 | F0268:text,heuristic_atom_split_from_text_layer; needs回源核细则原文
R_CC0001_2024_丰台_一模_16_17,CC0001_2024_丰台_一模_16,驾驶人对搭乘人的生命财产安全负有保障义务，被告乙某发生交通事故，造成原告甲某受伤，侵犯了其生命权、健康权，需要承担相应责任。,evaluation_standard,formal,驾驶人对搭乘人的生命财产安全负有保障义务，被告乙某发生交通事故，造成原告甲某受伤，侵犯了其生命权、健康权，需要承担相应责任。,M_CC0001_2024_丰台_一模_16_16|M_CC0001_2024_丰台_一模_16_17,驾驶人对搭乘人的生命财产安全负有保障义务，被告乙某发生交通事故，造成原告甲某受伤，侵犯了其生命权、健康权，需要承担相应责任。,判断法律关系/行为性质/责任承担或程序路径(回源细化),生命权；健康权；原告；被告,,knowledge+material,no,F0044:text | F0045:page 4 | F0045:page 8 | F0267:page 4 | F0267:page 8 | F0268:text,heuristic_atom_split_from_text_layer; needs回源核细则原文
R_CC0001_2024_丰台_一模_16_18,CC0001_2024_丰台_一模_16,被告乙某在原告甲某受伤一事上，固然存在过错，但并非故意或重大过失，原告甲某诉请其承担全部赔偿责任，有违民事活动的平等原则，根据民法典和好意同乘相关规定，应当减轻被告乙某的赔偿责任。,evaluation_standard,formal,被告乙某在原告甲某受伤一事上，固然存在过错，但并非故意或重大过失，原告甲某诉请其承担全部赔偿责任，有违民事活动的平等原则，根据民法典和好意同乘相关规定，应当减轻被告乙某的赔偿责任。,M_CC0001_2024_丰台_一模_16_16|M_CC0001_2024_丰台_一模_16_17,被告乙某在原告甲某受伤一事上，固然存在过错，但并非故意或重大过失，原告甲某诉请其承担全部赔偿责任，有违民事活动的平等原则，根据民法典和好意同乘相关规定，应当减轻被告乙某的赔偿责任。,判断法律关系/行为性质/责任承担或程序路径(回源细化),民法典；原告；被告,,knowledge+material,no,F0044:text | F0045:page 4 | F0045:page 8 | F0267:page 4 | F0267:page 8 | F0268:text,heuristic_atom_split_from_text_layer; needs回源核细则原文
R_CC0001_2024_丰台_一模_16_19,CC0001_2024_丰台_一模_16,法院判决有利于维护双方合法权益，促进社会公平，对维持人际关系和谐，弘扬社会主义核心价值观及减少交通拥堵、倡导绿色出行具有积极意义。,evaluation_standard,formal,法院判决有利于维护双方合法权益，促进社会公平，对维持人际关系和谐，弘扬社会主义核心价值观及减少交通拥堵、倡导绿色出行具有积极意义。,M_CC0001_2024_丰台_一模_16_01|M_CC0001_2024_丰台_一模_16_02,法院判决有利于维护双方合法权益，促进社会公平，对维持人际关系和谐，弘扬社会主义核心价值观及减少交通拥堵、倡导绿色出行具有积极意义。,判断法律关系/行为性质/责任承担或程序路径(回源细化),,维护；促进；公平,material+value,no,F0044:text | F0045:page 4 | F0045:page 8 | F0267:page 4 | F0267:page 8 | F0268:text,heuristic_atom_split_from_text_layer; needs回源核细则原文
R_CC0001_2024_丰台_一模_16_20,CC0001_2024_丰台_一模_16,拓展答案： 在回答现实意义时，从对个人、对国家司法、对社会发展三个角度作答。,evaluation_standard,formal,拓展答案： 在回答现实意义时，从对个人、对国家司法、对社会发展三个角度作答。,M_CC0001_2024_丰台_一模_16_01|M_CC0001_2024_丰台_一模_16_02,拓展答案： 在回答现实意义时，从对个人、对国家司法、对社会发展三个角度作答。,判断法律关系/行为性质/责任承担或程序路径(回源细化),,,value,uncertain,F0044:text | F0045:page 4 | F0045:page 8 | F0267:page 4 | F0267:page 8 | F0268:text,heuristic_atom_split_from_text_layer; needs回源核细则原文
R_CC0001_2024_丰台_一模_16_21,CC0001_2024_丰台_一模_16,涉及维护双方合法权益、保障公正司法、弘扬社会主义核心价值观等方面。,evaluation_standard,formal,涉及维护双方合法权益、保障公正司法、弘扬社会主义核心价值观等方面。,M_CC0001_2024_丰台_一模_16_01|M_CC0001_2024_丰台_一模_16_02,涉及维护双方合法权益、保障公正司法、弘扬社会主义核心价值观等方面。,判断法律关系/行为性质/责任承担或程序路径(回源细化),,维护,value,uncertain,F0044:text | F0045:page 4 | F0045:page 8 | F0267:page 4 | F0267:page 8 | F0268:text,heuristic_atom_split_from_text_layer; needs回源核细则原文
R_CC0001_2024_丰台_一模_16_22,CC0001_2024_丰台_一模_16,评分标准说明： 本题8分，涉及两问。,evaluation_standard,formal,评分标准说明： 本题8分，涉及两问。,M_CC0001_2024_丰台_一模_16_01|M_CC0001_2024_丰台_一模_16_02,评分标准说明： 本题8分，涉及两问。,判断法律关系/行为性质/责任承担或程序路径(回源细化),,,uncertain,uncertain,F0044:text | F0045:page 4 | F0045:page 8 | F0267:page 4 | F0267:page 8 | F0268:text,heuristic_atom_split_from_text_layer; needs回源核细则原文
R_CC0001_2024_丰台_一模_16_23,CC0001_2024_丰台_一模_16,其中法理依据占5分，现实意义占3分。,evaluation_standard,formal,其中法理依据占5分，现实意义占3分。,M_CC0001_2024_丰台_一模_16_01|M_CC0001_2024_丰台_一模_16_02,其中法理依据占5分，现实意义占3分。,判断法律关系/行为性质/责任承担或程序路径(回源细化),,,uncertain,uncertain,F0044:text | F0045:page 4 | F0045:page 8 | F0267:page 4 | F0267:page 8 | F0268:text,heuristic_atom_split_from_text_layer; needs回源核细则原文
R_CC0001_2024_丰台_一模_16_24,CC0001_2024_丰台_一模_16,在法理依据方面，采用1+2+2的评分细则。,evaluation_standard,formal,在法理依据方面，采用1+2+2的评分细则。,M_CC0001_2024_丰台_一模_16_01|M_CC0001_2024_丰台_一模_16_02,在法理依据方面，采用1+2+2的评分细则。,判断法律关系/行为性质/责任承担或程序路径(回源细化),,,uncertain,uncertain,F0044:text | F0045:page 4 | F0045:page 8 | F0267:page 4 | F0267:page 8 | F0268:text,heuristic_atom_split_from_text_layer; needs回源核细则原文
R_CC0001_2024_丰台_一模_16_25,CC0001_2024_丰台_一模_16,其中“法院判决应以事实为依据，以法律为准绳”为必踩点，1分；,evaluation_standard,formal,其中“法院判决应以事实为依据，以法律为准绳”为必踩点，1分；,M_CC0001_2024_丰台_一模_16_01|M_CC0001_2024_丰台_一模_16_02,其中“法院判决应以事实为依据，以法律为准绳”为必踩点，1分；,判断法律关系/行为性质/责任承担或程序路径(回源细化),,,material,no,F0044:text | F0045:page 4 | F0045:page 8 | F0267:page 4 | F0267:page 8 | F0268:text,heuristic_atom_split_from_text_layer; needs回源核细则原文
R_CC0002_2024_丰台_一模_17_01,CC0002_2024_丰台_一模_17,17.(8 分) [page 5],missing,missing,17.(8 分) [page 5],M_CC0002_2024_丰台_一模_17_01|M_CC0002_2024_丰台_一模_17_02,17.(8 分) [page 5],判断法律关系/行为性质/责任承担或程序路径(回源细化),,,uncertain,uncertain,F0045:page 4 | F0045:page 8 | F0267:page 4 | F0267:page 8,heuristic_atom_split_from_text_layer; needs回源核细则原文
R_CC0002_2024_丰台_一模_17_02,CC0002_2024_丰台_一模_17,第5页/共9页 《中华人民共和国民法典》 第一千二百一十七条 非营运机动车发生交通事故造 成无偿搭乘人损害，属于该机动车一方责任的，应当 减轻其赔偿责任，但是机动车使用人有故意或重大过 失的除外。 资料卡 好意同乘：指驾驶人基于善意互助或友情帮助，无偿 搭载他人或允许大人无偿搭乘的情谊行为。 甲某搭乙某的车出行，上车后未听乙某提醒系好安全带。乙某在驾驶过程中因雨天 路滑，撞到灯杆，造 成甲某受伤住院。为此，乙某主动垫付了部分医疗费用。甲某认为， 本次交通事故对自己造成严重人身 财产损害，乙某应承担全部责任，向其赔付医疗费、误 工费和护理费等损失。乙某认为自己好意让甲某 免费搭乘，由于客观原因发生意外，并无过错，不应该承担全部责任。两人为此诉至法院。 法院综合考虑本案好意同乘时的具体情况、事故事实以及被告乙某主动承担部分责任的行为等，酌情减轻 乙某赔偿责任。 结合材料，运用《法律与生活》知识，谈谈法院酌情减轻被告赔偿责任的法理依据和现实意义。,missing,missing,第5页/共9页 《中华人民共和国民法典》 第一千二百一十七条 非营运机动车发生交通事故造 成无偿搭乘人损害，属于该机动车一方责任的，应当 减轻其赔偿责任，但是机动车使用人有故意或重大过 失的除外。 资料卡 好意同乘：指驾驶人基于善意互助或友情帮助，无偿 搭载他人或允许大人无偿搭乘的情谊行为。 甲某搭乙某的车出行，上车后未听乙某提醒系好安全带。乙某在驾驶过程中因雨天 路滑，撞到灯杆，造 成甲某受伤住院。为此，乙某主动垫付了部分医疗费用。甲某认为， 本次交通事故对自己造成严重人身 财产损害，乙某应承担全部责任，向其赔付医疗费、误 工费和护理费等损失。乙某认为自己好意让甲某 免费搭乘，由于客观原因发生意外，并无过错，不应该承担全部责任。两人为此诉至法院。 法院综合考虑本案好意同乘时的具体情况、事故事实以及被告乙某主动承担部分责任的行为等，酌情减轻 乙某赔偿责任。 结合材料，运用《法律与生活》知识，谈谈法院酌情减轻被告赔偿责任的法理依据和现实意义。,M_CC0002_2024_丰台_一模_17_01|M_CC0002_2024_丰台_一模_17_08,第5页/共9页 《中华人民共和国民法典》 第一千二百一十七条 非营运机动车发生交通事故造 成无偿搭乘人损害，属于该机动车一方责任的，应当 减轻其赔偿责任，但是机动车使用人有故意或重大过 失的除外。 资料卡 好意同乘：指驾驶人基于善意互助或友情帮助，无偿 搭载他人或允许大人无偿搭乘的情谊行为。 甲某搭乙某的车出行，上车后未听乙某提醒系好安全带。乙某在驾驶过程中因雨天 路滑，撞到灯杆，造 成甲某受伤住院。为此，乙某主动垫付了部分医疗费用。甲某认为， 本次交通事故对自己造成严重人身 财产损害，乙某应承担全部责任，向其赔付医疗费、误 工费和护理费等损失。乙某认为自己好意让甲某 免费搭乘，由于客观原因发生意外，并无过错，不应该承担全部责任。两人为此诉至法院。 法院综合考虑本案好意同乘时的具体情况、事故事实以及被告乙某主动承担部分责任的行为等，酌情减轻 乙某赔偿责任。 结合材料，运用《法律与生活》知识，谈谈法院酌情减轻被告赔偿责任的法理依据和现实意义。,判断法律关系/行为性质/责任承担或程序路径(回源细化),民法典；被告；法律与生活,,knowledge+material,no,F0045:page 4 | F0045:page 8 | F0267:page 4 | F0267:page 8,heuristic_atom_split_from_text_layer; needs回源核细则原文
