"entry_id","question_id","reasoning_form","logical_structure","validity_or_fallacy","rule_kouling","answer_sentence","evidence_level","status","rubric_source"
"RF0071","Q0117","类比推理","把人体健康体检中的“检测指标、预判风险、主动干预”迁移到治理领域，形成治理体检的思路。源域是健康管理，目标域是治理。","阅卷细则锁定推理类型为类比推理，2分，写其他不得分；价值层面围绕创新治理思路和提高治理效能各2分，不结合材料最高3分。","类比推理要抓两个对象之间的相似结构；本题相似结构不是“都叫体检”，而是都通过提前检测、预判风险、主动干预来提升管理效果。","东城二模 Q18 可写：体检思维从人体健康领域延伸到治理领域，运用了类比推理；借鉴体检的提前预判和主动干预，有利于创新治理思路、提高治理效能。","A-formal","source_locked_pending_external_review","09_logs/2026_ermo_text_extract/2026东城二模_试卷_2026北京东城高三二模政治_教师版_.docx.txt:105-107,140-141; 09_logs/2026_ermo_text_extract/2026东城二模_细则_18题阅卷细则_5.9_.pdf.txt:8-21"
"RF0072","Q0119","必要条件判断/双重否定表达","题干说没有未来产业为载体，先进技术就无法形成现实生产能力，锁定未来产业是先进技术形成现实生产能力的必要条件；D项把未来产业定义转写成“有些具有显著战略性、引领性、颠覆性和不确定性的前瞻性产业不是非未来产业”。","答案 Q6=D。D 等价于有些具有这些特征的前瞻性产业是未来产业，可由未来产业定义推出；B 把必要条件误推为充分条件，A/C 把监管材料扩张成过强条件。","看到“没有P就没有Q”，只能推出P是Q的必要条件，不能反推有P就有Q；“不是非P”就是P，双重否定要先还原。","朝阳二模 Q6 选 D。未来产业具有显著战略性、引领性、颠覆性和不确定性，所以有些具有这些特征的前瞻性产业不是非未来产业；但不能说只要以未来产业为载体，先进技术就一定形成现实生产能力。","A-support","source_locked_pending_external_review","09_logs/2026_ermo_text_extract/2026朝阳二模_试卷_2026北京朝阳高三二模政治_教师版_.docx.txt:37-41,289-290"
"RF0073","Q0121","定义方法/种差加属概念","材料界定“生产性服务业”：属概念为服务行业，种差为促进技术进步、提高生产效率、保障工农业生产活动有序进行；并用肯定与否定相结合解释内涵。","正式细则锁定定义方法、种差加属概念、材料属概念和种差对应、肯定与否定相结合、避免否定定义和循环定义等规则。","下定义先找属概念，再找区别于同属其他对象的种差；定义项不能过宽、过窄、循环或只是否定说明。","朝阳二模 Q19(1) 可写：材料用种差加属概念的方法界定生产性服务业，把它归入“服务行业”，并用促进技术进步、提高生产效率、保障工农业生产活动有序进行作为种差；同时说明其与制造业直接相关且不向消费者提供直接独立服务，使概念内涵更清晰。","A-formal","source_locked_pending_external_review","09_logs/2026_ermo_text_extract/2026朝阳二模_试卷_2026北京朝阳高三二模政治_教师版_.docx.txt:110-112,139-142; 09_logs/2026_ermo_text_extract/2026朝阳二模_细则_202605朝阳高三政治二模阅卷细则_1_.docx.txt:46-54"
"RF0074","Q0124","必要条件判断","只有数据被拆解成词元，人工智能才能分析运算；因此用户提问没有被拆解成词元，可以推出人工智能无法分析运算。","有效：必要条件假言判断的否定前件式；A/B/C 为概念外延或关系性质误判，不是本题正确推理。","看到“只有P才Q”，可写成 Q -> P；否定P就能否定Q，不能把概念关系乱套。","海淀二模 Q5 选 D。用户的提问没有被拆解成词元，则人工智能无法分析运算。","A-support","source_locked_pending_external_review","09_logs/2026_ermo_text_extract/2026海淀二模_试卷_2026北京海淀高三二模政治_教师版_.docx.txt:27-31,139-143"
"RF0075","Q0125","演绎推理/必要条件/选言边界","表格条件锁定：有的未达最低出口额但有发展潜力的中小企业获得参展资格；参加新品首发活动以拥有自主知识产权为必要条件；新品首发产品须是全球市场或广交会首次发布。","①②有效；③从未参加新品首发反推没有知识产权，属于无效反推；④把“全球市场或广交会首次发布”误作不相容选言。","必要条件只能保真推出“参加则拥有”，不能由不参加反推不拥有；“P或Q”未说明不相容时，不能推出P就非Q。","海淀二模 Q6 选 A，即①②。","A-support","source_locked_pending_external_review","09_logs/2026_ermo_text_extract/2026海淀二模_试卷_2026北京海淀高三二模政治_教师版_.docx.txt:32-38,139-143; C:/Users/Administrator/Desktop/2026各区模拟题/2026各区二模/2026海淀二模/试卷/2026北京海淀高三二模政治（教师版）.docx:table1"
"RF0076","Q0126","不完全归纳推理","对多个城市桥下空间改造项目进行跟踪调查，由部分对象的共同情况推出一般结论：桥下空间改造是提升城市活力的有效途径。","有效但非必然：属于不完全归纳推理，增加考察对象数量可提高可靠程度；不能说结论具有必然性。","部分到一般是不完全归纳，可靠程度可以提高，但结论通常不是必然。","海淀二模 Q7 选 A，即①②。","A-support","source_locked_pending_external_review","09_logs/2026_ermo_text_extract/2026海淀二模_试卷_2026北京海淀高三二模政治_教师版_.docx.txt:39-44,139-143"
"RF0077","Q0128","三段论构建","大前提：符合和平与发展主题的举措是应对全球发展各种新挑战的正确选择；小前提：同球共济、团结合作是符合和平与发展主题的举措；结论：同球共济、团结合作是应对全球发展各种新挑战的正确选择。","有效：中项“符合和平与发展主题的举措”联结大小项，符合三段论推理规则。","先定结论大小项，再补能联结二者的中项；三段论要有大前提、小前提、结论，不能出现四概念或中项不周延；同时查前提真实性：材料须能支持“同球共济、团结合作”符合和平与发展主题。","海淀二模 Q20(1) 可按示例写出合乎逻辑的三段论推理。","A-formal","source_locked_pending_external_review","09_logs/2026_ermo_text_extract/2026海淀二模_试卷_2026北京海淀高三二模政治_教师版_.docx.txt:128-132,158,188-192"
"RF0078","Q0130","相容选言/必要条件推理","题干条件：该社区参与竞选绿色宜居示范小区 -> 解决餐饮油烟扰民问题 或 解决固定设备噪声扰民问题。要推出解决餐饮油烟扰民，需要补充入选/参选且未解决设备噪声。","B 有效：入选示范社区肯定后件所需条件，未解决设备噪声否定一个选言支，故必须解决餐饮油烟扰民。","先把“只有P或Q，才R”转成 R -> (P或Q)；再用否定一个支项来肯定另一个支项。","西城二模 Q5 选 B。该社区未解决设备噪声扰民问题，但入选了示范社区，可以必然推出该社区解决了餐饮油烟扰民问题。","A-support","source_locked_pending_external_review","09_logs/2026_ermo_text_extract/2026西城二模_试卷_2026北京西城高三二模政治_教师版_.docx.txt:33-39,144-148"
"RF0079","Q0134","同一律/概念确定性","食品标签中的“0”“100%”等符号被突出为商标或宣传点，容易让消费者把商标、比例、纯度、零添加等不同概念混同。新版标准禁止“零添加”等易误导用语，要求概念使用保持同一和确定。","B 正确：符合同一律，避免误导消费者。A 把偷换概念方向说对但把同一律要求误写成一致性；C 误挂矛盾律和明确性；D 误挂排中律骑墙。","同一律看概念是否前后一致、确定；矛盾律看是否自相矛盾；排中律看是否在是非之间骑墙。","石景山二模 Q7 选 B。禁止易误导标签用语，是为了让食品标签概念保持确定和同一，避免消费者被混同概念误导。","A-support","source_locked_pending_external_review","09_logs/2026_ermo_text_extract/2026石景山二模_试卷_2026北京石景山高三二模政治_教师版_.docx.txt:38-42,116-118"
"RF0080","Q0139","矛盾律/一致性要求","车企初期判断 A：AI 自动驾驶系统全程正常，事故原因归于外部突发情况；后续又承认非 A：系统存在感知延迟，存在系统问题。两个判断指向同一事故、同一系统、同一方面，不能同真。","结论一前半正确：企业前后说法自相矛盾，违反矛盾律；后半错误：这不是违反思维的确定性要求，而是违反思维的一致性要求。","同一时间、同一方面、同一对象上 A 和非 A 不能同真；矛盾律管一致性，同一律管确定性。","顺义二模 Q18(1) 可写：企业前后判断不能同真，其中必有一假，构成自相矛盾，违反矛盾律；但应表述为违反思维一致性要求，而不是确定性要求。","A-formal","source_locked_pending_external_review","09_logs/render_check_shunyi_2026_ermo/shunyi2026_ermo_page_009.png; 09_logs/2026_ermo_text_extract/2026顺义二模_细则_26顺义二模评标_doc_COM_normalized.txt:55-57"
"RF0081","Q0141","科学归纳推理/求异法 + 类比推理","科学团队先比较高粱 AT1 基因与耐碱能力的因果关系，再根据高粱 AT1 基因与水稻 GS3 基因的相似属性迁移推断水稻耐碱密码。","有效路径：科学归纳推理中用求异法探求因果联系；再用类比推理从高粱相似属性迁移到水稻。V92 已回源裁定：source path 与旧 source ledger 均属 2024东城二模；真正东城一模 Q17(2) 为北极熊毛衣题，故内页一模标题按模板/页眉误写处理，边界保留待 Claude 复核。","求异法看“其他基本相同，关键因素有无不同，结果有无不同”；类比推理看两个对象是否存在可迁移的相似属性和关系。","东城二模来源包 Q17(2) 可写：科学团队运用科学归纳推理，利用求异法探求 AT1 与高粱耐碱能力的因果联系；又根据高粱 AT1 基因与水稻 GS3 基因的相似属性进行类比推理，找到水稻 GS3 基因与耐碱属性的关系。","A-formal","source_verified_header_typo_boundary_accepted_pending_claude_review","gpt_sources/72fd64a3dddd2c89_17-2.md:22-39,44-49"
"RF0082","Q0142","充分条件假言推理前提真假辨析","学生推理为：有良好的创新生态 -> 实现创新发展；当前有良好创新生态；所以一定实现创新发展。","结构上是充分条件假言推理的肯定前件式，结构有效；但“良好的创新生态”只是实现创新发展的必要条件，不是充分条件，前提虚假，所以结论错误。","肯前肯后结构本身有效，但先检查前提中的条件关系是否成立；重要条件、必要条件不能直接写成充分条件。","东城二模 Q18(2) 可写：该推理是充分条件假言推理，结构上采用肯定前件而肯定后件，但把良好的创新生态误作实现创新发展的充分条件，前提虚假，所以结论错误。","A-formal","source_locked_pending_external_review","gpt_sources/9b287871f660f23d_2025北京东城高三二模政治_教师版.md:184-187,276-278; gpt_sources/606dbae1d5ce3e59_2025东城二模细则.md:107-118,123-126"
"RF0083","Q0143","三段论构建","小前提固定为“工业固废是放错了地方的资源”；可补大前提“放错了地方的资源可以通过适当方式被重新利用”，结论为“工业固废可以通过适当方式被重新利用”。","有效：大项来自大前提，小项来自小前提，中项“资源/放错了地方的资源”联结大小项；正式细则要求符合三段论基本规则得 4 分。","先定结论中的小项和大项，再补能联结二者的中项；大前提不能过窄，结论主项要来自小前提；同时查前提真实性：不能把“放错了地方的资源”扩大成“所有资源”。","西城期末 Q17(2) 可写：放错了地方的资源可以通过适当的方式被重新利用；工业固废是放错了地方的资源；所以，工业固废可以通过适当的方式被重新利用。","A-formal","source_locked_pending_external_review","gpt_sources/6662da1c2772cc38_2025北京西城高三_上_期末政治_教师版.md:191-215,281-292; gpt_sources/89d264a31e348be6_2025西城期末细则.md:70-77"

