"entry_id","question_id","reasoning_form","logical_structure","validity_or_fallacy","rule_kouling","answer_sentence","evidence_level","status","rubric_source"
"RF0043","Q0067","定义构成/属加种差定义","定义结构为：被定义项=举国体制；定义联项=是；种差=利用国家力量动员规模性资源、实现国家目标；属概念=一种任务组织方式和体制机制安排。","有效：该定义用属概念加种差说明举国体制，能把定义项与被定义项对应起来。","定义题先拆四件：被定义项、定义联项、种差、属概念；不要把整个定义项只写成属概念。","西城一模 Q19(2) 可写：①举国体制，②是，③利用国家力量动员规模性资源、实现国家目标，④一种任务组织方式和体制机制安排。","A-formal","source_locked_pending_external_review","gpt_sources/2aa2ee045f75ecd8_2024.4高三统一测试思想政治试卷.md:226-278; gpt_sources/91e28443e7a1bb0e_2024.4高三统一测试思想政治答案.md:53-62; gpt_sources/f7bcf000f212cc69_2024西城一模细则.md:65-78"
"RF0044","Q0068","概念外延关系：相容/属种关系","新型举国体制是举国体制的一种新形态；二者外延不是全异，正式答案接受相容或属种。","有效：属种关系属于相容关系；不能写成全同或全异。","看到“新型X”和“X”，先判断新型是不是X的一种；若是，就是属种，也属于相容。","西城一模 Q19(3) 可写：“举国体制”与“新型举国体制”的外延是相容关系，也可写属种关系。","A-formal","source_locked_pending_external_review","gpt_sources/2aa2ee045f75ecd8_2024.4高三统一测试思想政治试卷.md:226-278; gpt_sources/91e28443e7a1bb0e_2024.4高三统一测试思想政治答案.md:53-62; gpt_sources/f7bcf000f212cc69_2024西城一模细则.md:65-78"
"RF0045","Q0071","逻辑规则综合选择","D项：选择必须比较，不加比较作选择包含逻辑矛盾；A/B/C分别误判定义、列举/划分、概念搭配问题。","正确选D","逐项判规：不要把定义过宽误判为同语反复，不要把列举误判为严格划分错误，不要把概念搭配不当误判为不表达判断；抓住自相矛盾。","东城一模 Q6 选 D：不加比较作选择与选择本身的要求冲突，违背矛盾律。","A-formal","source_locked_pending_external_review","paper render preprocessed_corpus/renders/74cdfac9253763bf/page_003.png; answer render preprocessed_corpus/renders/7b4eece2963205d8/page_001.png; gpt_sources/4b2073bcc9e26f62_2024东城一模细则.md:22-27"
"RF0046","Q0072","三段论有效性与前提真实性","所有鸟都是会飞的；鸵鸟是鸟；所以鸵鸟是会飞的。","形式有效但前提不真，结论不真；正确选A=①②","演绎推理形式有效不等于结论真实；前提真实和形式有效共同保证结论真实；三项清楚时不要误判四概念。","东城一模 Q7 选 A：该三段论推理形式有效，但大前提“所有鸟都是会飞的”为假，所以结论“鸵鸟会飞”不正确。","A-formal","source_locked_pending_external_review","paper render preprocessed_corpus/renders/74cdfac9253763bf/page_003.png; answer render preprocessed_corpus/renders/7b4eece2963205d8/page_001.png"
"RF0047","Q0073","复合假言/选言推理链","小徐未选物理 -> 小赵未选地理 -> 小王未选政治；或者小李选政治，或者小王选政治；所以小李选政治。","正确选D","先把“只有A才B”改写为B->A，再用逆否；再把“如果P那么Q”逆否为非Q->非P；最后用选言推理排除一支推出另一支。","东城一模 Q8 选 D：小徐未选物理可推出小赵未选地理，再推出小王未选政治；既然小李或小王选政治，排除小王后必然推出小李选政治。","A-formal","source_locked_pending_external_review","paper render preprocessed_corpus/renders/74cdfac9253763bf/page_003.png; answer render preprocessed_corpus/renders/7b4eece2963205d8/page_001.png"
"RF0048","Q0074","类比推理/联想迁移复合辨析","海草培育移植法模仿地上植物移植技术方法，同时把既有移植经验迁移到海草生态修复场景。","支持选择 A：①②正确；③超前思维与④发散思维不直接对应题中既定技术路线。","看到“模仿某类对象的方法”先判类比推理；看到“由此及彼的迁移”再判联想思维，不要把所有技术改进都挂到超前或发散。","海草培育移植法既体现联想思维的迁移，也体现由地上植物移植方法到海草移植技术的类比推理。","A-support","source_locked_pending_external_review","gpt_sources/f581620be44a4c2c_2024北京石景山高三一模政治_教师版带答案.md:53-56; answer key :188"
"RF0049","Q0075","概念外延关系图示辨析","①财产权与物权可按图甲描述；④领土包含领陆、领空等组成部分，可按图丁描述；②③不符合对应图示外延关系。","支持选择 B：①④正确。","先判断两个概念的外延是包含、交叉、全异还是并列，再把概念关系映射到图示；不要把相关关系误写成外延关系。","石景山一模 Q7 的正确组合是①④，核心是把概念外延关系从文字关系转换到图示关系。","A-support","source_locked_pending_external_review","gpt_sources/f581620be44a4c2c_2024北京石景山高三一模政治_教师版带答案.md:57-61; answer key :188"
"RF0050","Q0076","枚举概括与同一对象替换","①在题干已给出三舱段封闭集合的前提下，把问天/梦天/天和分别是舱段概括为三者都是舱段；③把“中国空间站的三个舱段”与“问天、梦天、天和”作同一对象替换。","正确选B=①③；②把三个对象过度概括为航天人走过的路的穷尽选言；④由个别对象是路不能推出三者连缀征程。","先看集合是否封闭，再决定能否由列举概括；涉及两个表达指向同一对象时，可以替换保真；不要把若干例子偷换成全部对象。","西城一模 Q11 选 B。①是在封闭集合内作概括，③是同一对象替换；②犯过度概括，④添加了前提没有保证的整体关系。","A-formal","source_locked_pending_external_review","gpt_sources/2aa2ee045f75ecd8_2024.4高三统一测试思想政治试卷.md:105-143; gpt_sources/91e28443e7a1bb0e_2024.4高三统一测试思想政治答案.md:20-25; render 09_logs/render_check_west_2024_q11/west2024_page_005_q11.png"
"RF0051","Q0080","性质判断谓项周延性","文段多次作出“法是……社会规范”的肯定判断，其中“社会规范”作为肯定判断的谓项。","支持选择C：肯定判断的谓项不周延；A/D判断类型错误，B表述对象和方向不够严格。","性质判断先看肯定还是否定：肯定判断谓项不周延，否定判断谓项周延；再看选项有没有偷换对象或倒置属种方向。","丰台一模 Q7 选 C。“社会规范”在文中作为肯定判断的谓项出现，肯定判断的谓项不周延。","A-support","source_locked_pending_external_review","gpt_sources/5f5486bfc3baab2b_2024北京丰台高三一模政治试题及答案.md:80-92,287-293; render 09_logs/render_check_fengtai_2024_q7/fengtai2024_page_002_q7.png and page_008_answer_key.png"
"RF0052","Q0081","选言推理与逆向思维复合辨析","围棋一步棋存在多种可选走法，可用选言推理在备选方案中分析取舍；一步棋与双方局势相关，也可从对手、结果或相反方向倒推。","正确选B=①④；②把走法与结果的关系误挂必要条件假言判断；③把完全归纳推理绝对化。","多方案先看选言推理；从对手或结果反向审视时看逆向思维；不要把所有必然联系都写成必要条件，也不要把完全归纳说成取胜保证。","海淀一模 Q6 选 B。多种走法触发选言推理，双方关联触发逆向思维；必要条件和完全归纳两项不符合题干动作。","A-formal","source_locked_pending_external_review","gpt_sources/4bc0edec2a08a90e_高三政治_一模试题.md:98-105; gpt_sources/98d1d762f302004f_一模政治-答案.md:21-28"
"RF0053","Q0082","联言判断类型识别","“不是洋货买不起，而是国货更有性价比”可写成“并非P，并且Q”。选项C“前提真实，并且推理形式有效”也是联言判断。","正确选C；A为充分必要条件判断，B/D为条件判断。","看到“不是P，而是Q”先翻译为“非P并且Q”；判断类型题要找结构一致，而不是找语义话题相似。","海淀一模 Q7 选 C。题干句式是联言判断，选项C同样由两个判断通过“并且”联结。","A-formal","source_locked_pending_external_review","gpt_sources/4bc0edec2a08a90e_高三政治_一模试题.md:108-114; gpt_sources/98d1d762f302004f_一模政治-答案.md:21-28"
"RF0054","Q0084","类比推理","人效法天地之德：由天地生育万物不息、广阔博大的德性，类推人应自强不息、厚德载物。","正式细则锁定②为类比推理，且无变通；不能泛化为联想、演绎或归纳。","看到一个对象效法另一个对象的相似德性或方法时，优先检查类比推理。","人效法天地之德，是把天地之德类推到人的修身实践中，体现类比推理。","A-formal","source_locked_pending_external_review","gpt_sources/9223488a4b5e6f80_003202405朝阳高三二模政治试题.md:316-320; gpt_sources/84218459671af8ac_2024朝阳二模细则.md:142-150"
"RF0055","Q0085","联言判断真值条件","“与天地合其德，与日月合其明，与四时合其序”由三个并列联言支共同组成。","联言判断；全真才真，一假即假。","并列连接多个判断且要求同时成立时，判联言判断；真值口令是全真才真，一假即假。","该复合判断是联言判断；只有组成它的各个联言支都是真的，这个联言判断才是真的，如果有一个联言支为假，整个联言判断就是假的。","A-formal","source_locked_pending_external_review","gpt_sources/9223488a4b5e6f80_003202405朝阳高三二模政治试题.md:323-324; gpt_sources/84218459671af8ac_2024朝阳二模细则.md:155-163"
"RF0056","Q0088","复合判断识别与逻辑规则辨析","刑法第二十条正当防卫条文由目的、对象、正在进行的不法侵害、制止行为、损害后果、责任结论等多个判断联结而成。","官方答案 Q6=C：该判断属于复合判断。A误判划分规则，B把充分条件误判为充分必要条件，D把答非所问误挂排中律。","看到一个法律条文同时包含多个条件、行为和结论时，先判断是否由多个判断复合而成；不要把语义上的答非所问直接当排中律。","顺义二模 Q6 选 C。正当防卫条文由多个判断联结构成，属于复合判断。","A-formal","source_locked_pending_external_review","gpt_sources/33010f3bed39e275_20240318顺义思政二模试题_定.md:55-71; gpt_sources/f986728ea555a6ed_2024顺义思政二模细则.md:20-25"
"RF0057","Q0089","必要条件假言判断","只有不断加深对数字劳动的认识、把握基本特征并构建相关法律法规，才能确保数字劳动受到监管和保护并保证数字经济稳定快速发展。","官方答案 Q7=C：构建相关法律法规是保证数字经济稳定和快速发展的必要条件。","“只有P，才Q”表示P是Q的必要条件；没有P就没有Q，但有P不必然推出Q。","顺义二模 Q7 选 C。“只有……才……”表明构建相关法律法规是保证数字经济稳定和快速发展的必要条件。","A-formal","source_locked_pending_external_review","gpt_sources/33010f3bed39e275_20240318顺义思政二模试题_定.md:72-76; gpt_sources/f986728ea555a6ed_2024顺义思政二模细则.md:20-25"
"RF0058","Q0091","必要条件判断","河流是地球生命宜居的必要条件；没有河流，就不会有生命产生。","官方答案 Q11=D；A/B从可能证据过度推出遍布河流或存在生命，C把“很可能是遗迹”误判为非对称性关系判断。","必要条件口令：无P则无Q；不要由“必要条件存在”直接推出结果已经存在。","丰台一模 Q11 选 D。河流是地球生命宜居的必要条件，没有河流就不会有生命产生。","A-support","source_locked_pending_external_review","gpt_sources/5f5486bfc3baab2b_2024北京丰台高三一模政治试题及答案.md:113-120,287-292"
"RF0059","Q0093","探求因果联系/求异法","同样是棉质新毛巾、同样用超纯水多次洗涤，只改变干燥环境：有阳光的室外、阳光被遮挡的室外、室内；只有室外阳光下晒干的毛巾出现独特香气分子。","官方答案 Q5=A。只有一个关键条件不同且结果随之不同，符合求异法；不是多个场合同有同一条件的求同法，也不是量变同步的共变法。","求异法口令：其他情况基本相同，只有某一因素有无不同，结果也有无不同，就把该因素作为因果候选。","海淀二模 Q5 选 A。阳光是三组干燥条件中的关键差异，只有有阳光时出现香气分子，体现探求因果联系的求异法。","A-formal","source_locked_pending_external_review","gpt_sources/13d454fdd813a039_高三二模_政治试题_以PDF为准_1.md:51-52; gpt_sources/8f109fb09efc0c6a_高三二模_政治答案_2.md:20-25; gpt_sources/227192d22e10241b_2024海淀二模细则.md:20-23"
"RF0060","Q0094","概念属性与换位推理边界","特别国债是国债分类中的一种；超长期特别国债被定义为发行期限10年以上的特别国债；题目要求判断外延关系、属性和换位推理表述。","官方答案 Q6=C。发行期限10年以上反映超长期特别国债的属性；A把并列分类误判为矛盾关系，B将特别国债与超长期特别国债的关系表述不严，D把特称/全称结构简单换位导致主谓倒置过度。","概念题先分内涵属性和外延关系；换位推理必须看量项和谓项周延，不能把“特别国债是增量工具”直接倒成“增量工具是特别国债”。","海淀二模 Q6 选 C。“发行期限10年以上”说明超长期特别国债的属性；不能由材料经简单换位推出“助力经济增长的增量工具是特别国债”。","A-formal","source_locked_pending_external_review","gpt_sources/13d454fdd813a039_高三二模_政治试题_以PDF为准_1.md:54-58; gpt_sources/8f109fb09efc0c6a_高三二模_政治答案_2.md:20-25; gpt_sources/227192d22e10241b_2024海淀二模细则.md:20-23"
"RF0061","Q0096","类比推理/性质判断换位换质","EAST因模拟太阳内部核聚变反应而被称为人造太阳；题中还由“有些模拟太阳核聚变的装置是EAST装置”推出“有些EAST装置不是非模拟太阳核聚变的装置”。","官方答案 Q6=A，即①③。①由相似属性作类比推理；③可先换位为有些EAST装置是模拟太阳核聚变的装置，再换质为有些EAST装置不是非模拟太阳核聚变的装置；④把托卡马克装置和EAST装置倒置为全称肯定的简单换位，推理无效。","类比看相似属性；特称肯定判断可换位，换质要加否定和负概念；全称肯定判断不能把主谓随意倒过来。","门头沟一模 Q6 选 A，即①③。EAST人造太阳体现类比推理，③是合规则的换位加换质表达，④属于不当换位。","A-formal","source_locked_pending_external_review","gpt_sources/e84e6bbdd8988978_门头沟区高三政治一模试卷.md:104-113; gpt_sources/89313bd871502cf4_2026门头沟一模细则.md:20-52"
"RF0062","Q0104","换质位推理边界","“有些属于非物质文化遗产组成部分的实物和场所，适用文物保护法”是特称肯定判断。","官方答案 Q5=D。该判断可换质为有些相关实物和场所不是不适用文物保护法，但换质后是特称否定判断，不能继续换位；因此不能进行有效换质位推理。","特称肯定判断可以换位，也可以换质；但换质后形成特称否定判断，特称否定判断不能换位。换质位要连续守规则，不能只看第一步。","石景山一模 Q5 选 D。原判断是特称肯定判断，换质后不能再换位，所以“无法进行换质位推理”成立。","A-formal","source_locked_pending_external_review","gpt_sources/0d4a5cd29c2e6961_2026北京石景山高三一模政治_教师版.md:67-80,288-290; gpt_sources/78d97b669465d8a5_2026石景山一模细则.md:23-25"
"RF0063","Q0105","必要条件判断/定义推断","具身智能是具有身体的人工智能，但并非所有具有身体的人工智能都是具身智能；只有能像人一样感知、学习的人工智能，才能称之为具身智能。","官方答案 Q6=D，即②④。②可由具身智能定义推出有些具有身体的人工智能能像人一样感知、学习；④“除非P，否则不能Q”等价于只有P才Q，锁定P是Q的必要条件。①把具有身体的人工智能都当成具身智能，③把不能称为具身智能误推为不能感知学习。","必要条件口令：只有P才Q、除非P否则不Q，都表示Q离不开P；但不Q不能推出不P，较大范围概念也不能直接等同较小范围概念。","石景山一模 Q6 选 D，即②④。能像人一样感知、学习是称为具身智能的必要条件；不能把“不能称为具身智能”反推成“不能感知学习”。","A-formal","source_locked_pending_external_review","gpt_sources/0d4a5cd29c2e6961_2026北京石景山高三一模政治_教师版.md:81-88,288-290; gpt_sources/78d97b669465d8a5_2026石景山一模细则.md:23-25"
"RF0064","Q0106","不完全归纳推理","茶道通过观茶芽卷舒、察茶汤黏稠、闻茶香持久等有限经验迹象，识别嫩度、发酵水平和烘焙工艺。","官方答案 Q7=C。由有限观察样本识别茶香持久与烘焙工艺之间的内在关联，属于不完全归纳推理；A误挂必要条件假言判断，B误挂求同法，D把见微知著泛化为辩证思维整体妙悟。","不完全归纳从部分经验材料推出一般性或内在关联，结论具有或然性；求同法要看多个场合共同因素，必要条件要有无P则无Q的条件结构。","石景山一模 Q7 选 C。通过观、察、闻等有限经验迹象识别茶的香气持久与烘焙工艺之间的内在关联，属于不完全归纳推理。","A-formal","source_locked_pending_external_review","gpt_sources/0d4a5cd29c2e6961_2026北京石景山高三一模政治_教师版.md:89-99,288-290; gpt_sources/78d97b669465d8a5_2026石景山一模细则.md:23-25"
"RF0065","Q0109","关系判断/非传递关系","甲是乙的同学，乙是丙的同学，并不必然推出甲是丙的同学。","教师版答案 Q13=A。同学关系在此不具有传递性；B把不完整的基本形式说成正确划分，C由特称否定判断作换位推理，D把文字表达的语言艺术定义说得过窄。","判断关系是否传递，要检查 aRb 且 bRc 时是否必然 aRc；特称否定判断不能换位。","丰台二模 Q13 选 A。同学关系不保证传递，甲是乙的同学、乙是丙的同学，不能必然推出甲是丙的同学。","A-support","source_locked_pending_external_review","gpt_sources/9f3b486088840b52_2025北京丰台高三二模政治_教师版.md:185-190,368-373"
"RF0066","Q0111","三段论构建","大项P=有利于培养时代新人；小项S=大思政课；中项M=能够帮助青年学子树立正确价值观的教育活动。所有M都是P；S是M；所以S是P。","阅卷评标细则要求标明大前提、小前提、结论，结构正确给4分；四概念、中项不周延、小项不当扩大、结论被修改、漏结论或写成充分条件/联言推理均会失分或零分。","三段论先定结论中的大项和小项，再找中项；中项表达要一致，至少周延一次，结论不能扩大前提中不周延的项；同时查前提真实性：材料须能支持“大思政课”确实属于“能够帮助青年学子树立正确价值观的教育活动”。","丰台二模 Q16(2) 可写：所有能够帮助青年学子树立正确价值观的教育活动都有利于培养时代新人；大思政课是能够帮助青年学子树立正确价值观的教育活动；所以大思政课有利于培养时代新人。","A-formal","source_locked_pending_external_review","gpt_sources/9f3b486088840b52_2025北京丰台高三二模政治_教师版.md:214-232,390-393; gpt_sources/e3e9942211ec52f9_16._2.md:20-78"
"RF0067","Q0112","充分条件假言判断真假辨析","原观点结构为：只要给 AI 装上版权雷达并提前扫描问题指令，就能防止点击盗版资源网站。即 P -> Q。","阅卷评标细则锁定该观点片面或错误：版权雷达只是防止点击盗版资源网站的重要条件，而非充分条件；前件不是后件的充分条件是必踩点。","看到只要P就Q，先问P是否足以保证Q；若P只是重要条件、必要配套之一或局部措施，就不能把它说成充分条件。","丰台二模 Q19(1) 可写：该观点是片面的。给 AI 装上版权雷达只是防止点击盗版资源网站的重要条件，而非充分条件，不能由有版权雷达就必然推出能防止点击盗版资源网站。","A-formal","source_locked_pending_external_review","gpt_sources/9f3b486088840b52_2025北京丰台高三二模政治_教师版.md:313-347,409-412; gpt_sources/0e0ec077bf920336_19._1.md:26-40,48-55"
"RF0068","Q0113","换位推理/三段论规则/概念外延关系","题干定义脑机接口使用方，并分为终端使用者和试验操作者；②从“有的终端使用者是受试者”换位为“有的受试者是终端使用者”；③要求判断“所有 M 都是 P；S 是 M；所以 S 是 P”是否犯中项不周延；④要求判断同一属概念下两类使用方的外延关系。","答案 Q8=C，即②④。②是特称肯定判断有效换位；④在“使用方”范围内，终端使用者与试验操作者被题干分为两个穷尽类，可判为矛盾关系。①把定义错误方向说反，③把有效三段论误判为中项不周延。","特称肯定判断可以简单换位；判断三段论中项周延要看中项在前提中是否至少周延一次；判断矛盾关系要限定同一属概念范围内互斥且穷尽。","丰台二模 Q8 选 C，即②④。“有的S是P”可换位为“有的P是S”；“所有M都是P，S是M，所以S是P”不犯中项不周延。","A-support","source_locked_pending_external_review","09_logs/2026_ermo_text_extract/2026丰台二模_试卷_2026北京丰台高三二模政治_教师版_.pdf.txt:101-118; 09_logs/render_check_fengtai_2026_ermo_q7_q8/fengtai2026_ermo_page_003.png; 09_logs/2026_ermo_text_extract/2026丰台二模_细则_高三政治答案.docx.txt:18-21"
"RF0069","Q0114","真假话约束推理","四人各喜欢三种茶中的两种且不喜欢一种；四人发言中只有一假，其余三真。需要从真假约束和每人偏好约束推出必然结论。","答案 Q9=D，即②④。满足“只有一人说假话”的情形都推出乙不喜欢茉莉花茶，所以乙喜欢珠兰花茶；同时都推出丁不喜欢白兰花茶。①甲不喜欢白兰和③丙不喜欢珠兰不是所有满足情形下都成立。","真假话题先列约束：每句话真假、总假话数、对象属性限制；“必然为真”必须在所有满足条件的情形下都真，不能只找一个可能情形。","丰台二模 Q9 选 D，即②④。由只有一人说假话和每人恰好不喜欢一种茶，可必然推出乙喜欢珠兰花茶、丁不喜欢白兰花茶。","A-support","source_locked_pending_external_review","09_logs/2026_ermo_text_extract/2026丰台二模_试卷_2026北京丰台高三二模政治_教师版_.pdf.txt:119-144; 09_logs/render_check_fengtai_2026_ermo_q7_q8/fengtai2026_ermo_page_003.png; 09_logs/2026_ermo_text_extract/2026丰台二模_细则_高三政治答案.docx.txt:18-21"
"RF0070","Q0116","矛盾关系/省略三段论前提","题目比较“春日意象”相关判断与推理。D 判断原命题与其否定论断的真假关系；C 判断“鸭子是水禽，所以春江水暖鸭先知”省略的是哪一个三段论前提。","答案 Q12=D。一个判断与其否定判断之间不能同真也不能同假；C 错在省略的是连接“水禽/鸭子”和“先知水暖”的大前提，不是小前提。","原判断和否定判断构成矛盾关系；省略三段论前提时，看明说的那句是大前提还是小前提，再判断缺哪一个。","东城二模 Q12 选 D。“人误地一时，地误人一年”的否定论断与原判断不能同真，也不能同假；“鸭子是水禽，所以鸭先知”省略的是大前提而非小前提。","A-support","source_locked_pending_external_review","09_logs/2026_ermo_text_extract/2026东城二模_试卷_2026北京东城高三二模政治_教师版_.docx.txt:71-76,155-158"
