"entry_id","question_id","reasoning_form","logical_structure","validity_or_fallacy","rule_kouling","answer_sentence","evidence_level","status","rubric_source"
"RF0001","Q0005","矛盾律","完整保留历史街巷的一砖一瓦；同时对无法适应现代需要部分进行必要拆除和改造","自相矛盾，不能同真","同一思维过程不能既肯定又否定同一对象同一方面","主张1不符合逻辑，完整保留与必要拆改不能同真，违反矛盾律。","A-formal","source_locked","gpt_sources/e4d67789c91d1b92_2026东城期末细则.md:280-307"
"RF0002","Q0005","充分条件假言推理","如果引入智能垃圾箱(P)，则垃圾分类效率提升(Q)；由Q推出P","肯后必肯前错误；也可判为混淆充分条件和必要条件","充分条件只允许肯前肯后、否后否前，不能肯后肯前","主张2不符合逻辑，由效率提升需要推出必须引入智能垃圾箱，是肯后必肯前的错误。","A-formal","source_locked","gpt_sources/e4d67789c91d1b92_2026东城期末细则.md:280-307"
"RF0003","Q0005","三段论","有些采用居民提案-AI模拟-多轮投票模式的方案是科学民主方案；立体花园+口袋公园方案采用该模式；所以它是科学民主方案","中项不周延","三段论中项至少周延一次","主张3不符合逻辑，中项在大小前提中都不周延，犯中项不周延错误。","A-formal","source_locked","gpt_sources/e4d67789c91d1b92_2026东城期末细则.md:280-307"
"RF0004","Q0006","充分条件假言推理","如果A区域古代没有广泛生长竹子(P)，就不可能有大量炭化竹节(Q)；已发现大量炭化竹节(非Q)；所以A区域古代广泛生长竹子(非P)","有效：否定后件式","充分条件可肯前肯后、否后否前","推理一属于充分条件假言推理，后件假则前件假，推理成立。","A-formal","source_locked","gpt_sources/d64506799887753e_2024朝阳一模细则.md:317-327"
"RF0005","Q0007","必要条件假言推理","只有A区域古代气候温暖(P)，A区域古代才有可能生长竹子(Q)；A区域古代广泛生长竹子(Q)；所以A区域古代气候温暖(P)","有效：肯定后件式","必要条件可否前否后、肯后肯前","推理二应补足气候温暖是竹子生长的必要条件，再由广泛生长竹子推出气候温暖。","A-formal","source_locked","gpt_sources/d64506799887753e_2024朝阳一模细则.md:328-335"
"RF0006","Q0008","充分条件假言推理","若发现岩松鼠活动痕迹(P)，则一定能找到红嘴蓝鹊(Q)；观察到红嘴蓝鹊(Q)","无效：肯定后件不能肯定前件","充分条件不能肯后肯前","看到红嘴蓝鹊只是后件为真，无法确定前件真假，不能断定一定有岩松鼠。","A-formal","source_locked","gpt_sources/cfb0f19ef38aafd7_2025西城二模细则.md:52-53"
"RF0007","Q0009","充分条件假言推理","如果阻碍加装电梯(P)，就会侵犯相关业主合法权益(Q)；范某阻碍(P)；所以侵权(Q)","有效：肯定前件式","充分条件肯前必肯后","推理①属于充分条件假言推理，肯定前件推出肯定后件，结构有效。","A-formal","source_locked","gpt_sources/44537714bd68a7c1_2026通州期末细则.md:147-161"
"RF0008","Q0009","必要条件假言推理","只有公示期间未收到异议(P)，加装电梯才符合要求(Q)；公示期内未收到异议(P)；所以符合要求(Q)","无效：肯定前件不能肯定后件","必要条件不能肯前肯后","推理②属于必要条件假言推理，但仅肯定前件就推出后件，结构错误。","A-formal","source_locked","gpt_sources/44537714bd68a7c1_2026通州期末细则.md:147-161"
"RF0009","Q0010","必要条件假言推理","甲的推理肯定后件并肯定前件","有效：肯定后件式","必要条件肯后必肯前","甲的推理属于必要条件假言推理，前提真实且符合肯定后件式，推理正确。","A-formal","source_locked","gpt_sources/26649804f1de31f5_2026丰台一模细则.md:116-132"
"RF0010","Q0010","三段论","乙的推理中大项“带动居民消费”在前提中不周延、在结论中周延","大项不当扩大","前提中不周延的项在结论中不得周延","乙的推理属于三段论，犯大项不当扩大的逻辑错误。","A-formal","source_locked","gpt_sources/26649804f1de31f5_2026丰台一模细则.md:116-132"
"RF0011","Q0012","三段论谬误名称纠偏","A项推理实际是大项“青年”在前提中不周延、结论中周延","大项不当扩大，不是小项不当扩大","判断三段论谬误名称时先确定大项/小项/中项，再看周延变化","顺义一模 Q7 正确选 A，因为其分析把大项不当扩大误说成小项不当扩大。","A-formal","source_locked","gpt_sources/9dd43cae443f853c_2025北京顺义高三一模政治_教师版.md:88-115; explanation:371-380"
"RF0012","Q0013","演绎推理/三段论","未来产业具有P特征；量子科技具有P特征；所以量子科技是未来产业","前提不真导致演绎保真失败；三段论结构本身正确","演绎推理保真要同时满足前提真实和结构正确","顺义 Q19(1) 推理错误，因为材料不能推出所有具有P特征的产业都是未来产业。","A-formal","source_locked","gpt_sources/de758e5e79500dd0_2026顺义一模细则.md:136-142"
"RF0013","Q0015","三段论补大前提","小前提：乌毛蕨形成的镧独居石是纯净无辐射的独居石；结论：乌毛蕨形成的镧独居石具有绿色提取前景","应选能让中项周延且不犯四概念的大前提","大前提只含中项和大项；中项至少周延一次；三段论只能有三个项","东城期末 Q6 选 B：纯净无辐射的独居石具有绿色提取前景。","A-formal","source_locked","gpt_sources/e4d67789c91d1b92_2026东城期末细则.md:553-570; analysis:595-596"
"RF0014","Q0016","矛盾关系/真假判断","吴老师与王老师发言形成矛盾关系；四人仅一真","由矛盾关系必有一真一假，推出周老师和郑老师均假","矛盾命题必有一真一假；再用唯一真约束排除其他发言","东城期末 Q7 选 A，因为真实结果要求人机赛跑不达标且AI主题闯关达标。","A-formal","source_locked","gpt_sources/e4d67789c91d1b92_2026东城期末细则.md:48-52"
"RF0015","Q0018","不完全归纳推理","从若干 AI 任务指令或样本特征归纳出设计任务所用推理类型","正式细则锁定不完全归纳推理；写归纳推理只部分给分","部分对象推出一般性结论属于不完全归纳，是或然推理","朝阳一模 Q17(1) 前半应识别为不完全归纳推理。","A-formal","source_locked","gpt_sources/3a11db4bade216d1_2026朝阳一模细则.md:40-43"
"RF0016","Q0020","充分条件假言推理","如果P则Q；已知Q；所以P","无效：肯定后件不能肯定前件","充分条件有效式只有肯前肯后、否后否前；肯后肯前是错误结构","海淀期末 Q20(1) 的推理是充分条件假言推理，但犯肯定后件推出前件的错误。","A-formal","source_locked","gpt_sources/7832041a93d37e1f_2026海淀期末细则.md:33"
"RF0017","Q0022","概念划分规则","Q17问题1身份单选把年龄(老年人/儿童)、身体状况(残障人士)、就业状态(普通在职职工/离退休人员)、行业角色(相关行业从业者)混列同一层级","划分标准不一","一次划分只能使用同一标准，不能在同层级混入不同依据","海淀一模 Q17(1) 的第一个逻辑错误是划分标准不一：身份单选题把年龄、身体状况、就业状态和行业角色混在同一层级。","A-formal","source_locked_questionnaire_detail_pending_external_review","rendered page 03e0412bb80579d8/page_005.png; gpt_sources/9b5ac8fd0cfe59cb_2026海淀一模细则.md:35-36"
"RF0018","Q0022","选言判断","Q17问题2设施主要问题多选只列设计不合理、标识不清、相关部门维护不到位，未设其他/补充说明，未覆盖其他有选择价值的情况","选言判断遗漏","选言支要覆盖题目要求下有选择价值的情况，不能遗漏关键可能性","海淀一模 Q17(1) 的第二个逻辑错误是选言判断遗漏：设施问题选项只列设计、标识、维护三类原因，未覆盖其他有选择价值的情况。","A-formal","source_locked_questionnaire_detail_pending_external_review","rendered page 03e0412bb80579d8/page_005.png; gpt_sources/9b5ac8fd0cfe59cb_2026海淀一模细则.md:35-36"
"RF0019","Q0024","形式逻辑综合选择题","A越级划分；B两个全称判断可同假；C矛盾律冲突；D四概念","正确选B，其他选项分别违反划分、矛盾律、三段论三概念规则","先判断每个选项对应的逻辑规则，再看是否真实违反该规则","朝阳一模 Q6 选 B，因为不赞成两个反对命题并不违反逻辑规则。","A-formal","source_locked","gpt_sources/d64506799887753e_2024朝阳一模细则.md:42-47"
"RF0020","Q0025","不完全归纳推理","楚王由一个齐国盗贼推出齐人固善盗","轻率概括/以偏概全，属于或然推理","不完全归纳只涉及部分对象，不能保真；提高可靠性要扩大对象并分析因果联系","楚王推理犯轻率概括，可通过考察更多对象和因果关系提高可靠性。","A-formal","source_locked","gpt_sources/92a268ce852f6944_2024.11期中政治朝阳评标2.md:264-301"
"RF0021","Q0025","类比推理","晏子由橘在不同环境中性质变化，类比推出楚之水土使民善盗","或然推理，但论证有说服力","类比是由两个或两类对象在若干属性相似推出其他属性相似","晏子推理属于类比推理，虽然或然，但能反驳楚王并增强论证说服力。","A-formal","source_locked","gpt_sources/92a268ce852f6944_2024.11期中政治朝阳评标2.md:264-301"
"RF0022","Q0026","三段论/四概念","甲把个人补偿诉求与公共利益处理为非此即彼，且小前提窄化公共利益外延","错误：细则并列列出四概念错误、前提不真、材料分析三条可用理由","三段论只能有三个项，且前提必须真实可靠；本题细则未设主次链","西城一模 Q19(3) 甲观点错误，最稳写法是合写前提不真与公共利益外延被窄化造成四概念错误。","A-formal","source_locked","gpt_sources/22206a780a1503a6_2026西城一模细则.md:73-77"
"RF0023","Q0026","反对关系/联言判断","乙认为既不能所有村务必须公开，也不能所有村务都不必公开","正确：两个全称判断为反对关系，可同假不可同真","反对关系不能同真但可以同假；联言判断同真才真","西城一模 Q19(3) 乙观点正确，因为两个极端全称命题是反对关系。","A-formal","source_locked","gpt_sources/22206a780a1503a6_2026西城一模细则.md:73-77"
"RF0024","Q0026","同一律/偷换概念","丙在充分条件假言推理中把后件的村民会议换成结论中的村委会","错误：偷换概念，违背同一律","同一思维过程必须在同一意义上使用同一概念","西城一模 Q19(3) 丙观点错误，因为把村民会议偷换为村委会。","A-formal","source_locked","gpt_sources/22206a780a1503a6_2026西城一模细则.md:73-77"
"RF0025","Q0027","不相容选言推理（有效式）","p xor q; not p; therefore q","有效：否定一个选言支，可以肯定另一个选言支","不相容选言否定肯定式：要么p要么q；非p；所以q","海淀一模 Q21(1) 可以写：外贸进出口要么影响国内大循环，要么是拉动经济增长的重要引擎；外贸进出口不影响国内大循环；所以外贸进出口是拉动经济增长的重要引擎。","A-formal","source_locked","gpt_sources/7ebce670784d805e_2025北京海淀高三一模政治_教师版.md:255-266; gpt_sources/506347bd4a7061dd_2025海淀一模细则.md:56-64"
"RF0026","Q0028","不相容选言推理（无效式陷阱）","p xor q is true; therefore p","无效：只知道不相容选言判断为真，不能直接指定哪一个选言支为真","不相容选言真，只能推出p且非q或非p且q两种可能之一，不能直接肯定p","丰台期末 Q9 B 不能选：由“小张或者去甘肃游学，或者去湖南游学”为真，不能直接推出“小张去甘肃游学”为真。","B-choice-signal","source_locked","gpt_sources/89765092a6f26242_2025北京丰台高三_上_期末政治_教师版.md:120-130,386-392"
"RF0027","Q0029","三段论/小项不当扩大","自媒体是思想政治教育的工具；自媒体也是娱乐的工具；所以娱乐工具都是思想政治教育的工具。小项“娱乐工具”在前提中不周延，在结论中周延。","无效：小项不当扩大","前提中不周延的项，在结论中不得周延；否则犯大项或小项不当扩大。","朝阳二模 Q7 A 项不合逻辑，因为小项“娱乐工具”在前提中不周延，却在结论中被周延，犯小项不当扩大；本题正确选 D。","A-formal","source_locked_pending_external_review","gpt_sources/9223488a4b5e6f80_003202405朝阳高三二模政治试题.md:96-114; gpt_sources/f7c4cc4ac52ecefd_004202405朝阳高三政治质量检测二参考答案_以PDF为准.md:24-44"
"RF0028","Q0031","概念外延关系","“上世纪20年代末北京城南风土人情”是《城南旧事》呈现的具体内容，落在北京题材的具体表现范围中；选项D却说二者外延交叉。","错误：把从属/包含式题材关系误判为交叉关系","先定概念范围，再判全同、属种、交叉或全异；具体内容与上位题材不能直接判交叉","顺义一模 Q2 D 项不能选：具体风土人情属于北京题材的具体内容或下位表现，不是与北京题材部分重合的交叉关系。","B-choice-signal","source_locked_pending_external_review","gpt_sources/8d19592ca0679f21_2026顺义一模.md:37-43; gpt_sources/de758e5e79500dd0_2026顺义一模细则.md:20-30"
"RF0029","Q0033","类比推理","《论持久战》解决抗战中长期问题的思想经验，对当前科技创新、乡村振兴等中长期问题提供思想启迪。","正确：以中长期复杂问题之间的相似性作或然迁移；不是定义，也不是完全归纳","类比推理看对象之间是否存在可迁移的相似属性，结论是或然的启发，不是必然保真","顺义一模 Q4 A 项可选：重温《论持久战》用一个历史复杂问题的思维经验启发当前中长期问题，属于类比推理。","B-choice-signal","source_locked_pending_external_review","gpt_sources/8d19592ca0679f21_2026顺义一模.md:55-63; gpt_sources/de758e5e79500dd0_2026顺义一模细则.md:20-30"
"RF0030","Q0038","关系判断/非传递关系","1班赢2班；2班赢3班；不能推出1班与3班之间同向胜负结果","正确：比赛胜负关系不具有传递性","判断关系是否传递，要看aRb且bRc时是否必然aRc；比赛胜负不保证传递","朝阳一模 Q5 D 项可选：1班赢2班、2班赢3班，并不能保证1班赢3班，所以胜负关系属于非传递关系。","B-choice-signal","source_locked_pending_external_review","gpt_sources/585b15124610aff7_2026北京朝阳高三一模政治_教师版.md:67-72,320-325"
"RF0031","Q0042","三段论构造","大项=保护和传承人类文明的重要殿堂；小项=博物馆；中项=具有教育功能的场所。M are P; S are M; therefore S are P。","有效：前提真实且符合三段论基本规则","先定大项和小项，再找中项；中项至少周延一次，结论不得扩大前提中不周延的项","房山一模 Q16(2) 可写：具有教育功能的场所是保护和传承人类文明的重要殿堂；博物馆是具有教育功能的场所；所以博物馆是保护和传承人类文明的重要殿堂。","A-formal","source_locked_pending_external_review","gpt_sources/3227fd51f2020c04_2025北京房山高三一模政治_教师版.md:156-176; gpt_sources/17cdecfbd774ee79_2025房山一模细则.md:46-54"
"RF0032","Q0047","归纳推理可靠程度","通过文献查阅、问卷调研、访谈、实验数据等多种方法收集材料，运用定性分析和定量分析寻找因果联系。","有效增强：扩大样本和证据面，用多方法互证提高归纳结论可靠程度","归纳推理不是只看一个例子；样本越广、方法越多、因果分析越充分，结论越可靠","石景山一模 Q19 可写：获奖建议综合文献、问卷、访谈和实验数据，用定性与定量分析寻找因果联系，从而提高归纳推理的可靠程度。","A-formal","source_locked_pending_external_review","gpt_sources/fb8717be46dabe77_2025北京石景山高三一模政治_教师版.md:271-282,384-387; gpt_sources/0b97375f2f69e53d_2025石景山一模细则.md:86-100"
"RF0033","Q0049","排中律/两不可错误","甲同时否定“使用融雪剂”和“禁止使用融雪剂”这两个相互矛盾判断。","错误：A与非A不能同假，两个互相矛盾判断必有一真；同时否定犯两不可错误","排中律管不能都否定：A和非A不能同假，至少有一真","朝阳期末 Q19 甲可写：使用融雪剂和禁止使用融雪剂是相互矛盾判断，甲同时否定二者，犯两不可错误，违反排中律。","A-formal","source_locked_pending_external_review","gpt_sources/ec82917288aa8774_2025北京朝阳高三_上_期末政治_教师版.md:221-227,326-336; gpt_sources/195324f05d7e2fea_朝阳高三期末2025.md:215-240; gpt_sources/953eaee3f98d8598_2025朝阳期末细则.md:1-16; renders/953eaee3f98d8598/page_003.png,page_004.png"
"RF0034","Q0049","矛盾律/自相矛盾错误","乙同时肯定“快速完成扫雪”和“慢慢清扫积雪”这两个相互矛盾要求。","错误：A与非A不能同真，两个互相矛盾判断必有一假；同时肯定犯自相矛盾错误","矛盾律管不能都肯定：A和非A不能同真，至少有一假","朝阳期末 Q19 乙可写：快速完成扫雪和慢慢清扫积雪在本题中是相互矛盾要求，乙同时肯定二者，犯自相矛盾错误，违反矛盾律。","A-formal","source_locked_pending_external_review","gpt_sources/ec82917288aa8774_2025北京朝阳高三_上_期末政治_教师版.md:221-227,326-336; gpt_sources/195324f05d7e2fea_朝阳高三期末2025.md:215-240; gpt_sources/953eaee3f98d8598_2025朝阳期末细则.md:1-16; renders/953eaee3f98d8598/page_003.png,page_004.png"
"RF0035","Q0049","三段论有效结构","所有为维护小区美好环境付出辛勤劳动的行为都是值得赞扬的；居民在小区扫雪是为维护小区美好环境付出辛勤劳动的行为；所以居民在小区扫雪是值得赞扬的。","有效：前提真实，且符合三段论推理规则，结构为M are P; S are M; therefore S are P","三段论先找大项、小项、中项；前提真实且结构合规，结论才符合逻辑","朝阳期末 Q19 丙可写：丙的推理是三段论，前提真实，结构符合三段论推理规则，因此结论符合逻辑。","A-formal","source_locked_pending_external_review","gpt_sources/ec82917288aa8774_2025北京朝阳高三_上_期末政治_教师版.md:221-227,326-336; gpt_sources/195324f05d7e2fea_朝阳高三期末2025.md:215-240; gpt_sources/953eaee3f98d8598_2025朝阳期末细则.md:1-16; renders/953eaee3f98d8598/page_003.png,page_004.png"
"RF0036","Q0052","必要条件假言推理无效式","P=实现虚拟与现实深度融合；Q=人工智能拥有智能硬件载体。原判断为P->Q，或“只有Q才P”；推理把Q当作可推出P的充分条件。","错误：必要条件不能当充分条件；必要条件假言推理中，肯定前件不能肯定后件；充分条件形式中，肯定后件不能肯定前件。","必要条件只挡掉没有它的情况：没有Q就没有P；有Q不等于一定有P。","朝阳一模 Q17(1) 可写：该推理不正确。智能硬件载体是实现深度融合的必要条件而非充分条件；肯定必要条件前件不能推出后件，所以仅有智能载体不能推出一定实现虚拟与现实深度融合。","A-formal","source_locked_pending_external_review","gpt_sources/e051761a7fc68fef_2025北京朝阳高三一模政治_教师版.md:190-198,309-315; gpt_sources/f5f683a900508fd2_2025朝阳一模细则.md:1-16; renders/f5f683a900508fd2/page_001.png; gpt_sources/f0b3ab889aa0b17b_20250329高3阅卷总结17_1题_具身智能_任会波组_阐释论证.md:25-57,80-97"
"RF0037","Q0053","不完全归纳推理可靠程度","研究小组只考察部分客运量位居前列线路，发现这些线路沿线景点多，就推出沿线景点数量是影响北京地铁客运量的决定性因素。","或然：从部分对象推出一般结论，前提与结论之间不是必然联系；需要扩大样本并探究因果关系提高可靠性。","不完全归纳先看样本够不够，再看因果够不够；样本越广、因果越清楚，结论越可靠。","朝阳二模 Q17 可写：该组同学运用不完全归纳推理。要更好发挥该推理功能，应考察更多线路，探究客运量与景点数量、人口密度等因素的因果联系，提高前提与结论的相关程度，增强推理可靠性。","A-formal","source_locked_pending_external_review","gpt_sources/6009b3f19a33a729_2025北京朝阳高三二模政治_教师版.md:192-200,304-308; gpt_sources/73c36c3077dced72_2025朝阳二模细则.md:71-79,86-107"
"RF0038","Q0060","充分条件假言判断构造","如果/只要P，就能Q；P=能够在商品外包装上印上垃圾分类标识，Q=方便人们正确进行垃圾分类。","正确：补全前件后形成符合上下文的充分条件真判断。","看横线前后哪一端是条件、哪一端是结果；如果/只要引出充分条件，不能把“提高标识率”这种含混目标当作满分判断。","丰台一模 Q19(1) 可写：如果/只要能够在商品外包装上印上垃圾分类标识，就能方便人们正确进行垃圾分类；这是符合上下文的充分条件假言判断。","A-formal","source_locked_pending_external_review","gpt_sources/5f5486bfc3baab2b_2024北京丰台高三一模政治试题及答案.md:235-252,332-337; gpt_sources/950d6b2d3cdda441_2024丰台一模细则.md:98-123"
"RF0039","Q0061","三段论构造","M=搭建对外交流合作平台；P=推动冰雪经济高质量发展；S=第七届雪博会。大前提 M->P，小前提 S->M，结论 S->P。","有效：三段论形式合规且内容真实；大小前提倒置会降分。","结论给出小项和大项时，先找中项；大前提写中项到大项，小前提写小项到中项。","丰台二模 Q18(1) 可写：搭建对外交流合作平台推动了冰雪经济高质量发展；第七届雪博会是对外交流合作平台；所以第七届雪博会可以推动冰雪经济高质量发展。","A-formal","source_locked_pending_external_review","paper rendered page preprocessed_corpus/renders/57ddd500c48eeec9/page_006.png; gpt_sources/71fcaa9e66afc5db_2024丰台二模细则.md:40-50"
"RF0040","Q0062","必要条件误当充分条件/只要句式评析","观点把“准确预测冰雪经济发展前景”说成推动高质量发展的充分条件；正式细则要求判断其是必要条件但不是唯一条件。","片面：必要条件不是充分条件；有准确预测不等于一定能推动高质量发展。","必要条件只说明缺了不行，不说明有了就够；推动发展还需要辩证分析优势短板、遵循规律、从实际出发。","丰台二模 Q18(2) 可写：准确预测冰雪经济发展前景是推动高质量发展的必要条件，但不是唯一条件，不能推出只要预测准确就必然推动高质量发展。","A-formal","source_locked_pending_external_review","paper rendered page preprocessed_corpus/renders/57ddd500c48eeec9/page_006.png; gpt_sources/71fcaa9e66afc5db_2024丰台二模细则.md:53-64"
"RF0041","Q0063","科学归纳推理/不完全归纳推理","由352种不同品系高粱的AT1基因与耐盐碱表现，推出缺失AT1基因的高粱更耐碱的一般性结论；再用AT1增加/剪切与耐盐碱能力变化探求因果联系。","或然但可靠性增强：样本广，并用共变法、求异法等探求因果联系。","看到多种样本到一般结论，先判不完全归纳；看到一个因素变化伴随结果变化，判共变法；看到有无某因素导致结果差异，判求异法。","西城二模 Q18(1) 可写：研究人员运用不完全归纳推理，考察352种不同品系高粱，推出缺失AT1基因的高粱更耐碱；并通过AT1基因增加时耐碱能力减弱、剪切后耐碱能力增强，运用共变法和求异法探求因果联系。","A-formal","source_locked_pending_external_review","gpt_sources/0dbd7271f7bf108d_高三模拟测试思想政治试卷.md:162-172; gpt_sources/85ebe0578ce81b18_高三模拟测试思想政治答案.md:43-47; gpt_sources/f2e1772f20ed2085_2024西城二模细则.md:62-75"
"RF0042","Q0064","不完全归纳推理可靠程度","由部分外国朋友遇到移动支付“不能用”“不好用”等问题，推出支付不便利会导致“不想用”的一般结论。","或然推理：从部分对象推出一般结论，结论可靠程度可通过扩大认识对象、增加样本和归纳角度，并探求因果联系来提高。","不完全归纳不保真；样本越多、角度越全、因果越清楚，结论越可靠。","海淀一模 Q18(2) 可写：材料中由部分外国朋友在支付中遇到“不能用”“不好用”等问题，推出支付不便利会导致“不想用”，运用了不完全归纳推理；要提高可靠性，应考察更多认识对象，扩大研究范围、增加样本数量和归纳角度，并分析支付不便利与“不想用”之间的因果关系，可运用求同法、求异法、共变法等方法。","A-formal","source_locked_pending_external_review","gpt_sources/4bc0edec2a08a90e_高三政治_一模试题.md:278-296; gpt_sources/98d1d762f302004f_一模政治-答案.md:45-48; gpt_sources/b692254ceb1b8174_2024海淀一模细则.md:69-86"
