batch_id,question_id,status,question_source,rubric_source,evidence_level,boundary_note,next_gate
BATCH_008,2025朝阳期末Q21,source_locked,"C:\Users\Administrator\Desktop\beijing_politics_research\data\preprocessed_corpus\texts\195324f05d7e2fea_朝阳高三期末2025.txt:284-285","C:\Users\Administrator\Desktop\beijing_politics_research\data\preprocessed_corpus\texts\195324f05d7e2fea_朝阳高三期末2025.txt:286-299",scoring_ppt_with_score_caps,"中国特色大国外交为中国式现代化营造外部环境。该缓存来自朝阳期末PPT，含分值、最高分限制和四个环境角度；按阅卷/讲评PPT处理，不得把结构性要求当作术语。高水平对外开放、服务新发展格局只作边界提示，不进入选必一主链。",codex_and_claudecode_draft
BATCH_008,2026丰台一模Q19,source_locked,"C:\Users\Administrator\Desktop\beijing_politics_research\data\preprocessed_corpus\renders\6e8f2df5ef86ff9e\page_008.png","C:\Users\Administrator\Desktop\beijing_politics_research\data\preprocessed_corpus\texts\26649804f1de31f5_2026丰台一模细则.txt:143-150",formal_rubric_plus_rendered_exam_page,"原卷缓存为已渲染未OCR，已人工核看page_008：题面围绕联合国2030年可持续发展议程、消除贫困、教育普及、卫生健康三组材料。细则PPT给出三段正式答案链。不得使用新发展理念、新发展格局等模块错词。",codex_and_claudecode_draft
BATCH_008,2025门头沟一模Q19,source_locked,"C:\Users\Administrator\Desktop\beijing_politics_research\data\preprocessed_corpus\texts\1d8a23fe11f59810_2025北京门头沟高三一模政治_教师版.txt:230-258","C:\Users\Administrator\Desktop\beijing_politics_research\data\preprocessed_corpus\texts\26d9b228064053c1_2025门头沟一模细则.txt:26-38",formal_rubric,"中国做赋能型大国的世界意义。细则每条2分并要求材料深度关联；充分利用两个市场两种资源不给分，只答对中国意义不给分，国家关系民主化、世界多极化、多边主义不给分。",codex_and_claudecode_draft
BATCH_008,2026石景山一模Q20,source_locked,"C:\Users\Administrator\Desktop\beijing_politics_research\data\preprocessed_corpus\texts\0d4a5cd29c2e6961_2026北京石景山高三一模政治_教师版.txt:238-253","C:\Users\Administrator\Desktop\beijing_politics_research\data\preprocessed_corpus\texts\78d97b669465d8a5_2026石景山一模细则.txt:49-69",formal_level_based_rubric_with_examples,"中国倡议如何助推亚太合作，任选共同、开放、包容两个关键词。细则为等级化说明和示例，不得伪造成固定逐点分值；可沉淀共商共建共享、共同利益、开放型区域经济环境、贸易投资自由化便利化、普惠包容经济全球化等。",codex_and_claudecode_draft
BATCH_008,2026顺义一模Q20,source_locked,"C:\Users\Administrator\Desktop\beijing_politics_research\data\preprocessed_corpus\texts\8d19592ca0679f21_2026顺义一模.txt:312-332","C:\Users\Administrator\Desktop\beijing_politics_research\data\preprocessed_corpus\texts\de758e5e79500dd0_2026顺义一模细则.txt:137-159",formal_rubric,"科技小院成为南南合作典范的深层逻辑。共同利益为必答1分；国际政治、国际经济各3分。农业技术、生产率、成本、人才、内生动力、可持续发展主要作材料事实和效果链，不应单独冒充选必一术语。",codex_and_claudecode_draft
