suite,covered_priority,district_priority,source_id,year_hint,district_hint,stage_hint,evidence_guess,extract_status,text_chars,hit_count,hit_terms,question_anchors,relative_path,cache_path
2026海淀期末,no,1,SRC_93d2077755f7,2026,海淀,期中/期末,P0_candidate_scoring,ok,1678,0,,5答案BCCBD⼆、⾮选择题（共55分）16.（8分）可从⽭盾的观点、意识的能动作⽤、实践的观点等⻆度作答。分值标准细则5-6（1+1）×3观点清晰⽭盾观（⼀分为⼆/两重统⼀）“重点论”出不来只能1分知（意 || -分-分，如果能看出各段之间有衔接最优 17.可从联系的观点、价值观、弘扬⺠族精神、发展中国特⾊社会主义⽂化等⻆度作答。 [[PAGE 2]] 2 18.（1）该合同条款⽆效。该合同条款是住房租赁企业为了重 || 等⻆度作答。 [[PAGE 2]] 2 18.（1）该合同条款⽆效。该合同条款是住房租赁企业为了重复使⽤⽽预先拟定，并在订⽴合同时未与对⽅协商的条款，属于格式条款。⺠法典规定采⽤格式条款订⽴合同的，提供格式 || 动良法善治。 [[PAGE 3]] 3 19.根据反不正当竞争法规定，不正当竞争⾏为是指经营者在⽣产经营活动中，扰乱市场竞争秩序，损害其他经营者或者消费者的合法权益的⾏为。郑某利⽤技术⼿段，为⽤户提供不正当 || [[PAGE 4]] 4 评分标准： 20.（1）充分条件假⾔推理，错误，这个充分条件假⾔推理的⼀个前提肯定了假⾔判断的后件，结论肯定了假⾔判断的前件，这是错误的推理结构。(4分)【细则】分三步采分第⼀步 || 辑错误⽆关） [[PAGE 5]] 5 20.（2）符合超前思维的⽅法，能够扣住城市书房建设与运营的问题提出建议，措施具体。(6分)示例：运⽤调查研究的⽅法，对当地居⺠的需求进⾏⼴泛深⼊的调查，了解居⺠在阅 || 瞻性规划。 [[PAGE 6]] 6 21.可从党的领导、以⼈⺠为中⼼、⽭盾的观点、制度优势等⻆度作答,2026各区期末和期中/2026海淀期末/细则/细则.pdf,02_extraction/full_source_text_cache_20260503/SRC_93d2077755f7_细则_pdf.txt
2026海淀期末,no,1,SRC_51b7508a0497,2026,海淀,期中/期末,P3_candidate_paper,ok,1812,0,,部分 本部分共 6 题，共 55 分。 16. (8 分) 可从矛盾的观点、意识的能动作用、实践的观点等角度作答。 17. (8 分) 可从联系的观点、价值观、弘扬民族精神、发展中国特色社会主义文化等角度作答 || 意识的能动作用、实践的观点等角度作答。 17. (8 分) 可从联系的观点、价值观、弘扬民族精神、发展中国特色社会主义文化等角度作答。 等级水平 等级描述 水平 4 观点鲜明，能明确表达自己的见解；紧扣问题， || 政治参考答案 第 2 页（共 2 页） 18.(12 分) (1) 该合同条款无效。该合同条款是住房租赁企业为了重复使用而预先拟定，并在订立合同时 未与对方协商的条款，属于格式条款。民法典规定，采用格式条款 || 推进严格执法，推动良法善治。(6 分) 19.(7 分) 根据反不正当竞争法规定，不正当竞争行为是指经营者在生产经营活动中，扰乱市场竞争秩序， 损害其他经营者或者消费者的合法权益的行为。郑某利用技术手段，为 || 会整体福祉的增进，扰乱了市场竞争秩序。 20.(10 分) (1)充分条件假言推理，错误，这个充分条件假言推理的一个前提肯定了假言判断的后件，结论 肯定了假言判断的前件，这是错误的推理结构。(4 分) (2 || 未来一段时间运营功能等进行前瞻性规划。 21.(10 分) 可从党的领导、以人民为中心、矛盾的观点、制度优势等角度作答。 等级水平 等级描述 水平 4 观点鲜明，能明确表达自己的见解；紧扣问题，综合运用所学,2026各区期末和期中/2026海淀期末/试卷/试卷.pdf,02_extraction/full_source_text_cache_20260503/SRC_51b7508a0497_试卷_pdf.txt
2025海淀二模,yes,1,SRC_06bdaf7a81b0,2025,海淀,二模,P2_candidate_teaching_or_lecture,ok,12398,50,和平与发展;世界多极化;经济全球化;全球治理;联合国;国际组织;新型国际关系;人类命运共同体;中国智慧;中国方案;正确义利观;多边主义;对外开放;联合国宪章,"的重大方针政策。 【2025年延庆一模】17.（8分） 法治是最好的营商环境。 ➢ 改革开放以来，特别是党的十八大以来，党中央、国务院高度重视民营经济发展 ，出台了一系列促进 民间投资和民营经济发展的政策措 || 展环境（2分） [[PAGE 25]] 18题 [[PAGE 26]] 出题意图 • 知识模块：知识产权法、程序法、法治等 • 能力模块：运用法律相关知识解决真实问题的能力 • 考察意图：本题通过“恶意抢注 || 1]] 反馈试题 【2024海淀一模】 17． 高质量发展是新时代的硬道理。 材料一 哈尔滨的雪花、上海的“繁花”……借助现代交通工具，南北互换式旅游成为触手可及的浪漫，也带 动了国内南北多省份“隐藏款土特产 || 22海淀期末】 [[PAGE 43]] 20.(6分）共享是中国特色社会主义的本质要求。 共享发展理念是对中华优秀传统文化""不患寡而患不均""""损有余而补不足""等思想的继承 与发展， 也是对新时代中国特色社",2025各区二模/2025海淀二模/其他材料/2025届二模考试讲评0510.pdf,02_extraction/full_source_text_cache_20260503/SRC_06bdaf7a81b0_2025届二模考试讲评0510_pdf.txt
2025海淀二模,yes,1,SRC_05a280b2e00d,2025,海淀,二模,P0_candidate_scoring,ok,2661,24,和平与发展;世界多极化;经济全球化;全球治理;联合国;国际组织;新型国际关系;人类命运共同体;中国智慧;中国方案;正确义利观;多边主义;对外开放;联合国宪章,16题 17题 18题 1.回避 1分 2.被告...包装 1分 3.未经许可使用商标权/侵犯商标权((要和2对应)1分 4.……的材料/或书证、物证、证词类的例子 || 16题 17题 18题 1.回避 1分 2.被告...包装 1分 3.未经许可使用商标权/侵犯商标权((要和2对应)1分 4.……的材料/或书证、物证、证词类的例子 1分(要 || 16题 17题 18题 1.回避 1分 2.被告...包装 1分 3.未经许可使用商标权/侵犯商标权((要和2对应)1分 4.……的材料/或书证、物证、证词类的例子 1分(要合理) || 三个层次4分，两个层次3分一个层次2分 19题 1、数字化/互联网/模式 1分 节约成本/便利交易/提高华农收入 1分 2、完善基础设施 /物流体系 1分 -扩大国际市场/推进高水平对外开放/落实开放发展理 || 消费新场景/扩大内需/带动国内消费1分 20题 21题 中国需要联合国 1、联合国本身的地位和作用(2分，写出任意两条给2分)· ——联合国是当今世界最具普遍性、代表性和权威性的政府间国际组织 ——集体安全 || 景/扩大内需/带动国内消费1分 20题 21题 中国需要联合国 1、联合国本身的地位和作用(2分，写出任意两条给2分)· ——联合国是当今世界最具普遍性、代表性和权威性的政府间国际组织 ——集体安全机制的核 || 价值/正确义利观/构建人类命运共同体。 22题 题目(1分):以“青年的作为”为题，或者自拟题目均可未来规划(1分):具体、真实的职业或专业。综合运用(1分):答案涉及到2个及以上模块。 结合规划从国家角度,2025各区二模/2025海淀二模/细则/细则.docx,02_extraction/full_source_text_cache_20260503/SRC_05a280b2e00d_细则_docx.txt
2025海淀期中,yes,1,SRC_e3da1b6b45ca,2025,海淀,期中/期末,P3_candidate_paper,ok,9886,19,和平与发展;时代主题;政治多极化;经济全球化;联合国;国际秩序;多边主义;两个市场;两种资源;综合国力;外交政策;独立自主;和平共处五项原则;普惠;平衡,本部分共 6 题，共 55 分。 16. 材料一 按照工艺标准、口感风味与保存方式的不同，咖啡主要分为现磨咖啡、速溶咖啡等种类。 速溶咖啡由烘焙后的咖啡豆制成，易于保存，即冲即饮。速溶咖啡存储和运输 || 度，为中国咖啡企业“出海”提出建议。 17. 7 月 30 日，中共中央政治局召开会议，指出要有力有效支持发展瞪羚企业。 在我国，对瞪羚企业的政策支持始于北京中关村科技园区。近期，某市推出了一系列政策： || 说明上述政策将如何促进瞪羚企业发展。 18. 东城区前门街道草厂地区有一个远近闻名的“小院议事厅”。 “小院议事厅”在社区党委的领导下，组织居民会议、召开恳谈会、举办议事会，探索出协商共治的 “五民工作法 || 民工作法”对我国发展基层民主的启示。 19. 某中学党支部组织党员教师共同学习修订后的《中国共产党纪律处分条例》 。下面是部分学习内容。 [修改解读] 第三十条是在原有条款上修订而来的，这一条款的修订主 || 法治》知识，分析上述条款修订的原因。 20. 党的二十届三中全会提出要统筹建立粮食产销区省际横向利益补偿机制。 目前我国有 13 个粮食主产区、7 个主销区和 11 个产销平衡区。粮食主产区贡献了全国 7 || 食产销区省际横向利益补偿机制的意义。 21. 75 年，大国自信而坚定的脚步。 1950 年 5 月 1 日， 《中华人民共和国婚姻法》开始施行。这是新中国成立后颁布的第一部具有基本法 律性质的法律，彻底 || 本部分共 6 题，共 55 分。 16．（11 分） （1）可从生产技术、产品质量、消费方式、市场需求等角度回答。 等级水平 等级描述 水平 4 观点鲜明，能明确表达自己的见解；紧扣问题，综合 || ，为企业“出海”营造良好的国际环境。 17．（6 分） 财政补贴、税收优惠等政策有助于降低瞪羚企业经营成本，增强企业的创新活力和投资积极性。融资 支持政策有助于降低瞪羚企业融资成本，帮助企业解决资金问题,2025各区期末/2025海淀期中/试卷/试卷.pdf,02_extraction/full_source_text_cache_20260503/SRC_e3da1b6b45ca_试卷_pdf.txt
2025海淀期中,yes,1,SRC_cda046c2d36d,2025,海淀,期中/期末,P0_candidate_scoring,ok,1410,12,和平与发展;时代主题;政治多极化;经济全球化;国际组织;两个市场;两种资源;综合国力;独立自主;和平共处五项原则,，共45分。 本部分共6题，共55分。 16．（11分） （1）可从生产技术、产品质量、消费方式、市场需求等角度回答。 （2）咖啡企业应客观看待“出海”的机遇与挑战，制定正确的经营战略，重视对海外市场的考察 || 定，为企业“出海”营造良好的国际环境。 17．（6分） 财政补贴、税收优惠等政策有助于降低瞪羚企业经营成本，增强企业的创新活力和投资积极性。融资支持政策有助于降低瞪羚企业融资成本，帮助企业解决资金问题，扩大 || 术水平和研发能力，不断培育竞争新优势。 18．（8分） “五民工作法”启示我们发展基层民主要坚持党的领导，发挥基层党组织的战斗堡垒作用；要依托基层群众自治组织，开展民主选举、民主协商、民主决策、民主管理、民 || 合力，积极打造多方参与的社会治理格局。 19．（7分） 中国共产党坚持解放思想、实事求是、与时俱进、求真务实，始终走在时代前列，针对新问题、新情况对条款进行修订。上述条款修订有助于规范党员行为，更好发挥党员 || 国，促进国家治理体系和治理能力现代化。 20．（8分） 建立粮食产销区省际横向利益补偿机制有助于增加主产区农民种粮收入，共享改革发展成果，逐步实现共同富裕；有助于调动农民种粮积极性，引导全社会更加重视粮食生 || 级，实现乡村振兴，促进经济高质量发展。 21．（15分） （1）小海的观点片面。新中国成立初期尚未完全建立夫妻共同财产制度，在家庭生活中男方经济地位更强，根据权利与义务相对应原则，由男方清偿具有合理性，有利,2025各区期末/2025海淀期中/细则/细则.docx,02_extraction/full_source_text_cache_20260503/SRC_cda046c2d36d_细则_docx.txt
2025海淀期末,yes,1,SRC_61b68f14212d,2025,海淀,期末,P0_candidate_scoring,ok,13190,9,人类命运共同体;中国智慧;中国方案;平衡,2、5、8 1-15 主观题题号 16、17（2） 19、20、21 17（1）、18 22 16-22 必修4 选择性必修2 选择性必修3 综合 合计 客观题分值 15 21 9 45 主观题 || 15 主观题题号 16、17（2） 19、20、21 17（1）、18 22 16-22 必修4 选择性必修2 选择性必修3 综合 合计 客观题分值 15 21 9 45 主观题分值 16 20 || 主观题题号 16、17（2） 19、20、21 17（1）、18 22 16-22 必修4 选择性必修2 选择性必修3 综合 合计 客观题分值 15 21 9 45 主观题分值 16 20 10 || IDE 8]] [[SLIDE 9]] 16.（8分）守正不守旧，尊古不复古。 作为中华文明的重要组成部分，中医药是我们观察中华文明的一个生动视角。 “药食同源”是中医药文化的重要理念。它主张食物与药物之间 || 迹难以辨认） [[SLIDE 14]] 17题（1） 分三层，注意前后逻辑要自洽 1.科学思维具有客观性（可检验性） 2分 2.规律（能量守恒定律）1分 3.针对客观性的材料分析：没有符合客观条件/违背客 || 社会意识的，总分不给0分，给1分原理分 18．（7分） 技术恐惧，指的是人们对新技术的不信任、焦虑、担忧甚至恐慌，从而产生排斥、拒 绝和抵制新技术的心理和行为。技术恐惧在人类历史上一直存在，并随着科技进步 || [SLIDE 31]] 2023海淀期末19（2）题 运用了发散思维的方法。发散思维是根据已知的事物信息，从不同的角度、不同的方向思考，以寻求解决问题的多样性答案的思维方式。《妇女权益保护法》修订过程中多次征求有 || SLIDE 32]] 2024年东城期末18（2）题 [[SLIDE 33]] 2025年顺义期末18题 [[SLIDE 34]] 可综合可单独用必修三和选必二 土地所有权、土地使用权和他项权利的确认、确定 多角,2025各区期末/2025海淀期末/细则/细则.pptx,02_extraction/full_source_text_cache_20260503/SRC_61b68f14212d_细则_pptx.txt
2025海淀二模,yes,1,SRC_5b0f1d77d036,2025,海淀,二模,P0_candidate_scoring,ok,2083,8,联合国,16题 1、在信息时代应该学习哪些东西？应该如何学习？是否还需要大量的记忆呢？这个题目难度较大，学生们驾驭起来难度大，考虑到高考的惯性还是放在了这里，22题形成了呼应 || 难度大，考虑到高考的惯性还是放在了这里，22题形成了呼应，16题反思如何学，22题思考在国内国际形势变化的背景下我作为青年人我应该过什么样的生活，应该从大背景下去定位。前面主要是从国家党角度，这套卷子重点是 || 的惯性还是放在了这里，22题形成了呼应，16题反思如何学，22题思考在国内国际形势变化的背景下我作为青年人我应该过什么样的生活，应该从大背景下去定位。前面主要是从国家党角度，这套卷子重点是关注个人，关注育人 || 里，22题形成了呼应，16题反思如何学，22题思考在国内国际形势变化的背景下我作为青年人我应该过什么样的生活，应该从大背景下去定位。前面主要是从国家党角度，这套卷子重点是关注个人，关注育人的角度。把前面学习 || 1分给了文化，写在原理或分析里都可以。 17题 代表法的修正，完善了联系的制度，一个是了联系群众的制度，一个是完善了联系国家机关的制度。 1、法律保障，法治基础、法治保障等都可以。 2、中间是2+2 3、总 || 以。 2、中间是2+2 3、总结。1分 18题 想考社会实践类的活动，之前考的是更多对于案情的研究和判断，这次呢我们想在这个基础上兼顾下诉讼程序，尤其是选必二的最后一单元专门讲到了，所以命制了这个提面。做成 || 一谈审判的价值，8的点变通放过来也可以 19题 结合总书记考察云南，主要是根据材料来的，答案也是根据材料来的。 是政府的经济职能、一个是科技创新研发 消费新场景，通过产业优化、供给侧优化能够营造新的消费场景 || 业优化、供给侧优化能够营造新的消费场景 20题考了辩证思维 主要在答案基础上做了几个调整，辩证否定显然是没有问题，虽然答案没做。或者学生也可以从辩证思维的特征角度也可以替代给分的。 一个是整体性、动态性，一,2025各区二模/2025海淀二模/细则/补充材料/2025年海淀二模评标实录.docx,02_extraction/full_source_text_cache_20260503/SRC_5b0f1d77d036_2025年海淀二模评标实录_docx.txt
2025海淀期末,yes,1,SRC_1bd40d845040,2025,海淀,期末,P3_candidate_paper,ok,9962,5,联合国;人类命运共同体;平衡,公约，提高社会治理法治化水平 第二部分 16. 阅读材料，完成问题。 守正不守旧，尊古不复古。 作为中华文明的重要组成部分，中医药是我们观察中华文明的一个生动视角。 “药食同源”是中医药文化的重要理念。它主张 || 识，谈谈我们是如何打造中医药新时尚的。 17. 阅读材料，完成问题。 在人们的想象中，永动机是可以不停地自动运动的机械装置。 下图是刊登在某杂志上的“永动机”设计图。一盆水，上面漂浮着一个架子。架子下方是一个 || 何要纪念为实现永动机奋斗而失败的人们。 18. 阅读材料，完成问题。 “一个充满活力和吸引力的图书天堂”——北京城市图书馆从多个国家的图书馆中脱颖而出，获得“2024年度公共图书馆奖”，这是中国首次荣获此项世 || 何运用创新思维建设新型公共文化空间的。 19. 阅读材料，完成问题。 我国农村大多数土地承包工作在改革开放初期便已完成。当时没有明确的法律依据和完善的登记制度，造成农村土地纠纷多、利用效率低，阻碍了农村经济发 || ，阐释实施农村土地确权登记的现实意义。 20. 阅读材料，完成问题。 最高人民法院围绕民法典实施过程中社会广泛关注、审判实践中亟需解决的重大争议问题，制定了《最高人民法院关于适用<中华人民共和国民法典>侵权责 || 《解释》部分条款。参考示例，完成下表。 21. 阅读材料，完成问题。 “竞业限制”是指用人单位与劳动者之间约定，劳动者在离职后不得到生产同类产品或经营同类产业且有竞争关系的其他用人单位任职，也不得自己生产与原 || 规定“竞业限制”并对其加以限制的原因。 22. 阅读材料，完成问题。 国家博物馆西大厅的巨型浮雕《愚公移山》以徐悲鸿1940年所作国画《愚公移山》为原本。“愚公移山”既指古代典籍中的“移山神话”，又指抗战期间 || 。 第二部分 本部分共7题，共55分。 16．（8分） 可从联系的观点、发展的观点、实现中华优秀传统文化创造性转化与创新性发展等角度作答。 17．（12分） （1）科学思维追求认识的客观性。科学思维总是从实,2025各区期末/2025海淀期末/试卷/试卷.docx,02_extraction/full_source_text_cache_20260503/SRC_1bd40d845040_试卷_docx.txt
2025海淀二模,yes,1,SRC_203635b75b25,2025,海淀,二模,P3_candidate_paper,empty_pdf_text_needs_visual,0,0,,,2025各区二模/2025海淀二模/试卷/试卷.pdf,02_extraction/full_source_text_cache_20260503/SRC_203635b75b25_试卷_pdf.txt
2025西城一模,no,2,SRC_062e7a5c776b,2025,西城,一模,P3_candidate_paper,ok,10024,25,共同利益;经济全球化;全球治理;联合国;中国智慧;中国方案;一带一路;全球南方;公共产品;普惠;平衡;共赢,人与人类选手同时出发，在同一路线上完成 21.0975 公里的比赛。下列选项中正确的是 A．人形机器人与人这两个概念是不相容的，二者是矛盾关系 B．人形机器人实际上是一定的社会关系的总和 C．人形机器 || D．③④ 第二部分 16．（7 分）“春日迟迟，卉木萋萋”，跟着《诗经》去研学。 【主题】诗三百·文化与自然之旅 【研学目标】 文化溯源：理解《诗经》中的自然、民俗、历史背景 学 || E 6]] 第6页/共10页 17．（7 分） 温榆河公园是京城最大的“绿肺”。 鲜为人知的是，公园中央有一片荒野。 这片荒野位于清河、温榆河在公园中 的交汇处，水流形态丰富，鱼多、昆虫多、水 || 榆生态心”建设中蕴含的科学思维。 18．（7 分）从“两条鱼循环”看增长新空间。 产自中国的鳗鱼“游”向世界，挪威三文鱼“飞”来中国，增长新空间在不断拓展。结合材料，运用 《经济与社会》所学，谈谈中 || 谈谈中国经济增长新空间是如何拓展的。 19．（8 分）高质量办理人大代表建议。 【提出】 十四届全国人大二次会议期间， 有人大代表提出了 《关于促进和规范自动驾驶的建议》 。该代表说， “近两年， || ，2024 年，挪威对华海产品出口 量达18.2万吨，同比增长14%。中国已 跃升为挪威海产出口的亚洲第一大市 场和全球范围内增长最快的市场。 [[PAGE 7]] 第7页/共10页  公安 || 发言人， 请你说明该案例的入选理由。 20．（8 分） 全国总工会、人力资源社会保障部、中国企业联合 会、全国工商联联合启动 2025 年度集体协商“集中要约 行动” ，指导工会与企业开展集体协商 、签 || 能促进社会公平与经济效率的平衡。 21．（8 分） 看到有外国人士说，许多全球南方国家代表团到中国城市乡村参观，想要借鉴中国发展经 验，中国新发展理念正成为广受欢迎的国际公共产品。一国的发展理念也可,2025各区一模/2025西城一模/试卷/试卷.pdf,02_extraction/full_source_text_cache_20260503/SRC_062e7a5c776b_试卷_pdf.txt
2025西城一模,no,2,SRC_6ea5462e02af,2025,西城,一模,P0_candidate_scoring,ok,4107,18,共同利益;经济全球化;人类命运共同体;中国智慧;中国方案;两个市场;两种资源;一带一路;对外开放;普惠;平衡;共赢,C 第二部分共 7 题，共 55 分。 16．（7分） 可从知行关系、继承弘扬中华优秀传统文化等角度作答。 答案示例： 《诗经》作为优秀古典诗词的代表作，承载着丰富的文化内涵，在行前准备环节，诵读《诗经》、 || 理不恰当，文化分析得当，给相应的分析分 17．（7分）可从追求认识的客观性、运用辩证思维方法、具有创新意识等角度作答。 如：角度1：追求认识的客观性 科学思维追求认识的客观性，要从实际出发、努力把握和 || 未深入分析得5分； 其他情况0~2分。 18．（7分）环境保护给产业发展带来新机遇，推动生态价值实现，促进生态优势转换为发展优势。地区利用资源优势，注重技术和品质，探索打造特色产业链，不断提高竞争力，成功开 || 级/消费结构优化升级/增收入/促就业/ 19．（8分）人大代表依法履职，关注国家创新发展，调研自动驾驶发展中的问题，积极推动自动驾驶领域法律法规的完善。国家机关认真听取人大代表意见和建议，自觉接受人民监督， || 的民主，1分 践行全过程人民民主，1分 20．（8分）劳动法的首要原则是保护劳动者权益，工会搭建协商平台，劳动者以集体力量与用人单位签订集体合同，可以确保双方协商一致，更加公平、平等自愿。更好地保护劳动者合 || 高/培育良好商誉/企业信誉形象 1分 21．（8分） （1）具有普遍价值的理念能够促进国际社会在共同关心的问题上达成共识，推动全球合作和发展。以人民为中心，创新、协调、绿色、开放、共享的新发展理念，指导着 || 三大倡议、人类命运共同体理念、进博会等 22.（10分） 可从党的领导、民族精神、理想信念、把握发展趋势等角度作答。 【细则】 长期主义能够科学把握事物发展趋势，坚持真理尊重规律，把眼前利益和长远利益相结合,2025各区一模/2025西城一模/细则/细则.docx,02_extraction/full_source_text_cache_20260503/SRC_6ea5462e02af_细则_docx.txt
