suite,covered_priority,district_priority,source_id,year_hint,district_hint,stage_hint,evidence_guess,extract_status,text_chars,hit_count,hit_terms,question_anchors,relative_path,cache_path
2024西城二模,no,2,SRC_ecba6fd5969d,2024,西城,二模,P0_candidate_scoring,ok,3528,15,国家利益;共同利益;和平与发展;世界多极化;经济全球化;全球治理;国际秩序;国际关系民主化;人类命运共同体;多边主义;真正的多边主义;国际竞争;平衡,C 第二部分共 4 题，共 55 分。 16．（8分） 经营者应依法、诚信经营，保护消费者的合法权益。（2分，多选一）人民法院支持市民甲就首单购买行为适用食品安全法中的惩罚性赔偿请求，以此打击违法生产经营行 || 营者诚信”）、弘扬了社会主义核心价值观 17.（9分） 可以从以下角度作答：人类社会发展的进程和趋势，生产力与生产关系，经济基础与上层建筑，马克思主义中国化时代化新的飞跃；经济高质量发展，创新发展；当前国际 || 建设人才支撑（二十大报告的标题“五”） 18．（33分） （1）（8分） 符合题意、言之成理即可。推理类型2分，相应的推理过程及方法6分。如写出多个推理、推理过程及方法，按得分最高的一项计分。 示例： ①归 || 盾特殊性，系统优化；产业融合；科学思维 19．（5分） 全人类是一个命运与共的大家庭，国与国之间利益交汇、命运交织、休戚与共。（1分，多选一）人类命运共同体理念超越了集团政治的“小圈子”规则，超越了实力至上,西城二模/细则/细则.docx,02_extraction/full_source_text_cache_20260503/SRC_ecba6fd5969d_细则_docx.txt
2024西城一模,no,2,SRC_359083f91cd3,2024,西城,一模,P3_candidate_paper,ok,6098,9,经济全球化;全球治理;全球治理体系;国际组织;人类命运共同体;一带一路,④ 第二部分 本部分共4题，共55分。 16．（7分） 2023年6月1日，新版《北京市未成年人保护条例》（以下简称《条例》）施行。《条例》将“最有利于未成年人”原则放在重要位置，在与《中华人民共和国未成年 || 明市人大是如何推进《条例》修订工作的。 17．（9分） 在中国，有这样一个城市公园，没有精心筛选的观赏植物，没有大片修剪整齐的绿地，也没有平整规矩的健身步道。园林设计师们从城市各个角落搜集了不同的土壤将公园 || 与自然的关系，应避免陷入人类中心主义。 18．（8分） 【基本案情】郭某与刘某是夫妻关系，刘某于2022年去世。二人育有子女四人，现郭某年已九十，由小女儿照顾，郭某起诉要求另外三子支付赡养费，其中郭某每月有 || 《督促履行义务告知书》的认识。（6分） 19．（31分） 未来产业由前沿技术驱动，是具有显著战略性、引领性、颠覆性和不确定性的前瞻性新兴产业，当前处于孕育萌发阶段或产业化初期。 2022年度全球未来产业发展,西城一模/试卷/试卷.docx,02_extraction/full_source_text_cache_20260503/SRC_359083f91cd3_试卷_docx.txt
2025西城二模,no,2,SRC_7e4a722d6d9e,2025,西城,二模,P0_candidate_scoring,ok,4219,9,经济全球化;正确义利观;普惠;平衡;共赢,B 第二部分共 5 题，共 55 分。 16．（14分） （1）（6分）可从尊重规律、正确发挥主观能动性、具体问题具体分析、树立正确的生态价值观等角度作答。 如：角度1：把发挥主观能动性与尊重客观规律相结合 || 展现良好的人文关怀与生态意识 1分 17．（13分） （1）（6分）价格信号是引导资源配置的重要方式，农产品、能源、公用事业、公共服务、公共数据等重要产品的价格，关系国计民生。在这些重点领域创新价格引导 || 协商、民主决策、民主监督中的主体作用。 18．（8分）小刘为限制民事行为能力人，其大额打赏行为，家长事先不知情、事后也不同意追认，交易行为无效。平台的审核措施不完善，未能尽到合理审查的义务，存在过错。小刘父 || 台…1分，规范引导监护人或未成年人…） 19．（10分） （1）（5分）机遇：世界国民财富总体增长，有利于经济发展和增进福祉。基础设施、工业和技术的增长，可以提高生产率和支持提高生活水平。人力资本的增长，劳 || 同推进现代化 （任意1点1分，共2分） 20.（10分）可从党的性质宗旨；满足文化需求、丰富文化供给、推动文化创新创造；社会历史主体；中国式现代化的实现等角度作答。 如： 党的角度：3分 如，中国共产党是具,2025各区二模/2025西城二模/细则/细则.docx,02_extraction/full_source_text_cache_20260503/SRC_7e4a722d6d9e_细则_docx.txt
2024西城一模,no,2,SRC_461b3fdcd830,2024,西城,一模,P0_candidate_scoring,ok,3055,8,经济全球化;两个市场;两种资源;国际竞争,C 第二部分共 6 题，共 55 分。 16．（7分） 市人大坚持社会主义法制统一和地方立法特色，（1分，二选一）以问题为导向，回应社会关切，坚持科学立法、民主立法，（2分，二选一）立良善之法，立管用之法； || 体地位；人大代表积极履行自己的职责等。 17．（9分） 可以从以下角度作答：生态价值观，构建人与自然生命共同体，人与自然和谐共生的现代化，实践与认识，客观规律与主观能动性，联系与发展，对立统一，否定之否定； || 么做角度如果未出“价值观”，则扣1分； 18．（8分） （1）依据诉讼法规定的回避制度，当书记员有下列情形之一的，当事人有权申请其回避：是本案当事人或者当事人、诉讼代理人近亲属的；与本案有利害关系的；与本案 || （1分）：以事实为根据，以法律为准绳。 19．（31分） （1）我国未来产业的六大领域发展较为均衡，量子信息、绿色能源、机器人、元宇宙和先进通信的产业优势突出，但在排名前6位的国家中，生物技术方面有差距。（,西城一模/细则/细则.docx,02_extraction/full_source_text_cache_20260503/SRC_461b3fdcd830_细则_docx.txt
2024西城二模,no,2,SRC_3cb2df235603,2024,西城,二模,P0_candidate_scoring,ok,1913,7,国家利益;世界多极化;经济全球化;国际秩序;人类命运共同体;国际竞争;平衡,C 第二部分共 4 题，共 55 分。 16. （8分） 经营者应依法、诚信经营，保护消费者的合法权益。人民法院支持市民甲就首单购买行为适用食品安全法中的惩罚性赔偿请求，以此打击违法生产经营行为，维护了消费者 || ，有利于服务和保障经济社会高质量发展。 17．（9分） 可以从以下角度作答：人类社会发展的进程和趋势，生产力与生产关系，经济基础与上层建筑，马克思主义中国化时代化新的飞跃；经济高质量发展，创新发展；当前国际 || 推动者，世界多极化，经济全球化；等等。 18．（33分） （1）（8分） 符合题意、言之成理即可。推理类型2分，相应的推理过程及方法6分。如写出多个推理、推理过程及方法，按得分最高的一项计分。 示例：①归纳 || 层群众自治；创新思维，辩证思维；等等。 19．（5分） 全人类是一个命运与共的大家庭，国与国之间利益交汇、命运交织、休戚与共。人类命运共同体理念超越了集团政治的“小圈子”规则，超越了实力至上的逻辑，超越了少,西城二模/细则/补充材料/高三模拟测试思想政治答案.docx,02_extraction/full_source_text_cache_20260503/SRC_3cb2df235603_高三模拟测试思想政治答案_docx.txt
2026西城一模,no,2,SRC_5447227f6175,2026,西城,一模,P3_candidate_paper,ok,6188,5,公共产品;普惠;平衡,局 第二部分 本部分共6题，共55分。 16．（7分） 阅读，涵养文明、传承文脉。对于国家发展而言，国民的创新能力和文化素养，是一项为未来“蓄水”的战略投资。 我国首部针对全民阅读的行政法规《全民阅读促进条 || 综合运用所学，谈谈你对这一问题的认识。 17．（8分）良好生态环境是最公平的公共产品，是最普惠的民生福祉。 【民法典物权编】 第286条： 业主应当遵守法律、法规以及管理规约，相关行为应当 || 物权编的上述规定如何推动国家绿色发展。 18．（7分）2026年中央财政专门安排1000亿元专项资金，推出一揽子政策，稳定经济运行。 【政策要点】 贷款贴息：对中小微企业贷款给予财政贴息，单户贷款最高贴息1 || 解释该一揽子政策对稳定经济运行的作用。 19．（12分）推进美丽乡村建设、完善乡村公共服务。 材料一 某村规划建设集休闲健身、生态绿化、文化展示于一体的文化生态公园，却在推进中却遭遇一连串难题： 乡镇政府 || 这件事，说明这件事不涉及村民切身利益。 20．（11分）中国与东盟自贸区合作迈入新阶段。 材料一 （1）概括材料一反映的经济信息。（3分） 材料二 中国与东盟共同签署自贸区 3.0 || 展和世界经济注入强劲动力的。（8分） 21．（10分）推进中国式现代化是一项探索性事业。 中国式现代化是对西方式现代化的超越，是党领导人民长期探索和实践出来的。只有持续探索，才能让中国式现代化道路越走越宽,2026各区一模/2026西城一模/试卷/试卷.docx,02_extraction/full_source_text_cache_20260503/SRC_5447227f6175_试卷_docx.txt
2026西城一模,no,2,SRC_e28c940953ba,2026,西城,一模,P0_candidate_scoring,ok,2594,4,共同利益;多边主义;平衡;共赢,高三政治一模主观题阅卷细则 26.4 16.有人说，阅读是私事，多凭个人兴趣，为什么还需要国家立一部法呢？综合运用所学，谈谈你对这一问题的认识。（7分） 【细则】 ●回应任务，表明全民阅读不仅仅是个人私事 || 读权利/满足人民美好生活需要 1分 17.结合材料，运用法律相关知识，说明民法典物权编的上述规定如何推动国家绿色发展。（8分） 【细则】 ●法律依据（2分） 贯彻落实民法绿色原则 1分 为绿色发展提供 || 可持续发展/节约资源保护环境 1分 18.运用《经济与社会》知识，解释该一揽子政策对稳定经济运行的作用。(7分) 【细则】 ●直接作用（5分） 降低中小微企业融资成本/减轻企业贷款压力 1分 分担信贷 || 理体系改革 1分 ●联系材料（1分） 21.结合材料，综合运用所学，分析为什么“中国式现代化处于关键时期，更要坚持探索”。（10分） 【细则】 本题属于观点论证，要求学生阐释“为什么”，适宜从“必要性+重,2026各区一模/2026西城一模/细则/细则.docx,02_extraction/full_source_text_cache_20260503/SRC_e28c940953ba_细则_docx.txt
2024西城二模,no,2,SRC_f9754eb81c9b,2024,西城,二模,P3_candidate_paper,ok,5911,3,国际秩序;人类命运共同体;对外开放,象 第二部分 本部分共4题，共55分。 16．（8分） 市民甲在某食品科技有限公司开设的网店中购买了30盒“黄芪薏米饼干”，付款516元。签收后，甲发现这些饼干不符合食品安全标准，随后又在两个月内三次购买同 || 款饼干，加购数量共计200盒，总重量高达18.4千克。综合考量案涉饼干的保质期、普通消费者通常的生活消费习惯等因素，甲的加购行为超出正常的生活消费所需，对其就加购饼干提出的惩罚性赔偿请求不应支持，故判决支持 || 生活》的知识，分析人民法院判决的意义。 17．（9分） 北京聚力建设国际科技创新中心；安徽加快建设量子信息、聚变能源、深空探测三大科创高地；黑龙江实施制造业数字化转型、中小企业数字化赋能、智能制造试点示范行 || 世界上最大的发展中国家应当扮演的角色。 18．（33分）推进乡村全面振兴，加快农业农村现代化建设。 【盐碱地有望变良田】 我国盐碱地面积达1亿公顷，占世界盐碱地总面积的近1/10。我国研究人员以耐盐碱作物高 || 学，阐释如何推动乡村文化振兴。（9分） 19．（5分） 一些国家奉行实力至上的逻辑，恃强凌弱、巧取豪夺、零和博弈大行其道，发展鸿沟加剧，安全赤字加重，结盟对抗、封闭排他的做法与多极化的发展方向背道而驰。随着,西城二模/试卷/试卷.docx,02_extraction/full_source_text_cache_20260503/SRC_f9754eb81c9b_试卷_docx.txt
2025西城二模,no,2,SRC_62207119d52d,2025,西城,二模,P3_candidate_paper,ok,9868,3,平衡;共赢,D．③④ 第二部分 16.（14 分） 京郊的鹿叫村遗址，生物资源丰富，是各种野生动植物的栖息地。 上世纪 80 年代，因为取水问题鹿叫村整体搬迁，村落遗址内保留着较 多废弃水井和地 || 诉求提出解决办法。（4 分） 17.（13 分） 价格治理是宏观经济治理的重要内容。为进一步深化价格改革，完善价格治理机制，中共中央办公厅、 国务院办公厅发布《关于完善价格治理机制的意见》 。 || 知识， 阐述你的看法。 （7 分） 18.（8 分） 17 岁的小刘背着家长、绕过平台监管打赏多名网络主播，金额高达 45 万余元。 家长：我们发现之后，先跟主播沟通，有几位主播退了一部分钱，总计5 || 识，分析人民法院的判决结果。 19.（10 分） 为了更好地跟踪监测经济进步的可持续性和衡量国家财富，世界银行推出了《国民财富变化》系列报 告，从多个方面综合衡量国民财富。《2024 国民财富变 || 这一做法中的中国担当。（5 分） 20.（10 分）建设文化强国，事关中国式现代化全局。 中国共产党是具有高度文化自觉的马克思主义政党，历来重视文化建设。早在 1940 年，毛泽东同志就 在《新民主 || 第二部分共 5 题，共 55 分。 16．（14分） （1）（6分）可从尊重规律、正确发挥主观能动性、 具体问题具体分析、树立正确的生态价值观 等角度 作答。 （2）（4分）无法确定一定有岩松鼠 || 、建立新的具 体联系，分析解决矛盾） 17．（13分） （1）（6分）价格信号是引导资源配置的重要方式， 农产品、能源、公用事业、公共服务、公共数据等 重要产品的价格，关系国计民生。 在这些重点领域 创 || 系、民主集中制、各方参与等角度作答。 18．（8分）小刘为限制民事行为能力人，其大额打赏行为，家长事先不知情、事后也不同意追认，交易行为 无效。平台的审核措施不完善，未能尽到合理审查的义务，存在过错。小刘,2025各区二模/2025西城二模/试卷/试卷.pdf,02_extraction/full_source_text_cache_20260503/SRC_62207119d52d_试卷_pdf.txt
2025西城期末,no,2,SRC_f548fe634936,2025,西城,期末,P0_candidate_scoring,ok,4203,3,国际组织;两个市场,B 二、非选择题（共 55 分） 16.（11分） （1）文物建筑承载着特定的历史记忆。通过活化利用，可以传承弘扬中华优秀传统 文化、增强文化认同，实现中华优秀传统文化的创造性转化和创新性发展，激 || 分参考 第2页（共5页） 17.（10分） （1）资源的循环利用关系国家的绿色发展和美丽中国建设。组建中国资环集团，可 以整合和优化国有经济布局，发挥国有企业支柱作用，提高资源循环利用水 平 || 规则 18. （7 分） 可从新事物的特点、认识的局限性、承认矛盾、科技要以人为本等角度回答。 等级水平 等 级 描 述 水平 4 （6~7 分） 观点鲜明， || 总分不给0 分，给 1 分原理分 19. （8 分） 根据反不正当竞争法，陈某在明知他人已经使用“小爱同学”唤醒词并有一定影响的 情况下，抢先注册，并发布引人误解的商业宣传信息，构成混淆及虚假宣传，属 || 发展/创新/，维护市场秩序/营商环境 20. （9 分） （1）其他主要经济体（德日）的市场份额有所下降，中国汽车产业出口竞争力提升，尤其 电动载人汽车具有较大优势。 （2）充分运用国际规则，利用国际组 || 阐述和说明，总体给3 分+1 分 21. （10 分） 可从在改革中完善法治、在法治下推进改革、坚持党的领导等角度回答。 等级水平 等 级 描 述 水平 4 （8~10 观点鲜明，能明确表,2025各区期末/2025西城期末/细则/细则.pdf,02_extraction/full_source_text_cache_20260503/SRC_f548fe634936_细则_pdf.txt
2024西城一模,no,2,SRC_ae7373932e0b,2024,西城,一模,P0_candidate_scoring,ok,1655,2,国际竞争,C 第二部分共 4 题，共 55 分。 16．（7分） 市人大坚持社会主义法制统一和地方立法特色，以问题为导向，回应社会关切，坚持科学立法、民主立法，立良善之法，立管用之法；践行全过程人民民主，广泛听取各方 || 议，保障公民的知情权、参与权和表达权。 17．（9分） 可以从以下角度作答：生态价值观，构建人与自然生命共同体，人与自然和谐共生的现代化；实践与认识，客观规律与主观能动性，联系与发展，对立统一，否定之否定； || 系与发展，对立统一，否定之否定；等等。 18．（8分） （1）（1分） 依据诉讼法规定的回避制度，当书记员有下列情形之一的，当事人有权申请其回避：是本案当事人或者当事人、诉讼代理人近亲属的；与本案有利害关系 || 价值观，发挥法律对道德建设的促进作用。 19．（31分） （1）（3分） 我国未来产业的六大领域发展较为均衡，量子信息、绿色能源、机器人、元宇宙和先进通信的产业优势突出，但在排名前6位的国家中，生物技术方面,西城一模/细则/补充材料/2024.4高三统一测试思想政治答案.docx,02_extraction/full_source_text_cache_20260503/SRC_ae7373932e0b_2024_4高三统一测试思想政治答案_docx.txt
2025西城期末,no,2,SRC_3b9cf3beca8e,2025,西城,期末,P3_candidate_paper,ok,8334,1,国际组织,定项目中标 单位后进行公示 ② ③ 17．（10 分） 资料包  当前，全国大宗固体废弃物综合利用率约为 59%，废钢铁、废有色金属等 10 种主要再生资源利用量每 年都在大幅增长，废钢铁每年利用 || 规则的三段论。（4 分） 18．（7 分） 技术恐惧，指的是人们对新技术的不信任、焦虑、担忧甚至恐慌，从而产生排斥、拒绝和抵制新技术 的心理和行为。技术恐惧在人类历史上一直存在，并随着科技进 || 明，该如何看待技术恐惧？ 19．（8 分） 【案情回放】 “小爱同学，今天天气怎么样？”“小爱同学，讲个故事”……随着M 公司2017 年7 月推出的“小爱 同学”智能语音设备后，“小爱同 || E 7]] 第7页/共10页 20．（9 分）读图，回答问题： （1）读图 1 和图 2，说明全球汽车产业链出口的竞争格局所发生的变化。 （3 分） （2）欧盟是中国整车出口的第一 || 国汽车企业该如何应对？（6 分） 21．（10 分）坚持改革和法治相统一，是我们党治国理政的重要方法。 党的十八大以来，以习近平同志为核心的党中央突出制度建设这条主线，通过改革和 法治的相互促动， || B 二、非选择题（共 55 分） 16.（11 分） （1）文物建筑承载着特定的历史记忆。通过活化利用，可以传承弘扬中华优秀传统文 化、增强文化认同， 实现中华优秀传统文化的创造性转化和创新性发展， || 监督，保障人民群众的知情权（2 分） 17.（10 分） （1）资源的循环利用关系国家的绿色发展和美丽中国建设。组建中国资环集团，可以 整合和优化国有经 济布局，发挥国有企业支柱作 用，提高资源循环利用 || 源 工业固废可以转化为有价值的产品 18.（7 分） 可从新事物的特点、认识的局限性、承认矛盾、科技要以人为本等角度回答。 等级水平 等级描述 水平 4（6~7 分） 观点鲜明，能明确表达自己的,2025各区期末/2025西城期末/试卷/试卷.pdf,02_extraction/full_source_text_cache_20260503/SRC_3b9cf3beca8e_试卷_pdf.txt
2024西城二模,no,2,SRC_abdf5a2c1aeb,2024,西城/东城,二模,P2_candidate_teaching_or_lecture,ok,431,0,,,西城二模/其他材料/西城东城二模选择题讲评.pdf,02_extraction/full_source_text_cache_20260503/SRC_abdf5a2c1aeb_西城东城二模选择题讲评_pdf.txt
2024西城二模,no,2,SRC_bd22f6c39c9e,2024,西城/东城,二模,P2_candidate_teaching_or_lecture,ok,579,0,,,西城二模/其他材料/西城东城二模选择题讲评.pptx,02_extraction/full_source_text_cache_20260503/SRC_bd22f6c39c9e_西城东城二模选择题讲评_pptx.txt
2026西城一模,no,2,SRC_4ff3bc2e680a,2026,西城,一模,P3_candidate_paper,empty_pdf_text_needs_visual,0,0,,,2026各区一模/2026西城一模/试卷/补充材料/2026北京西城高三一模政治.pdf,02_extraction/full_source_text_cache_20260503/SRC_4ff3bc2e680a_2026北京西城高三一模政治_pdf.txt
2026西城期末,yes,2,SRC_751bc9aaa01f,2026,西城,期中/期末,P0_candidate_scoring,ok,2922,3,中国方案;平衡;共赢,2．C 13．D 14．C 15．A 16．（1）①立足社会实践，筑牢文化自信的根基。纪录片立足时代发展与社会变迁，记录 人民群众的日常实践，挖掘中华优秀传统文化中的精神内核与当代价值，让文 化自信建立在 || 参考答案（第 2 页 共 3 页） 17．法院判决 B 公司构成不正当竞争并赔偿损失是正确的，因为 B 公司的行为违反了《中华 人民共和国反不正当竞争法》和《中华人民共和国未成年人保护法》的相关规定，损 || 场竞争秩序 和未成年人合法权益。 18．①邀请人大代表、政协委员、人民监督员、专家学者等多方参与案件磋商、听证及 “回 头看”，广泛听取各方意见建议，既保障了人民群众的知情权、参与权和监督权，又 践行 || 公益诉讼治理更具科学性和认可度。 19．（1）坚持以人民为中心的发展思想，贯彻实施共享发展理念，以“投资于人”增强内 需动力。通过教育、培训等提高劳动者素质，增强消费能力和就业质量，为产业 升级提供人 || 参考答案（第 3 页 共 3 页） 20．①主动担当全球气候治理责任 :中国严格落实 《巴黎协定》要求，每五年提交国家自主 贡献（NDC）目标，从 2015 年、2020 年到 2025 年提交《中国 || 发展非化石能源，非化石能源消 费占比达 19.8%，电、太阳能发电总装机容量提前完成 2030 年目标；在森林碳汇领 域，森林蓄积量超 200 亿立方米，提前完成 2030 年目标；在绿色交通领域，新能源汽 || 应对 气候变化提供了系统性方案。 21．①五年规划是中国共产党治国理政的重要经验，也是中国特色社会主义的重要政治优势。 五年规划体现了党对国家发展的全面领导，在党中央集中统一领导下，提出规划建议、 国,2026各区期末和期中/2026西城期末/细则/补充材料/高三思想政治参考答案.pdf,02_extraction/full_source_text_cache_20260503/SRC_751bc9aaa01f_高三思想政治参考答案_pdf.txt
2026西城期末,yes,2,SRC_060b7ec32fe4,2026,西城,期中/期末,P0_candidate_scoring,ok,943,2,两种资源;对外开放,与试题无关；或重复试题内容；或没有应答 16.（2）可从追求真理、正确对待矛盾、群众观点、正确价值观等角度作答。（6分） [[SLIDE 3]] [[SLIDE 4]] [[SLIDE 5]] [[SLID || E 11]] [[SLIDE 12]] 21.（10分） 可从坚持党的领导、全过程人民民主、实事求是、发展的观点等角度作答。,2026各区期末和期中/2026西城期末/细则/补充材料/西城高三期末评标.pptx,02_extraction/full_source_text_cache_20260503/SRC_060b7ec32fe4_西城高三期末评标_pptx.txt
2026西城期末,yes,2,SRC_0eccc84583b5,2026,西城,期中/期末,P0_candidate_scoring,empty_pdf_text_needs_visual,0,0,,,2026各区期末和期中/2026西城期末/细则/细则.pdf,02_extraction/full_source_text_cache_20260503/SRC_0eccc84583b5_细则_pdf.txt
